hospital_id,hospital_name,address,district_id,pincode,latitude,longitude,mco_contact_number,total_beds,hospital_type
21203,"Hitech Medical College, Rourkela","Rourkela, Sundargarh, Odisha, 769001",410.0,769001.0,22.0605153,83.9359154,0,,
21204,Aruna Shakti Nursing Homeand Hospital,"Laxmi Narayan Lane, Sambalpur, Odisha, 768001",408.0,768001.0,21.5570606,84.1528515,0,,
21205,Arunashakti Hospital,"Near Bus Stand, Sambalpur, Odisha, 768001",408.0,768001.0,21.5570606,84.1528515,0,,
21206,Hari Om Health Home,"Brook Shill, Sakhipara, Sambalpur, Odisha, 768001",408.0,768001.0,21.5570606,84.1528515,0,,
21207,J.M.J. Hospital,"Baraipali, Sambalpur, Odisha, 768001",408.0,768001.0,21.5570606,84.1528515,0,,
21208,Samarpan Children Hospital,"Near Li-N-Ja Hotel, Sakhipara, Sambalpur, Odisha, 768001",408.0,768001.0,21.5570606,84.1528515,0,,
21209,Seva Nursing Home,"At.Sakhipara, P.O., Sakhipara, Birsamunda Marg, Sambalpur, Odisha, 768001",408.0,768001.0,21.5570606,84.1528515,0,,
21210,Healing Touches Hospital,"Farm Road, Sambalpur, Odisha, 768002",408.0,768002.0,21.5570606,84.1528515,0,,
21211,Janani Maternity Nursing Home,"Modipara, Sambalpur, Odisha, 768002",408.0,768002.0,21.5570606,84.1528515,0,,
21212,K D Jalan Hospital,"Ketrajpur , Near Balaji Mandir, Sambalpur, Odisha, 768002",408.0,768002.0,21.5570606,84.1528515,0,,
21213,Sanjivani Family Hospital,"Farm Road, Modi Pada, Sambalpur, Odisha, 768002",408.0,768002.0,21.5570606,84.1528515,0,,
21214,Sanjivani Family Hospital,"Farm Road Farm Road, Sambalpur, Odisha, 768002",408.0,768002.0,21.5570606,84.1528515,0,,
21215,Sparsh Nursing Home,"Near Pani Tanki, Modipara, Sambalpur, Odisha, 768002",408.0,768002.0,21.5570606,84.1528515,0,,
21216,Sumitra Nursing Home,"Khetrajpur, Sambalpur, Odisha, 768003",408.0,768003.0,21.5570606,84.1528515,0,,
21217,Ashirwad Nursing Home,"Government Hospital Road,In Front Of Government Hospital, Sambalpur, Odisha, 768004",408.0,768004.0,21.5570606,84.1528515,0,,
21218,Astha Nursing Home,"Budharaja Road, Ainthapali, Sambalpur, Odisha, 768004",408.0,768004.0,21.5570606,84.1528515,0,,
21219,District  Head Quaters Hospital,"Sambalpur, Sambalpur, Odisha, 768004",408.0,768004.0,21.5570606,84.1528515,0,,
21220,J M J Hospital,"N.H  6 Ainthapalli, Sambalpur, Odisha, 768004",408.0,768004.0,21.5570606,84.1528515,0,,
21221,Jyoti Hospital,"Budharaja, Sambalpur, Odisha, 768004",408.0,768004.0,21.5570606,84.1528515,0,,
21222,Lochan Eye Clinic,"Ainthapali, Sambalpur, Odisha, 768004",408.0,768004.0,21.5570606,84.1528515,0,,
21223,New Life Nursing Home,"Srit Colony , Budharaja, Sambalpur, Odisha, 768004",408.0,768004.0,21.5570606,84.1528515,0,,
21224,Srusti Maternity and Nursing Home,"Budharaja, Sambalpur, Odisha, 768004",408.0,768004.0,21.5570606,84.1528515,0,,
21225,Trilochan Netralaya( A Unit Of Vision India Foundation),"At Fatak, Sbi Budharaja Branch Campus, Sambalpur, Odisha, 768004",408.0,768004.0,21.5570606,84.1528515,0,,
21226,Chakshyusyam,"Friends Colony, Phandi Chowk, Burla, Sambalpur, Odisha, 768017",408.0,768017.0,21.5570606,84.1528515,0,,
21227,Gupta Nursing Home,"Indira Chowk, Near Daily Market Burla, Sambalpur, Odisha, 768017",408.0,768017.0,21.5570606,84.1528515,0,,
21228,Patel Nursing Home,"Junhadihi,Sambalpur Road,Balangir, Sambalpur, Odisha, 768017",408.0,768017.0,21.5570606,84.1528515,0,,
21229,Sambaleswari Nursing Home,"Near Nac Collage (Pathanbandh)Ganesh Nagar ,Burla, Sambalpur, Odisha, 768017",408.0,768017.0,21.5570606,84.1528515,0,,
21230,V.S.S. Medical College Burla,"P.O. Burla, Sambalpur, Odisha, 768017",408.0,768017.0,21.5570606,84.1528515,0,,
21231,Samaleshwari Nursing Home,"Plot13 In Unit 12 Ward, Baraipali, Sambalpur, Odisha, 768018",408.0,768018.0,21.5570606,84.1528515,0,,
21232,Gourishankar Nursing Home,"Basant Vihar, Burla, Sambalpur, Odisha, 768019",408.0,768019.0,21.5570606,84.1528515,0,,
21233,Dr R K Sahoo Clinic,"Rairalchol, Sambalpur, Odisha, 768105",408.0,768105.0,21.5570606,84.1528515,0,,
21234,Gountia Medical Complex,"Kuchinda, Near Jhulenpool, Sambalpur, Odisha, 768222",408.0,768222.0,21.5570606,84.1528515,0,,
21235,Chc Biramaharajpur,"Birmaharajpur, Subarnapur, Sonepur, Odisha, 767018",428.0,767018.0,25.7094769,85.1355218,0,,
21236,Lipra Mahanadi Eye Hospital,"Pandapalli, Biramaharajpur, Sonepur, Odisha, 767018",428.0,767018.0,25.7094769,85.1355218,0,,
21237,Chc Binika,"Binka, Subarnapur, Sonepur, Odisha, 767019",428.0,767019.0,25.7094769,85.1355218,0,,
21238,Chc Dunguripali,"Dunguripali, Subarnapur, Sonepur, Odisha, 767023",428.0,767023.0,25.7094769,85.1355218,0,,
21239,Chc Ulunda,"Ullunda, Subarnapur, Sonepur, Odisha, 767062",428.0,767062.0,25.7094769,85.1355218,0,,
21240,Meher Hospital,"Udit Nagar,Main Road,Rourkela, Sundargarh, Odisha, 769001",410.0,769001.0,22.0605153,83.9359154,0,,
21241,City Hospital,"D/8, Civil Township, Rourkela, Sundargarh, Odisha, 769004",410.0,769004.0,22.0605153,83.9359154,0,,
21242,Khosla Nursing Home,"H-15, Civil Town Ship, Sundargarh, Odisha, 769004",410.0,769004.0,22.0605153,83.9359154,0,,
21243,Lifeline Hospital,"D/10,Civil Township,Rourkela, Sundargarh, Odisha, 769004",410.0,769004.0,22.0605153,83.9359154,0,,
21244,Om Appolo Hospital,"Uu-10 Civil Township, Rourkela, Sundargarh, Odisha, 769004",410.0,769004.0,22.0605153,83.9359154,0,,
21245,Panposh Sdh,"At/Po -Panposh Rourkela, Sundargarh, Sundargarh, Odisha, 769004",410.0,769004.0,22.0605153,83.9359154,0,,
21246,Rourkela Life Line Hospital Pvt Ltd,"D/10, Civil Township Civil Township Rourkela, Sundargarh, Odisha, 769004",410.0,769004.0,22.0605153,83.9359154,0,,
21247,Super Speciality Hospital,"N 18, Civil Township, Sundargarh, Odisha, 769004",410.0,769004.0,22.0605153,83.9359154,0,,
21248,Vesaj Patel Hospital,"H-4, Civil Township, Sundargarh, Odisha, 769004",410.0,769004.0,22.0605153,83.9359154,0,,
21249,Ambica Birsa Munda Hospital and Infertility Research Center,"D - 4/10, Civil Township, Sundargarh, Odisha, 769012",410.0,769012.0,22.0605153,83.9359154,0,,
21250,Goodwill Hospital,"Super Market Complex, Udit Nagar, Sundargarh, Odisha, 769012",410.0,769012.0,22.0605153,83.9359154,0,,
21251,Karunamia Nursing Home,"Birmitrapur,Rourkela, Sundargarh, Odisha, 769012",410.0,769012.0,22.0605153,83.9359154,0,,
21252,Rajasthan Seva Sadan.,"Em Block, Basanti Colony, Sundargarh, Odisha, 769012",410.0,769012.0,22.0605153,83.9359154,0,,
21253,Shanti Memorial Hospital,"Nr Ambedkar Chowk, Udit Nagar Rourkela, Sundargarh, Odisha, 769012",410.0,769012.0,22.0605153,83.9359154,0,,
21254,Community Welfare Society Hospital,"Jagda,Near Nit, Sundargarh, Odisha, 769042",410.0,769042.0,22.0605153,83.9359154,0,,
21255,Purnima Nursing Home,"Main Road Jhirpani, Sundargarh, Odisha, 769042",410.0,769042.0,22.0605153,83.9359154,0,,
21256,Bargaon Chc,"Bargoan, Sundargarh, Odisha, 770016",410.0,770016.0,22.0605153,83.9359154,0,,
21257,Shanti Seva Sadan,"Main Road Near : Aurobindo School, Sundargarh, Odisha, 770017",410.0,770017.0,22.0605153,83.9359154,0,,
21258,Karunamai Nursing Home,"Main Road, Birmitrapur, Sundargarh, Odisha, 770033",410.0,770033.0,22.0605153,83.9359154,0,,
21259,Bisra Chc,"Bisra, Sundargarh, Odisha, 770036",410.0,770036.0,22.0605153,83.9359154,0,,
