hospital_id,hospital_name,address,district_id,pincode,latitude,longitude,mco_contact_number,total_beds,hospital_type
30884,May Fair Hospital,"No 34/1 A, Bt Road, Phool Bagan, Kolkata, West Bengal, 700002",378.0,700002.0,22.5726459,88.3638953,0,,
30885,New Saraju Nursing Home,"No 46/1, Gbt Road, Kolkata, West Bengal, 700002",378.0,700002.0,22.5726459,88.3638953,0,,
30886,Eskag Sanjeevani,"P-48, Khirod Vidya Vinod Avenue, Kolkata, West Bengal, 700003",378.0,700003.0,22.5726459,88.3638953,0,,
30887,Irimed Clinics License Astha Medical Services,"P-48, Khirod Vidya Vinod Avenue (Girish Avenue), Kolkata, West Bengal, 700003",378.0,700003.0,22.5726459,88.3638953,0,,
30888,Sanjeevani Hospital,"P-48 Kshirod Vidyavinod Avenue Baghbazar Landmark Grish Mancha, Kolkata, West Bengal, 700003",378.0,700003.0,22.5726459,88.3638953,0,,
30889,Zenith Point Nursing Home,"32A, Ramkanta Boss Street, Kolkata, West Bengal, 700003",378.0,700003.0,22.5726459,88.3638953,0,,
30890,Deeamland Nursing Home (Only Kolkata Police),"2, Nayratna Lane, Kolkata, West Bengal, 700004",378.0,700004.0,22.5726459,88.3638953,0,,
30891,Dreamland Nursing Home,"#2, Nayratna Lane,Near Shyambazar Fire Point, Kolkata, West Bengal, 700004",378.0,700004.0,22.5726459,88.3638953,0,,
30892,Five Point Micro Surgery Centre Pvt Ltd,"227, Acharya Praffula Chandra Road , ( Near Shyambazar Cesc Building ), Kolkata, West Bengal, 700004",378.0,700004.0,22.5726459,88.3638953,0,,
30893,Lb Nursing Home,"204,A, Apc Road, Kolkata, West Bengal, 700004",378.0,700004.0,22.5726459,88.3638953,0,,
30894,Nabajiban Hospital Pvt Ltd,"5, Shibdas Bhaduri Street, Shyambazar, Kolkata, West Bengal, 700004",378.0,700004.0,22.5726459,88.3638953,0,,
30895,New Nirnoy Nursing Home,"2A, Kalachand Sanyal Lane, Kolkata, West Bengal, 700004",378.0,700004.0,22.5726459,88.3638953,0,,
30896,North Calcutta Nursing Home,"224A, Acharya Prafulla Chandra Road, Kolkata, West Bengal, 700004",378.0,700004.0,22.5726459,88.3638953,0,,
30897,Serum Sristi Nursing Home,"#136/1, Bidhan Sarani, Kolkata, West Bengal, 700004",378.0,700004.0,22.5726459,88.3638953,0,,
30898,Sterling Hospital,"55/1, Bhupen Bose Avenue, Kolkata, West Bengal, 700004",378.0,700004.0,22.5726459,88.3638953,0,,
30899,Welland Nursing Home Pvt Ltd,"140, Bidhan Sarani, Kolkata, West Bengal, 700004",378.0,700004.0,22.5726459,88.3638953,0,,
30900,Ashirvad Nursing Home,"44B, Vivekananda Road, Hatkhola, Kolkata, West Bengal, 700005",378.0,700005.0,22.5726459,88.3638953,0,,
30901,Guru Tegh Bahadur Medical Service Center,"11, Debendra Lal Khan Road, Kolkata, West Bengal, 700006",378.0,700006.0,22.5726459,88.3638953,0,,
30902,Jitendra Narayan Ray Sishu Seva Bhawan,"58/1S, Raja Dinendra Street, Kolkata, West Bengal, 700006",378.0,700006.0,22.5726459,88.3638953,0,,
30903,North Land Nursing Home,"133, Bidhansarani, Kolkata, West Bengal, 700006",378.0,700006.0,22.5726459,88.3638953,0,,
30904,North View Nursing Home,"#247/2C, A.P.C. Road,Beadon Street, Kolkata, West Bengal, 700006",378.0,700006.0,22.5726459,88.3638953,0,,
30905,Recovery Nursing Home P Ltd,"15/1 Jatindra Mohan Avenue, Kolkata, West Bengal, 700006",378.0,700006.0,22.5726459,88.3638953,0,,
30906,Sevalaya,"4, Abhoy Guha Road, Kolkata, West Bengal, 700006",378.0,700006.0,22.5726459,88.3638953,0,,
30907,Shakambari Nursing Home,"20, Jatindra Mohan Avenue, Kolkata, West Bengal, 700006",378.0,700006.0,22.5726459,88.3638953,0,,
30908,The Leprosy Mission Permananda Memorial Leprosy Ho,"259-A, Acharya Prafulla Chandra Road, Maniktala, Kolkata, West Bengal, 700006",378.0,700006.0,22.5726459,88.3638953,0,,
30909,Asharam Bhiwaniwalla Hospital,"55, Kalikrishna Tagore Street, Kolkata, West Bengal, 700007",378.0,700007.0,22.5726459,88.3638953,0,,
30910,Aurobindo Netralaya,"4A, Rajendra Deb Road, Kolkata, West Bengal, 700007",378.0,700007.0,22.5726459,88.3638953,0,,
30911,Jeevan Jyoti Nursing Home,"12, Pratap Ghosh Lane, Jorasanko, Kolkata, West Bengal, 700007",378.0,700007.0,22.5726459,88.3638953,0,,
30912,Marwari Relief Soceity Hospital,"225/227, Rabindra Sarani, Kolkata, West Bengal, 700007",378.0,700007.0,22.5726459,88.3638953,0,,
30913,Matri Mangal Pratishthan,"228, Rabindra Sarani, Burrabazar, Kolkata, West Bengal, 700007",378.0,700007.0,22.5726459,88.3638953,0,,
30914,Shree Vishudhanand Hospital and Research Institute,"35 & 37, Burtolla Street, M G Road, Kolkata, West Bengal, 700007",378.0,700007.0,22.5726459,88.3638953,0,,
30915,Aparna Nursing Home,"161/2, P K Guha Road, Dumdum, P K Guha Road, Kolkata, West Bengal, 700028",378.0,700028.0,22.5726459,88.3638953,0,,
30916,Dr. R. Hasan,"13, Post Office Road, Dum Dum Cantt., Kolkata, West Bengal, 700028",378.0,700028.0,22.5726459,88.3638953,0,,
30917,Dum Dum Municipal Specialised Hospital(Expension Project),"4, Harimohan Dutta Road, Kolkata, West Bengal, 700028",378.0,700028.0,22.5726459,88.3638953,0,,
30918,North Point Nursing Home Pvt Ltd,"39 Post Office Road, Kolkata, West Bengal, 700028",378.0,700028.0,22.5726459,88.3638953,0,,
30919,Orbit Eye Hospital,"617, Jessore Road , Nagerbazar, Kolkata, West Bengal, 700028",378.0,700028.0,22.5726459,88.3638953,0,,
30920,Tulip Nursing Home Pvt. Ltd.,"96, Rishi Bankim Chandra Road, Kolkata, West Bengal, 700028",378.0,700028.0,22.5726459,88.3638953,0,,
30921,Des Nursing Home,"5/25/1, Dumdum Road, Kolkata, West Bengal, 700030",378.0,700030.0,22.5726459,88.3638953,0,,
30922,Dum Dum Eye Microsurgery Centre,"5/1/1C, Kalicharan Seth Lane, Kolkata, West Bengal, 700030",378.0,700030.0,22.5726459,88.3638953,0,,
30923,Eves Clinic Nursing Home and Poly Clinic,"14 F/1A,Dum Dum Road, Kolkata, West Bengal, 700030",378.0,700030.0,22.5726459,88.3638953,0,,
30924,Critical and Trauma Care Hospital,"B T Dunlop Bridge , Baranagar, Kolkata, West Bengal, 700035",378.0,700035.0,22.5726459,88.3638953,0,,
30925,Lab-O-Aid Eye Micro Surgery Unit,"13, T.N. Biswas Road, Dakshineswar, Kolkata, West Bengal, 700035",378.0,700035.0,22.5726459,88.3638953,0,,
30926,Paradise Nursing Home,"10/A, N.C.Moitra Street, Kolkata, West Bengal, 700035",378.0,700035.0,22.5726459,88.3638953,0,,
30927,Rog Mookti,"98/70, G L T Road, Kolkata, West Bengal, 700036",378.0,700036.0,22.5726459,88.3638953,0,,
30928,Astha Medical Service Pvt Ltd,"48/2 Q. B.T.Road, Kolkata, West Bengal, 700050",378.0,700050.0,22.5726459,88.3638953,0,,
30929,Binayak Imaging And Diagnostic Pvt Ltd,"59 Binayak Enclave, Dum Dum, Kolkata, West Bengal, 700050",378.0,700050.0,22.5726459,88.3638953,0,,
30930,Medicave Diagnostic Centre Pvt Ltd,"48B,Near Sinthi More,B T Road,Sinthee, Kolkata, West Bengal, 700050",378.0,700050.0,22.5726459,88.3638953,0,,
30931,Maa Sarada Maternity and Nursing Home,"V.I.P.Road, Kaikhali, P.S.Airport, Kolkata, West Bengal, 700052",378.0,700052.0,22.5726459,88.3638953,0,,
30932,Mon Psychiatric Nursing Home Trust,"Block-O, No.26, Nazrul Islam Avenue(Vip), Kaikhali, Kolkata, West Bengal, 700052",378.0,700052.0,22.5726459,88.3638953,0,,
30933,Matri Sadan-O-Swasthya Kendra General Hospital,"Near Dum Dum Cantonment, Vivekananda Road, Rabindra Nagar, Kolkata, West Bengal, 700065",378.0,700065.0,22.5726459,88.3638953,0,,
30934,Monorama Nursing Home,"Rabindra Nagar, Near Durganagar Post Office, Kolkata, West Bengal, 700065",378.0,700065.0,22.5726459,88.3638953,0,,
30935,Care Hospital Of Medicare Co-Operative Society,"P-14 A/1, C.I.T. Scheme -Viii (M) , Ultadanga, Kolkata, West Bengal, 700067",378.0,700067.0,22.5726459,88.3638953,0,,
30936,Medicare Hospital Of Medicine Co-Op Society,"P 14 A/1 Scheme Vlll M, C I T Road, Ultadanga, Kolkata, West Bengal, 700067",378.0,700067.0,22.5726459,88.3638953,0,,
30937,Nayan Jyoti Eye Care Centre,"42, Dr Meghnath Saha Road, Dum Dum, North Dum Dum, Kolkata, North Twenty Four Parganas, 700074",378.0,700074.0,22.5726459,88.3638953,0,,
30938,Shushruta Nursing Home,"1, A M Bose Road, Kolkata, West Bengal, 700074",378.0,700074.0,22.5726459,88.3638953,0,,
30939,Dum Dum Medical Centre,"3A, Pollock Avenue, Kolkata, West Bengal, 700080",378.0,700080.0,22.5726459,88.3638953,0,,
30940,Ils Hospitals - Dumdum,"1, Khudiram Bose Sarani(Mall Road) , Near Nager Bazar Bus Stand, Kolkata, West Bengal, 700080",378.0,700080.0,22.5726459,88.3638953,0,,
30941,Baranagar 56 State General Hospital,"104, A.K. Mukherjee Road, Kolkata, West Bengal, 700090",378.0,700090.0,22.5726459,88.3638953,0,,
30942,Bankura Seva Niketan Hospital - Bankura,"Patpur (Jail Road ),  Bankura,West Be, Bankura, West Bengal, 722101",375.0,722101.0,23.132377,87.2081925,0,,
30943,Biswarupa Maternity And Nursing Home,"Rampur(Puration Rathala), Bankura, West Bengal, 722101",375.0,722101.0,23.132377,87.2081925,0,,
30944,"City Nursing Home,Bankura","Rampur, Bankura, Bankura, West Bengal, 722101",375.0,722101.0,23.132377,87.2081925,0,,
30945,Dr. Manik Chandra Nandys Nursing Home,"Pratapbagan, Bankura, West Bengal, 722101",375.0,722101.0,23.132377,87.2081925,0,,
30946,Hardik Medical Diagnostic Cnter Pvt Ltd -Bankura / Dr. R. B. Sarkar Memorial Nursing Home,"442/3 Rabindra Sarani, Near South Police Station, Kolkata, West Bengal, 722101",378.0,722101.0,22.5726459,88.3638953,0,,
30947,Hope Medicare (Chandradoy Sales And Services Pvt. Ltd.),"Rambhagat Bajoria Sarani, Lalbazar, Bankura, Kolkata, West Bengal, 722101",378.0,722101.0,22.5726459,88.3638953,0,,
30948,Jibandeep Nursng Home,"Schooldanga, Bankura, West Bengal, 722101",375.0,722101.0,23.132377,87.2081925,0,,
30949,Life Line Nursing Home,"Stadium More, Bankura, Bankura, West Bengal, 722101",375.0,722101.0,23.132377,87.2081925,0,,
30950,Maa Mahamaya Maternity and Nursing Home,"Kenduadihi, Bankura, West Bengal, 722101",375.0,722101.0,23.132377,87.2081925,0,,
30951,Memorial Nursing Home,"Abinash Sarani, Bankura, West Bengal, 722101",375.0,722101.0,23.132377,87.2081925,0,,
30952,Muktakeshi Arogya Niketan,"Jogeshpally , P.O.P.S., Bankura, West Bengal, 722101",375.0,722101.0,23.132377,87.2081925,0,,
30953,Nityananda Arogya Niketan,"Nityananda Ashram Lane, Nutangabj, Bankura, West Bengal, 722101",375.0,722101.0,23.132377,87.2081925,0,,
30954,Ramakrishna Charitable Dispensary And Netralaya,"Ashrampara, Bankura, Bankura, West Bengal, 722101",375.0,722101.0,23.132377,87.2081925,0,,
30955,Saviera Maternity and Nursing Home,"53, Poddar Pukur, Machantola, B/H Bankura Municipality, Bankura, West Bengal, 722101",375.0,722101.0,23.132377,87.2081925,0,,
30956,Souren Eye Clinic and Nursing Home,"Nutanchati , Nutanchati, Bankura, West Bengal, 722101",375.0,722101.0,23.132377,87.2081925,0,,
30957,Dr B N Dutta Medical Center,"Kajuridanga More, Bankura, West Bengal, 722102",375.0,722102.0,23.132377,87.2081925,0,,
30958,Dr R B Sarkar Memorial Nursing Home,"446, Rabindra Sarani, Bankura, West Bengal, 722102",375.0,722102.0,23.132377,87.2081925,0,,
30959,Dr S B Ray Memorial Nursing Home,"At Jathyrudanga, Netaji Nagar, P O Kenduadihi, Bankura, West Bengal, 722102",375.0,722102.0,23.132377,87.2081925,0,,
30960,Jeeban Suraksha Hospital,"Katuridanga More, P.O.- Kenduadihi, Bankura, West Bengal, 722102",375.0,722102.0,23.132377,87.2081925,0,,
30961,Little Hearts Diagnostic Centre And Hospital,"271/7/1, Taragoti Samanta Road Kenduadihi, Bankura, West Bengal, 722102",375.0,722102.0,23.132377,87.2081925,0,,
30962,Cure Home Nursing Home,"Lokepur, P.O. Kenduadihi, Bankura, West Bengal, 722122",375.0,722122.0,23.132377,87.2081925,0,,
30963,Lake View Nursing Home,"Matukganj, Bankura, West Bengal, 722122",375.0,722122.0,23.132377,87.2081925,0,,
30964,Newland Hospital,"College Road, Bishnupur, Bankura, West Bengal, 722122",375.0,722122.0,23.132377,87.2081925,0,,
30965,Panacea Hospital,"College Road, Rashtolla, Bishnupur, Bankura, West Bengal, 722122",375.0,722122.0,23.132377,87.2081925,0,,
30966,Basali Maternity And Nursing Home,"Po - Chhatna, Bankura, West Bengal, 722132",375.0,722132.0,23.132377,87.2081925,0,,
30967,Matribedi Shamayita Jeeban Surya,"Ce/123 Vill-Ranbahal , Post- Amarkanan, Bankura, West Bengal, 722133",375.0,722133.0,23.132377,87.2081925,0,,
30968,Camelia Health And Eye Care,"Kotalpur, Kotalpur, Bankura, West Bengal, 722141",375.0,722141.0,23.132377,87.2081925,0,,
30969,Khristya Seba Niketan,"Sarenga, Bankura, West Bengal, 722150",375.0,722150.0,23.132377,87.2081925,0,,
30970,Perorgari Gramin Hospital,"Vill-Perorgari, P.O.-Sukhadali, Bankura, West Bengal, 722150",375.0,722150.0,23.132377,87.2081925,0,,
30971,Bankura Lions Eye Care Centre,"Kesiakole, Bankura, West Bengal, 722155",375.0,722155.0,23.132377,87.2081925,0,,
30972,Shakti Purna Arogya Niketan,"Viii+P.O-Barjora, Bankura, West Bengal, 722202",375.0,722202.0,23.132377,87.2081925,0,,
30973,Glocal Hospital,"Gangani Danga, Ward- 13 , Bankura Burdwan Road, Sonamukhi, Bankura, West Bengal, 722207",375.0,722207.0,23.132377,87.2081925,0,,
30974,Gopinath Nursing Home,"Haranath Mondir Road, Sonamukhi, Bankura, West Bengal, 722207",375.0,722207.0,23.132377,87.2081925,0,,
30975,Saktipura Arogya Niketan,"Opp Lane Of Aparna Cinema, Bajora, Bankura, West Bengal, 722207",375.0,722207.0,23.132377,87.2081925,0,,
30976,Sonamukhi Pragati Netralaya,"Ranir Bazar, Sonamukhi, Bankura, West Bengal, 722207",375.0,722207.0,23.132377,87.2081925,0,,
30977,Srinibas Nursing Home,"Vill Post - Sonamukhi, Bankura, West Bengal, 722207",375.0,722207.0,23.132377,87.2081925,0,,
30978,Vijoy Krishna Nursing Home,"Sonamukhi, Bankura, West Bengal, 722207",375.0,722207.0,23.132377,87.2081925,0,,
30979,Anandalok Charitable Hospital,"N.S.B. Road, Searsole Rajbari, Bardhaman, West Bengal, 713101",371.0,713101.0,23.2495714,87.8681751,0,,
30980,B.C.C.U,"7 R.B. Ghosh Road, Khosbagan, Bardhaman, West Bengal, 713101",371.0,713101.0,23.2495714,87.8681751,0,,
30981,Barddhaman Lions Sisu Hospital,"Goods Shed Road, Tinkonia, Bardhaman, West Bengal, 713101",371.0,713101.0,23.2495714,87.8681751,0,,
30982,Chittaranjan Advanced Medical Refferal Institute(Camri),"Bamchandaipore G T Road, Bardhaman, West Bengal, 713101",371.0,713101.0,23.2495714,87.8681751,0,,
30983,"Chittaranjan Ultrasonography and Echo Clinic, Burdwan","33,Ramkrishna Road, Khosbagan, Bardhaman, West Bengal, 713101",371.0,713101.0,23.2495714,87.8681751,0,,
30984,Diplomat Nursing Home,"22 R B Ghosh Road, Khoshbagan, Bardhaman, West Bengal, 713101",371.0,713101.0,23.2495714,87.8681751,0,,
30985,Dr. Bimal Krishna Chatterjee,"P O Galsi, Bardhaman, West Bengal, 713101",371.0,713101.0,23.2495714,87.8681751,0,,
30986,Eve Land Nursing Home,"Madhuban(Baidyapur More),Kalna, Bardhaman, West Bengal, 713101",371.0,713101.0,23.2495714,87.8681751,0,,
30987,"Government Of West Bengal, Durgapur","Sub-Divisional Hospital, Durgapur, Bardhaman, West Bengal, 713101",371.0,713101.0,23.2495714,87.8681751,0,,
30988,Greenland Nursing Home,"Keshabganj Chatti(Masjid Tala), Bardhaman, West Bengal, 713101",371.0,713101.0,23.2495714,87.8681751,0,,
30989,H.L.G Memorial CharitablehospitalandRes.Centre,"Burdawan, Bardhaman, West Bengal, 713101",371.0,713101.0,23.2495714,87.8681751,0,,
30990,Hk Nursing Home,"Khoshbagan R B Ghosh Road Burdwan, Bardhaman, West Bengal, 713101",371.0,713101.0,23.2495714,87.8681751,0,,
30991,Jeevan Deep Nursing Home,"16 , D.N. Mitra Lane , (No.- Pakmara Lane) Khosbagan, Bardhaman, West Bengal, 713101",371.0,713101.0,23.2495714,87.8681751,0,,
30992,Kalpataru Nursing Home,"104, R.B. Ghosh Road, Narkel Bagan More, Khoshbagan., Bardhaman, West Bengal, 713101",371.0,713101.0,23.2495714,87.8681751,0,,
30993,Kalyani Nursing Home,"46, R.B. Ghosh Road, Kmoshbagan, Bardhaman, West Bengal, 713101",371.0,713101.0,23.2495714,87.8681751,0,,
30994,Lions Eye Care Hospital,"33A, R B Ghosh Road, Mallick Bazar, Khoshbagan, Bardhaman, West Bengal, 713101",371.0,713101.0,23.2495714,87.8681751,0,,
30995,Matri Kalyan Nursing Home Pvt. Ltd,"P.O. Katwa, Circus Maidan, Bardhaman, West Bengal, 713101",371.0,713101.0,23.2495714,87.8681751,0,,
30996,Nayonika Eye Care Centre,"J.N.Joy Road,Shyamsayee (East), Bardhaman, West Bengal, 713101",371.0,713101.0,23.2495714,87.8681751,0,,
30997,Nightingale Nursing Home,"26, J. B. Mitra Road, (Near Barabazar), Bardhaman, West Bengal, 713101",371.0,713101.0,23.2495714,87.8681751,0,,
30998,Parijat Sevalay Pvt. Ltd.,"Shayam Sayer (North), Opposite Burdwan Hospital & Raj Collage, Bardhaman, West Bengal, 713101",371.0,713101.0,23.2495714,87.8681751,0,,
30999,Park Nursing Home,"12, Frazer Avenue , (Opposite Power House),Bardhaman, Bardhaman, West Bengal, 713101",371.0,713101.0,23.2495714,87.8681751,0,,
31000,Sabitri Nursing Home,"Kajra Gram,Burdwan, Bardhaman, West Bengal, 713101",371.0,713101.0,23.2495714,87.8681751,0,,
31001,Sharanya Hospital,"Bamchandaipur, Nh- 2, Burdwan Burdwan, Bardhaman, West Bengal, 713101",371.0,713101.0,23.2495714,87.8681751,0,,
31002,Shyam View Nursing Home,"Shyam Sayer North, Bardhaman, West Bengal, 713101",371.0,713101.0,23.2495714,87.8681751,0,,
31003,Sishumangal Nursing Home,"B.C.Road, Bardhaman, West Bengal, 713101",371.0,713101.0,23.2495714,87.8681751,0,,
31004,The Amala Arogya Niketan and Polyclinic,"P.O : Rupnarayan Pur Bazar, Bardhaman, West Bengal, 713101",371.0,713101.0,23.2495714,87.8681751,0,,
31005,The Lifeline Nursing Homeand Poly Clinic,"Bhangakunthi, Bardhaman, West Bengal, 713101",371.0,713101.0,23.2495714,87.8681751,0,,
31006,Burdman Critical Care Unit Pvt. Ltd.,"7,R.B Ghosh Road,Khosbagan, Bardhaman, West Bengal, 713102",371.0,713102.0,23.2495714,87.8681751,0,,
31007,Burdwan Municipal Health Centre,"Jhurjhure Pool, Bongpur, Alamganj, Bardhaman, West Bengal, 713102",371.0,713102.0,23.2495714,87.8681751,0,,
31008,Ct Nursing Home,"Keshab Ganj Chatti, P.O. Rajbati, Bardhaman, West Bengal, 713102",371.0,713102.0,23.2495714,87.8681751,0,,
31009,Meditech Medical Ltd.,"Kazirhat,Goda,P.O.-Lakurdi, Bardhaman, West Bengal, 713102",371.0,713102.0,23.2495714,87.8681751,0,,
31010,Niranjan Smriti Kalyan Kendra Pvt. Ltd.,"Ranisayar West, Bardhaman, West Bengal, 713102",371.0,713102.0,23.2495714,87.8681751,0,,
31011,Sebalaya Nursing Home,"Kotalhat, Bardhaman, West Bengal, 713102",371.0,713102.0,23.2495714,87.8681751,0,,
31012,Skylark Nursing Home,"Borehat, Kalitala, Bardhaman, West Bengal, 713102",371.0,713102.0,23.2495714,87.8681751,0,,
31013,Subodh Sankar Sebayatan,"Dr. Subodh Mukhopadhyay Sarani, Krishna Sayer South, Borehat - Kalitala, Bardhaman, West Bengal, 713102",371.0,713102.0,23.2495714,87.8681751,0,,
31014,Dreamland Nursing Home,"Indraprastha, Baburbagh;OppositeCity Hotel Rajbati, Bardhaman, West Bengal, 713103",371.0,713103.0,23.2495714,87.8681751,0,,
31015,Megha Eye Centre,"Jail Khana More, Ramkrishna Road, Ranisayer (N), Bardhaman, West Bengal, 713103",371.0,713103.0,23.2495714,87.8681751,0,,
31016,Adarsh Nursing Home,"160, B.C. Road, P.O. - Rajbati, Sulipukur, Bardhaman, West Bengal, 713104",371.0,713104.0,23.2495714,87.8681751,0,,
31017,Shyamsundar Nursing Home,"Shyamsundar, Bardhaman, West Bengal, 713124",371.0,713124.0,23.2495714,87.8681751,0,,
31018,Lions Club Of Gushkora Town Ram Kumar Agarwal Memorial Hospital,"Vill-Dharapara,P.O.-Gushkara,P.S.-Aushgram, Bardhaman, West Bengal, 713128",371.0,713128.0,23.2495714,87.8681751,0,,
31019,Arogya Niketan Clinic and Nursing Home,"Telephone Maidan, Po- Katwa, Bardhaman, West Bengal, 713130",371.0,713130.0,23.2495714,87.8681751,0,,
31020,Katwa Nursing Home,"Station Bazar , Katwa, Bardhaman, West Bengal, 713130",371.0,713130.0,23.2495714,87.8681751,0,,
31021,Katwa Nursing Home,"Katoyastation Bazar, Kachari Road, Near Juma Masjid, Bardhaman, West Bengal, 713130",371.0,713130.0,23.2495714,87.8681751,0,,
31022,Debipur Netralaya Pvt Ltd,"Memari Chakdighi More, P.O. & P.S. - Memari, Bardhaman, West Bengal, 713146",371.0,713146.0,23.2495714,87.8681751,0,,
31023,Radharani Nursing Home,"G. T Road, Memari, Bardhaman, West Bengal, 713146",371.0,713146.0,23.2495714,87.8681751,0,,
31024,Repose Nursing Home,"G T Road , Panagarh Bazar, Bardhaman, West Bengal, 713148",371.0,713148.0,23.2495714,87.8681751,0,,
31025,Dreamland Nursing Home,"Sanjib Sarani , Station Bazar, Bardhaman, West Bengal, 713201",371.0,713201.0,23.2495714,87.8681751,0,,
31026,Vivek Nursing Home,"Dr. B. C. Roy Avenue, Near Durgapur Bus Stand, Durgapur, Bardhaman, West Bengal, 713201",371.0,713201.0,23.2495714,87.8681751,0,,
31027,West End Nursing Home and Maternity Center,"G T Road, Gopal Math, Bardhaman, West Bengal, 713203",371.0,713203.0,23.2495714,87.8681751,0,,
31028,Lions Care Centre,"Tagore Avenue Durgapur, Bardhaman, West Bengal, 713204",371.0,713204.0,23.2495714,87.8681751,0,,
31029,Durgapur Steel Plant Hospital,,371.0,713205.0,23.2495714,87.8681751,0,,
31030,Damodar Valley Corporation,"P.O. : Durgapur, Bardhaman, West Bengal, 713207",371.0,713207.0,23.2495714,87.8681751,0,,
31031,Dtps Hospital,"Durgapur, Bardhaman, West Bengal, 713207",371.0,713207.0,23.2495714,87.8681751,0,,
31032,Bidhan Niramoy,"B-120 Aldrin Path, Bidhan Nagar Durgapur, Bardhaman, West Bengal, 713212",371.0,713212.0,23.2495714,87.8681751,0,,
31033,Eye Clinic,"B-5 , Collins Path , Bidhannagar, Durgapur, Bardhaman, West Bengal, 713212",371.0,713212.0,23.2495714,87.8681751,0,,
31034,Gouri Devi Hospital and Research Institute,"National High Way-2,G T Road, Beside Ioc Terminal, Rajbandh Beside Ioc Terminal, Bardhaman, West Bengal, 713212",371.0,713212.0,23.2495714,87.8681751,0,,
31035,Heritage Clinic and Nursing Home,"D/178, Shastri Avenue, Durgapur, Bardhaman, West Bengal, 713212",371.0,713212.0,23.2495714,87.8681751,0,,
31036,The Mission Hospital,"Plot No 219 (P), Immon Kalyan Sarani Durgapur Durgapur, Bardhaman, West Bengal, 713212",371.0,713212.0,23.2495714,87.8681751,0,,
31037,Vivekananda Hospital Pvt Ltd,"Dr Zakir Hussain Avenue ,Bidhan Nagar, Durgapur, Bardhaman, West Bengal, 713212",371.0,713212.0,23.2495714,87.8681751,0,,
31038,Disha Eye Hospitals And Research Centre Pvt Ltd,"Road No-100, Palasdiha, Durgapur, Bardhaman, West Bengal, 713208",371.0,713208.0,23.2495714,87.8681751,0,,
31039,Sri Ram Health Care,"Nachan Road (Opposite Bank Of India) Benachity , Durgapur, Bardhaman, West Bengal, 713213",371.0,713213.0,23.2495714,87.8681751,0,,
31040,Dr.B.C.Roy Medical Institute,"N-1, Doctor S Colony, City Centre, Durgapur, Bardhaman, West Bengal, 713216",371.0,713216.0,23.2495714,87.8681751,0,,
31041,Durgapur Cityclinic And Nursing Home Pvt Ltd,"4Th And 5Th Street, Doctors Colony, Central Park, City Centre, Durgapur, Bardhaman, West Bengal, 713216",371.0,713216.0,23.2495714,87.8681751,0,,
31042,Elan View Nursinf Home Pvt. Ltd.,"N -1, Doctors Colony, City Centre, Durgapur, Bardhaman, West Bengal, 713216",371.0,713216.0,23.2495714,87.8681751,0,,
31043,Presidency Nursing Home,"A/1, Nandalal Bithi, Bardhaman, West Bengal, 713216",371.0,713216.0,23.2495714,87.8681751,0,,
31044,Vivekananda Nethralaya,"Sahid Khudiram Sarani, City Centre, Durgapur, Bardhaman, West Bengal, 713216",371.0,713216.0,23.2495714,87.8681751,0,,
31045,Asansol Metropolitan Nursing Home,"26, K N Mukherjee Lane Asansol Asansol, Bardhaman, West Bengal, 713301",371.0,713301.0,23.2495714,87.8681751,0,,
31046,Asnsol Eye Hospital,"36/1,Ram Gulam Sing Road,Ushagram Asansol, Bardhaman, West Bengal, 713301",371.0,713301.0,23.2495714,87.8681751,0,,
31047,Bengal Homoepathic Medical College Hospital,"Ismail, Asansol, Bardhaman, West Bengal, 713301",371.0,713301.0,23.2495714,87.8681751,0,,
31048,Maa Durga Nursing Home,"26,N.S.Road, Bardhaman, West Bengal, 713301",371.0,713301.0,23.2495714,87.8681751,0,,
31049,Mehi Diagnostic Centre,"City Tower, Kumarpur , Near Manoj Cinema G.T. Road, Bardhaman, West Bengal, 713301",371.0,713301.0,23.2495714,87.8681751,0,,
31050,Asansol West-End Clinic and Nursing Home Pvt.Ltd,"Vidyasagar Sarani,Kumarpur,Asansol, Bardhaman, West Bengal, 713304",371.0,713304.0,23.2495714,87.8681751,0,,
31051,Daffodil Medical Centre,"Upper Cheli Danga,Sb Gorai Road Asansol, Bardhaman, West Bengal, 713304",371.0,713304.0,23.2495714,87.8681751,0,,
31052,Drishti Eye Hospital (A Unit Of Drishti Eye Hospital Pvt. Ltd.) -Asansol,"68,S.B.Gorai Road, Near St. Vincent School 347, Burnpur Road, Near Court More, Bardhaman, West Bengal, 713304",371.0,713304.0,23.2495714,87.8681751,0,,
31053,H L G Memorial Charitable Hospital and Research Institute,"Opposite Kalyanpura Housing More, Sen Raleigh Road, Bardhaman, West Bengal, 713304",371.0,713304.0,23.2495714,87.8681751,0,,
31054,Hill View Nursing Home,"S.B.Gorai Road, Asansol, Bardhaman, West Bengal, 713304",371.0,713304.0,23.2495714,87.8681751,0,,
31055,Jeevan Arogya Nursing Home Pvt. Ltd.,"Sahara Commercial Comlex, Kumarpur [West], G.T. Road, Asansol, Bardhaman, West Bengal, 713304",371.0,713304.0,23.2495714,87.8681751,0,,
31056,"Kamalalaya Hospital (P) Ltd.,","#194, G.T. Road (W),Kumarpur,Opposite A G Cruch School, Bardhaman, West Bengal, 713304",371.0,713304.0,23.2495714,87.8681751,0,,
31057,Nayan Eye Hospital,"G.T.Road, City Tower, Kumarpur,Near Manoj Talkies,OppositeGenexx Exotica, Bardhaman, West Bengal, 713304",371.0,713304.0,23.2495714,87.8681751,0,,
31058,New Eveland Nursing Home,"Sen Raleigh Road(Near Tunnel Pool) < Apcar Gardens ,Asansol, Bardhaman, West Bengal, 713304",371.0,713304.0,23.2495714,87.8681751,0,,
31059,Satellite Nursing Home,"S.B. Gorai Road , Sri Pally More, Bardhaman, West Bengal, 713304",371.0,713304.0,23.2495714,87.8681751,0,,
31060,Sebayan Matri Sadan,"Saradapally, Kumarpur, Asansol, Bardhaman, West Bengal, 713304",371.0,713304.0,23.2495714,87.8681751,0,,
31061,The New Florence Nursing Home,"Hill View Park South, S.B.Gorai Road, Asansol, Bardhaman, West Bengal, 713304",371.0,713304.0,23.2495714,87.8681751,0,,
31062,West-End Clinic and Nursing Home Pvt Ltd,"Vidyasagar Sarani, Kumarpur, Asansol, Bardhaman, West Bengal, 713304",371.0,713304.0,23.2495714,87.8681751,0,,
31063,Punardristee Eye Hospital,"Adda Industrial Plot, Kalyanpur , Housing More Asansol- 5,Asansol(Mc), Bardhaman, West Bengal, 713305",371.0,713305.0,23.2495714,87.8681751,0,,
31064,Diamond Hospital Pvt.Ltd.,"Andal More,Ukhra Road,P.O.+P.S.-Andal, Bardhaman, West Bengal, 713321",371.0,713321.0,23.2495714,87.8681751,0,,
31065,Astha Hospital,"Hanuman Charai, Barakar, Bardhaman, West Bengal, 713324",371.0,713324.0,23.2495714,87.8681751,0,,
