hospital_id,hospital_name,address,district_id,pincode,latitude,longitude,mco_contact_number,total_beds,hospital_type
9562,Prime Dental Care and Orthodontic Centre,"Indraj Arcade, OppositeHope Appts,\nJharsa Road, Basement Reliance\nFresh, Sector 15, Gurgaon, Haryana, 122011",122.0,122011.0,28.4646148,77.0299194,0,,
9563,The Dental Lounge,"83, Arjun Marg, DLF Phase-1, Gurgaon, Haryana, 122001",122.0,122001.0,28.4668715,77.0977331,0,,
9564,Vardhman Medicare Centre,"Institute for Advanced IVF/ICSI, Laparoscopy And Child Care\nSec -5/239, Sheetla Mata Road\n, Gurgaon, Haryana, 122001",122.0,122001.0,28.4646148,77.0299194,0,,
9565,Nova Care Clinic,"New Railway Road, Gurgaon, Haryana, 122001",122.0,122001.0,28.4683613,77.0255377,0,,
9566,Yadav Hospital,"C-1, Sector-10-A,\nOppositeMeenakshi Public School,\nGurgaon, Haryana, Phone-, Gurgaon, Haryana, 122001",122.0,122001.0,28.4646148,77.0299194,0,,
9567,"Centre For Sight, Gurgaon, Sector 29","SCO Complex  317, Sector  29, Gurgaon, Haryana, 122001",122.0,122001.0,28.4646148,77.0299194,0,,
9568,"Centre For Sight, Gurgaon, New Railway Road","Plot 399/1, New railway road, Gurgaon, Haryana, 122001",122.0,122001.0,28.673523,77.3163754,0,,
9569,Divine Look Clinic Centre 1,"LG-9, D T Mega mall, DLF PHASE 1, Gurgaon, Haryana, 122001",122.0,122001.0,28.4646148,77.0299194,0,,
9570,Divine Look Clinic Centre 2,"S-373, Uppal South End, Behind  Omaxe Plaza, Sohna Road, Gurgaon, Haryana, 122001",122.0,122001.0,28.4646148,77.0299194,0,,
9571,"Eye-Q Super Speciality Eye Hospitals, DLF Phase","4306, Near Galleria Market\nDLF Phase IV, Gurgaon, Haryana, 122001",122.0,122001.0,28.4646148,77.0299194,0,,
9572,"Eye-Q Super Speciality Eye Hospitals, New Railway Road","Sheetla Hospital, New Railway Road, Gurgaon, Haryana, 122001",122.0,122001.0,28.4646148,77.0299194,0,,
9573,"Eye-Q Super Speciality Eye Hospitals, Palam Vihar","SCO/F-85, Near Rotary Public School, Sec-22, Palam vihar, Gurgaon, Haryana, 122001",122.0,122001.0,28.4646148,77.0299194,0,,
9574,Privat Hospital,"DLF City-II, M.G.Road Gurgaon, Haryana, Near MG Metro Station, Gurgaon, Haryana, 122002",122.0,122002.0,28.479881,77.080826,0,,
9575,"World Laparoscopy Hospital,","Cyber City, DLF Phase II, Gurgaon, Haryana, 122002",122.0,122002.0,28.4936018,77.088325,0,,
9576,Columbia Asia Hospital,"Block F, Gol Chakkar, Palam Vihar, Gurgaon, Haryana, 122017",122.0,122017.0,28.4646148,77.0299194,0,,
9577,"Rockland Manesar, Gurgaon","Plot No.P-2, Sector-5, IMT, Manesar, Gurgaon, Haryana, 0",122.0,0.0,28.3688093,76.9268541,0,,
9578,Umkal Hospital,"Dr.Umesh Gupta, A-520, Sushant Lok-1, Near IFFCO Chowk Metro Station, Gurgaon, Haryana, 122002",122.0,122002.0,28.4646148,77.0299194,0,,
9579,Aabhari Plastic Surgery Center,"Malik Nursing Home, Balsamand Road, Malik Chowk, Hisar, Haryana, 125001",116.0,125001.0,29.2396596,75.8174505,0,,
9580,Aakash Hospital,"Rishi Nagar, Near Bus Stand, Hisar, Haryana, 125001",116.0,125001.0,29.8008373,76.4264804,0,,
9581,Aastha Hospital,"81-S, Model Town, Hisar, Haryana, 125001",116.0,125001.0,29.1339562,75.7422368,0,,
9582,Agnihotri Eye Hospital,"Near Gujri Mahal, Barwala Road, Hisar, Haryana, 125001",116.0,125001.0,29.2396596,75.8174505,0,,
9583,Anand Nursing Home,"Bhagat Singh Road, Hisar, Haryana, 125001",116.0,125001.0,29.2396596,75.8174505,0,,
9584,Anant Medicare Centre,"Inside Churamani Hospital, Near Camp Chowk, Delhi Road, Hisar, Haryana, 125001",116.0,125001.0,29.2396596,75.8174505,0,,
9585,Arora Orthopaedic Hospital,"Barwala Road, Hisar, Haryana, 125001",116.0,125001.0,29.1666511,75.727776,0,,
9586,Ayushman Hospital,"Sector 14-D, Hisar, Haryana, 125001",116.0,125001.0,29.2396596,75.8174505,0,,
9587,B K Neurocare Hospital,"N-159, Model Town, Near Iti, Hisar, Haryana, 125001",116.0,125001.0,30.3452968,76.3602026,0,,
9588,Bansal Eye Hospital,"Near Budhla Sant Mandir Rishi Nagar, Hisar, Haryana, 125001",116.0,125001.0,29.2396596,75.8174505,0,,
9589,Bansal Hospital,"Luxmi Vihar, Barwala, Hisar, Haryana, 125001",116.0,125001.0,29.3641876,75.9056753,0,,
9590,Bharat Medical Centre,"Rishi Nagar,Near Bus Stand, Hisar, Haryana, 125001",116.0,125001.0,29.8008373,76.4264804,0,,
9591,Central Medical Centre / Cmc Hospital,"Delhi Road, Hisar, Haryana, 125001",116.0,125001.0,29.1308664,75.7525695,0,,
9592,Centre For Sight,"Centre For Sight At Gayathri Eye Care Institute, 1, Model Town, Jindal Chowk, Hisar, Haryana, 125001",116.0,125001.0,29.2396596,75.8174505,0,,
9593,Chawla Nursing Home,"232, Model Town, Hisar, Haryana, 125001",116.0,125001.0,29.1339562,75.7422368,0,,
9594,Chhabra Hospital,"Inderprashta Colony Near Bus Stand, Hisar, Haryana, 125001",116.0,125001.0,25.2430986,86.9789102,0,,
9595,Churamani Vishnudevi Matternity and Gen. / Churamani Hospital,"Near Camp Chock, Hisar, Haryana, 125001",116.0,125001.0,29.2396596,75.8174505,0,,
9596,City Hospital,"Dabra Chowk, Delhi Road, Hisar, Haryana, 125001",116.0,125001.0,29.1517831,75.7257012,0,,
9597,Civil Hospital,"Near Bus Stand , Circular Road, Hisar, Haryana, 125001",116.0,125001.0,30.1950435,71.4792529,0,,
9598,Dr Mahajan Family Care Hospital,"Near Budhia Sant Mandir, Adjoining Dhobi Ghat, Rishi Nagar, Hisar, Haryana, 125001",116.0,125001.0,29.2396596,75.8174505,0,,
9599,Dr Ram Narain Soni Ortho Hospital and Trauma Research Center,"Sector 15-A, Kaimri Road, Hisar, Haryana, 125001",116.0,125001.0,29.2396596,75.8174505,0,,
9600,Dr. Bal Krishna Gupta Hospital,"Near Sevak Sabha Hospital,Raj Ultrasound,Near Bus Stand, Hisar, Haryana, 125001",116.0,125001.0,29.2396596,75.8174505,0,,
9601,Dr. Ravi Vermas Hospital,"Ent Hospital,Speech & Hearing Centre,Near Sewak Sabha Hospital,Opp Dhobhi Ghat, Hisar, Haryana, 125001",116.0,125001.0,29.2396596,75.8174505,0,,
9602,Eye Q Super Speciality Eye Hospitals,"433/9C/2, Tayal Garden, Berwala Road , Tayal Garden, Hisar, Haryana, 125001",116.0,125001.0,29.2396596,75.8174505,0,,
9603,Gayatry Eye Care Institute,"Gindal Chouk, Hisar, Haryana, 125001",116.0,125001.0,29.2396596,75.8174505,0,,
9604,General Hospital,"Near Bus Stand , Circular Road, Hisar, Haryana, 125001",116.0,125001.0,30.1950435,71.4792529,0,,
9605,Ginni Orthopaedic Centre,"Sco- 1,Sector-14, Hisar, Haryana, 125001",116.0,125001.0,29.1747592,75.7051647,0,,
9606,Gobind Nursing Home,"Old Court Chowk, Opposite Jat College, Hisar, Haryana, 125001",116.0,125001.0,29.2396596,75.8174505,0,,
9607,Goswami Hospital,"Rishi Nagar, Hisar, Haryana, 125001",116.0,125001.0,29.1638483,75.7193405,0,,
9608,Goswami Nursing Home,", Near Bus Stand, Hisar, Haryana, 125001",116.0,125001.0,29.2396596,75.8174505,0,,
9609,Goyal Hospital - Hissar,"Dabra Chowk, Opposite Old St. Marry School, Hisar, Haryana, 125001",116.0,125001.0,29.2396596,75.8174505,0,,
9610,Grewal Hospital,"4,Pareet Nagar,Balasmand Road, Hisar, Haryana, 125001",116.0,125001.0,29.2396596,75.8174505,0,,
9611,Gulati Nursing Home,"Vijay Nagar, Hisar, Haryana, 125001",116.0,125001.0,29.148828,75.7251557,0,,
9612,Gupta Neonatal Hospital,"43-W, Model Town, Front Of Pushpa Complex, Hisar, Haryana, 125001",116.0,125001.0,29.2396596,75.8174505,0,,
9613,Hisar Children Hospital,"Jat College Road, Near Purani Kutchari, Hisar, Haryana, 125001",116.0,125001.0,29.2396596,75.8174505,0,,
9614,Jain Orthopedic Hospital,"Barnala Road, Hisar, Haryana, 125001",116.0,125001.0,29.2396596,75.8174505,0,,
9615,Janki Children Hospital,"Near Rishi Nagar, Hisar, Haryana, 125001",116.0,125001.0,29.1638483,75.7193405,0,,
9616,Janta Hospital,"Barwal Road, Hisar, Haryana, 125001",116.0,125001.0,29.2396596,75.8174505,0,,
9617,Jindal Surgical Hospital,"11, Indraprastha Colony, Near Bus Stand, Hisar, Haryana, 125001",116.0,125001.0,28.6790999,77.1616807,0,,
9618,Kailash Hospital,"167- S ,Model Town, Hisar, Haryana, 125001",116.0,125001.0,29.1339562,75.7422368,0,,
9619,Kalani Hospital,"Azad Nagar, Rajgarh Road, Hisar, Haryana, 125001",116.0,125001.0,29.1239665,75.7017487,0,,
9620,Kawatra Eye Hospital,"37,Indraprastha Colony,Near New Cloth Market, Hisar, Haryana, 125001",116.0,125001.0,29.2396596,75.8174505,0,,
9621,Khanna Medical Centre,"Rishi Nagar, Hisar, Haryana, 125001",116.0,125001.0,29.1638483,75.7193405,0,,
9622,Lamba Nursing Home Pvt. Ltd.,"Red Square Market,Railway Road, Hisar, Haryana, 125001",116.0,125001.0,8.4949884,76.9324309,0,,
9623,Life Line Institute Of Medical Sciences,"Azad Nagar, Opposite Godara Petrol Pump, Rajgarh Road, Hisar, Haryana, 125001",116.0,125001.0,29.2396596,75.8174505,0,,
9624,Medicity Hospital,"Dabra Chock, Hisar, Haryana, 125001",116.0,125001.0,29.2396596,75.8174505,0,,
9625,Mehta Hospital,"Main Road - Barwal Opp Cloth Market Barwala, Hisar, Haryana, 125001",116.0,125001.0,29.2396596,75.8174505,0,,
9626,Menon Hospital,"S.C.F.-92, C.U.E.-1, Hisar, Haryana, 125001",116.0,125001.0,29.2396596,75.8174505,0,,
9627,Mhta Holi Hospital,"Dabra Road, Hisar, Haryana, 125001",116.0,125001.0,29.1275526,75.7439086,0,,
9628,N. C. Jindal Institute Of Medical Care And Research Centre,"Model Town, Hisar, Haryana, 125001",116.0,125001.0,29.1339562,75.7422368,0,,
9629,"N. D. Hospital, Hisar","262, Model Town, Hisar, Haryana, 125001",116.0,125001.0,29.1339562,75.7422368,0,,
9630,Nawal Hospital,"Tayal Garden Barwala Road, Hisar, Haryana, 125001",116.0,125001.0,29.1694579,75.7268204,0,,
9631,Pradeep Kansal Multispeciality Hospital,"25-Inderprastha Colony,Near Bus Stand, Hisar, Haryana, 125001",116.0,125001.0,29.2396596,75.8174505,0,,
9632,Prashar Nursing Maternity Home and Eye Hospital,"Shri Hanuman Mandhir, Budhla Santh Sansthan , Behind Of Sevak Hospital, Hisar, Haryana, 125001",116.0,125001.0,29.2396596,75.8174505,0,,
9633,Progressive Medical Care and Research Center Pvt Ltd,"Delhi Raod Near Dabra Chowk, Hisar, Haryana, 125001",116.0,125001.0,29.1517831,75.7257012,0,,
9634,Raheja Nursing Home,"Old Kacheri Chowk, Hisar, Haryana, 125001",116.0,125001.0,29.2396596,75.8174505,0,,
9635,Ravi Janana Hospital,"Near Railway Staion, Railway Road, Hisar, Haryana, 125001",116.0,125001.0,27.8854345,78.071351,0,,
9636,Ravindra Hospital,"Model Town, Hisar, Haryana, 125001",116.0,125001.0,29.1339562,75.7422368,0,,
9637,"Ravindra Hospital And Heart Center - Hisar / Ravindra Hospital, Hisar Cath Lab and Heart Centre / Ravindra Panandikar","Near Jindal Hospital Main Road Model Town, Hisar, Haryana, 125001",116.0,125001.0,29.2396596,75.8174505,0,,
9638,Sai Hospital,"Near Jawa Hospital, Tosham Road, Hisar, Haryana, 125001",116.0,125001.0,29.2396596,75.8174505,0,,
9639,Sangwan Hospital,"Uklana Mandi, Hisar, Haryana, 125001",116.0,125001.0,29.2396596,75.8174505,0,,
9640,Sanjivani Multispeciality Hospital,"Tayal Garden, Barwalaroad,Opposite To O.P. Jindal Park, Hisar, Haryana, 125001",116.0,125001.0,29.2396596,75.8174505,0,,
9641,Sapra Multispeciality Hospital - Hisar,"Rajgardh Road, Hisar, Haryana, 125001",116.0,125001.0,29.2396596,75.8174505,0,,
9642,Sarvodaya Multispeciality Hospital / Dr. Kalra,"Opposite Red Cross Bhawan, Delhi Road, Hisar, Haryana, 125001",116.0,125001.0,29.2396596,75.8174505,0,,
9643,Satija Hospital,"Opposite Housing Board Colony, Sector-15-A, Kamri Road, Hisar, Haryana, 125001",116.0,125001.0,29.2396596,75.8174505,0,,
9644,Savant Hospital,"Near Camp Chowk,Opp Ruchi Hotel, Hisar, Haryana, 125001",116.0,125001.0,29.2396596,75.8174505,0,,
9645,Sewak Sabha Hospital,"Rishi Nagar, Hisar, Haryana, 125001",116.0,125001.0,29.1635124,75.7191133,0,,
9646,Shakti Neuroscience Centre and Dev Mri Centre,"Barwala Raod Near Bus Stand From Jindal Park, Hisar, Haryana, 125001",116.0,125001.0,29.2396596,75.8174505,0,,
9647,Shanti Mission Hospital,"49-E. Near P.N.B., Delhi Road, Model Town, Hisar, Haryana, 125001",116.0,125001.0,30.8827996,75.8322738,0,,
9648,Sharda Hospital,"106, Model Town, Gurudwara Road, Hisar, Haryana, 125001",116.0,125001.0,29.3890606,76.9589891,0,,
9649,Sharma Nursing Home / Sharma Ravin Hospital,"Prem Nagar,, Hisar, Haryana, 125001",116.0,125001.0,29.1538909,75.7160693,0,,
9650,Shri Balaji Charitable Hospital,"Azad Gali, Rajguru Market, Hisar, Haryana, 125001",116.0,125001.0,29.2396596,75.8174505,0,,
9651,Singhal Medical and Dialysis Centre,"Katla Ramlila, Hisar, Haryana, 125001",116.0,125001.0,29.2396596,75.8174505,0,,
9652,Singla Dental And Facial Trauma Centre,"Near I. T. L, Model Town, Hisar, Haryana, 125001",116.0,125001.0,31.485722,74.3264869,0,,
9653,Soni Burns Hospital,"Near Jat College, Double Phatak, Hisar, Haryana, 125001",116.0,125001.0,29.2396596,75.8174505,0,,
9654,Sri Sai Medicare Center,"126-128 Dabra Chowk , Model Town, Hisar, Haryana, 125001",116.0,125001.0,29.1387042,75.7366361,0,,
9655,Sukhda Hospital,"Delhi Road Near Pushpa Complex, Hisar, Haryana, 125001",116.0,125001.0,28.898828,76.5875468,0,,
9656,Surya Hospital,"Near Peer Baba Ki Dargha ,Dabra Chowk, Hisar, Haryana, 125001",116.0,125001.0,29.2396596,75.8174505,0,,
9657,The Chest and Allergy Clinic,"Dr. Goyals Nursing Home Complex, Gandhi Chowk, Hisar, Haryana, 125001",116.0,125001.0,29.2396596,75.8174505,0,,
9658,The Subhash Verma Surgical Hospital,"Rishi Nagar, Near Bus Stand, Hisar, Haryana, 125001",116.0,125001.0,29.8008373,76.4264804,0,,
9659,Veer Hospital,"Budha Khera Road,Uklana Mandi, Hisar, Haryana, 125001",116.0,125001.0,29.2396596,75.8174505,0,,
9660,Vishnu Devi Zanana Hospital,"Mori Gate, Hisar, Haryana, 125001",116.0,125001.0,29.2396596,75.8174505,0,,
9661,Global Health Center,"Barwala, Hisar, Haryana, 125005",116.0,125005.0,29.3641876,75.9056753,0,,
9662,Holy Help Hospital,"#5, Dabra Road,Model Town, Hisar, Haryana, 125005",116.0,125005.0,29.1335361,75.7405016,0,,
9663,Jain Eye Hospital,"Dabra Road, Hisar, Haryana, 125005",116.0,125005.0,29.1275526,75.7439086,0,,
9664,Jawa Child Care Centre,"Sector-13, Dabra Road, Hisar, Haryana, 125005",116.0,125005.0,29.1335361,75.7405016,0,,
9665,Chum Children Hospital,"G T Road,Hansi, Hisar, Haryana, 125033",116.0,125033.0,29.0971845,75.9637413,0,,
9666,Dhatarwal Hospital -Maternity and Laproscopic Center,"Near  Chungi ,Hansi, Hisar, Haryana, 125033",116.0,125033.0,29.0971845,75.9637413,0,,
9667,Garg Orthopaedic and Janana Hospital,"Near Allahabd, Bank, Gas Agency Road, Hansi, Hisar, Haryana, 125033",116.0,125033.0,29.2396596,75.8174505,0,,
9668,Inder Sain Hospital,"Uttam Nagar, Hisar, Haryana, 125033",116.0,125033.0,29.0905725,75.9637205,0,,
9669,Kamla Devi Jaswant Singh Saini Hospital,"Shree Kali Devi Mandir Marg, Hansi, Hisar, Haryana, 125033",116.0,125033.0,29.2396596,75.8174505,0,,
9670,Likha Hospital,"Opp;- Bajrang Asram, Hansi, Hisar, Haryana, 125033",116.0,125033.0,29.2396596,75.8174505,0,,
9671,Malik Hospital,"Opp S.D.M ,Residence , Hansi, Hisar, Haryana, 125033",116.0,125033.0,29.2396596,75.8174505,0,,
9672,Shree Kali Devi Eye and General Hospital,"Hansi, Hisar, Haryana, 125033",116.0,125033.0,29.0971845,75.9637413,0,,
9673,Tanwar Hospital,"OppositePwd Office, Near Court, Uttam Nagar, Hansi, Hisar, Haryana, 125033",116.0,125033.0,29.0905725,75.9637205,0,,
9674,Tawar Hospital,"Near Pwd Office, Hisar, Haryana, 125033",116.0,125033.0,29.2396596,75.8174505,0,,
9675,The Heart Line Hospital,"Musudpur, Road, Tech. Hansi, Hisar, Haryana, 125033",116.0,125033.0,29.2396596,75.8174505,0,,
9676,Shanti Hospital,"Narnaund ,Near Khanda More, Hisar, Haryana, 125039",116.0,125039.0,29.2212667,76.1406925,0,,
9677,Agroha Medical College,"Agroha, Hisar, Haryana, 125047",116.0,125047.0,29.3306696,75.6330686,0,,
9678,Maharaja Agrasen Medical College and Hospital,"Agroha, Hisar, Haryana, 125047",116.0,125047.0,29.3306696,75.6330686,0,,
9679,Bajaj Orthopaedic Hospital,"Adampur, Hisar, Haryana, 125052",116.0,125052.0,29.2822533,75.4715692,0,,
9680,Krishan Surgical and General Hospital,"Jyani Market,Near Kranti Chowk,Mandi Adampur, Hisar, Haryana, 125052",116.0,125052.0,31.4329486,75.713901,0,,
9681,Apollo Hospital and Maternity Center,"Near Bus Stand, Ulkana Mandi, Ulkana, Hisar, Haryana, 125121",116.0,125121.0,29.2396596,75.8174505,0,,
9682,Goel Orthopaedic Hospital,"Barwala, Hisar, Haryana, 125121",116.0,125121.0,29.3641876,75.9056753,0,,
9683,Marvel Hospital,"Maa Lajwanti Road Uklana, Hisar, Haryana, 125121",116.0,125121.0,29.2396596,75.8174505,0,,
9684,Maharaja Agrasen Medical College,"Agroha, Haryana, Hisar, Haryana, 125047",116.0,125047.0,29.2396596,75.8174505,0,,
9685,"Eye-Q Super Speciality Eye Hospitals, Hisar, Barwala Road","H.No-433/9C/2, Tayal Garden, Barwala Road, Hisar, Haryana, 125005",116.0,125005.0,29.1694579,75.7268204,0,,
9686,"Eye-Q Super Speciality Eye Hospitals, Hisar, Jindal Chowk","Jindal Chowk, Hisar, Haryana, 125005",116.0,125005.0,29.2396596,75.8174505,0,,
9687,Jawa Children Hospital,"Child Care Centre, Sector-13, Hisar, Haryana, 125001",116.0,125001.0,28.6452089,77.3447853,0,,
9688,National Fertility and Test Tube Baby Centre,"Tayal Garden, Barwala Road, Hisar, Haryana, 125001",116.0,125001.0,29.1694579,75.7268204,0,,
9689,Geetanjali Hospital,"270-N, Gurudwara Road, Near Post Office, Model Town, Hisar, Haryana, 125005",116.0,125005.0,29.3869559,76.9564629,0,,
9690,"Dr. Anant Ram janta Hospital, Barwala","Hospital Road, Barwala, Hisar, Haryana, 125121",116.0,125121.0,29.2396596,75.8174505,0,,
9691,AMC Hospital,"Chudamani Complex, Champ Chowk, Delhi Road, Hisar, Haryana, 125001",116.0,125001.0,29.2396596,75.8174505,0,,
9692,Jindal Institute of Medical Sciences,"Model Town, Hisar, Haryana, 125005",116.0,125005.0,29.1339562,75.7422368,0,,
9693,Khetarpaul Hospital,"S.C.F 211, C.U.E.1, Green Square, Hisar, Haryana, 125001",116.0,125001.0,29.9577612,31.2752291,0,,
9694,Life Line Hospital of Medical Sciences,"Opposite Godara petrol pump\nAzad Nagar, Hisar, Haryana, 125001",116.0,125001.0,29.2396596,75.8174505,0,,
9695,Sharma Nursing Home,"Prem Nagar, Hisar, Haryana, 125001",116.0,125001.0,29.1538909,75.7160693,0,,
9696,Central Medical Centre (CMC),"Near Dabra Chowk, Delhi Road, Hisar, Haryana, 125001",116.0,125001.0,29.1517831,75.7257012,0,,
9697,Shanti Ano-Rectal Hospital,"Jindal Chowk, Model Town, Hisar, Haryana, 125005",116.0,125005.0,29.1345683,75.7473837,0,,
9698,Shanti Ano-Rectal Hospital and Kshar Sutra Centre,"Subhash park, Jindal Chowk, Hisar, Haryana, 125005",116.0,125005.0,29.133643,75.747238,0,,
9699,Brahm Shakti Sanjivani Hospital Pvt Ltd / Brahma Kumaris' Gobal Hospital and Research Centre,"Opp: Telephone Exchange Delhi Rohtak Road, Jhajjar, Haryana, 124103",119.0,124103.0,28.6830944,77.0216684,0,,
9700,General Hospital,"Opp Telephone Exchange, Jhajjar, Haryana, 124103",119.0,124103.0,52.984241,-1.486703,0,,
9701,Memorial Health Centre / Pd Memorial General Hospital,"Beri Road Near Stadium, Jhajjar, Haryana, 124103",119.0,124103.0,28.7020499,77.1871526,0,,
9702,Pushpa Hospital,"Delhi-Rohtak Road,Near Tehsil, Jhajjar, Haryana, 124103",119.0,124103.0,28.6830944,77.0216684,0,,
9703,Rakesh Medicare Centre,"Near Bus Stand, Jhajjar, Haryana, 124103",119.0,124103.0,28.5964461,76.6505366,0,,
9704,Shaili Nursing Home and U S Center,"Near Bus Stand , Rohtak Road, Jhajjar, Haryana, 124103",119.0,124103.0,28.6775351,77.1598792,0,,
9705,Kaushik Hospital,"Jhajgarh Road, Near Shiv Chowk, Beri, Jhajjar, Haryana, 124201",119.0,124201.0,28.5964461,76.6505366,0,,
9706,Lifeline Medical Centre,"Near Bus Stand , Beri, Jhajjar, Haryana, 124201",119.0,124201.0,28.7013322,76.5806097,0,,
9707,Shiva Hospital,"Main Delhi-Rohtak Road ,Behind Elysia Resetaurnat , Sampla, Jhajjar, Haryana, 124501",119.0,124501.0,28.5964461,76.6505366,0,,
9708,Tomar Medical Centre,"Near Petrol Pump, Opposite High School, Delhi Road, Sampla , Rohtak, Jhajjar, Haryana, 124501",119.0,124501.0,28.7775769,76.7711626,0,,
9709,Aastha Hospital U/O S K Aastha Hospital Pvt Ltd,"Main Najafgarh Road, Bahadurgarh, Jhajjar, Haryana, 124507",119.0,124507.0,28.6036627,76.9303751,0,,
9710,Bhandari Nursing Home,"Opp Bus Stand, Jhajjar, Haryana, 124507",119.0,124507.0,28.5964461,76.6505366,0,,
9711,Delhi Hospital and Nursing Home,"Main Delhi Road, Near Sainik Public School, Bahadurgarh, Jhajjar, Haryana, 124507",119.0,124507.0,28.6924464,76.9239727,0,,
9712,General Hospital,"Near Court, Bahadurgarh, Jhajjar, Haryana, 124507",119.0,124507.0,28.6758469,76.8951327,0,,
9713,Jeevan Jyoti Hospital,"Delhi-Rohtak Road, Mie, Bahadurgarh, Jhajjar, Haryana, 124507",119.0,124507.0,28.6896735,76.9467108,0,,
9714,Mamta Eye Clinic,"Model Town.Nahra Nahri Road,Bahadurgarh, Jhajjar, Haryana, 124507",119.0,124507.0,28.6931574,76.9323604,0,,
9715,Mata Sumitra Devi Hospital,"Near I.T.I  Road, Chhara Mor, Bahadurgarh, Jhajjar, Haryana, 124507",119.0,124507.0,28.6924464,76.9239727,0,,
9716,Mission Hospital,"Main Delhi-Rohtak Road, Near Main Bus Stand, Bahadurgarh, Jhajjar, Haryana, 124507",119.0,124507.0,28.6924464,76.9239727,0,,
9717,Pdm General Hospital / Pd Memorial General Hospital,"Sec-3A, Sarai Aurangabad, Bahadurgarh, Jhajjar, Haryana, 124507",119.0,124507.0,28.6877686,76.8908318,0,,
9718,Sri Rattan Singh Memorial Hospital,"Vatsa Colony, Main Nahra-Nahri Road, Line-Par, Bahadurgarh, Jhajjar, Haryana, 124507",119.0,124507.0,28.6924464,76.9239727,0,,
9719,Vandana Hospital and Research Center,"Bank Colony, Mahavir Park, Bahadurgarh, Jhajjar, Haryana, 124507",119.0,124507.0,28.6931639,76.9241418,0,,
9720,Shivam Hospital,"Nahra-Nahri Road, Line Par, Jhajjar, Haryana, 124507",119.0,124507.0,28.5964461,76.6505366,0,,
9721,Aastha Childrens Hospital,"Green View Hotel Building Gohana Road, Jind, Haryana, 126102",113.0,126102.0,29.3152073,76.314082,0,,
9722,Bal Dharmath Hospital/Bal Dharmarth Hospital,"Bhiwani Road, Jind, Haryana, 126102",113.0,126102.0,29.2948895,76.3091646,0,,
9723,Balaji Hospital,"Rohtak Road, Jind, Haryana, 126102",113.0,126102.0,29.2959438,76.3343067,0,,
9724,Ch. Hoshiar Singh Dalamwala Dharmarth Trust Hospital,"Safidon Road, Jind, Haryana, 126102",113.0,126102.0,29.3224574,76.3416407,0,,
9725,D. S. Dental and Oral Disease Clinic,"48, Adj Head Post Office, Vivekanand Nagar, Jind, Haryana, 126102",113.0,126102.0,29.3152073,76.314082,0,,
9726,Delhi Hospital And Maternity Home / Delhi Institute Of Trauma and Orthopaedics (Dito),"1151,Urban Estate Opp Courts, Jind, Haryana, 126102",113.0,126102.0,29.3152073,76.314082,0,,
9727,Disha Mission Hospital,"Scheme No-19,House No-53-54,Near Main Post Office, Jind, Haryana, 126102",113.0,126102.0,33.5190404,73.9023417,0,,
9728,Dr Shashi Sharma Maternity Hospital,"23/6, Gandhi Nagar, Opposite Bal Bhawan, Jind, Haryana, 126102",113.0,126102.0,29.3152073,76.314082,0,,
9729,Garg Heart and Child Care Centre,"Scheme No -6 ,Gohana Road, Jind, Haryana, 126102",113.0,126102.0,29.3152073,76.314082,0,,
9730,Goel Orthopaedic Centre,"Scf-15-16 ,Pwd B&R Store Land ,Opp Drda Gohana Road, Jind, Haryana, 126102",113.0,126102.0,29.3152073,76.314082,0,,
9731,Gupta Maternity And General Hospital,"Rohtaj Road, Jind, Haryana, 126102",113.0,126102.0,29.3211153,76.3058328,0,,
9732,Jain Charitable Hospital / Jain Dharmarth Netar Chikatsalya,"Opp Bus Stand, Gohaana Road, Jind, Haryana, 126102",113.0,126102.0,29.3152073,76.314082,0,,
9733,Jind Nursing Home,"Near Rani Talab, Jind, Haryana, 126102",113.0,126102.0,29.3153515,76.3188616,0,,
9734,Kharab Hospital,"Scf-29-30,t Shopping Centre,Huda Ground, Jind, Haryana, 126102",113.0,126102.0,29.3152073,76.314082,0,,
9735,Kumar Maternity Home,"Bhiwani Road, Jind, Haryana, 126102",113.0,126102.0,29.2948895,76.3091646,0,,
9736,Laxmi Nursing Home,"Luxmi Nagar, Rohtak Road, Jind, Haryana, 126102",113.0,126102.0,28.682095,77.0512156,0,,
9737,Maharaja Agarsen Hospital / Maharaja Agrasen Hospital,"Opposite Bal Bhawan, Scheme No. 6, Jind, Haryana, 126102",113.0,126102.0,29.3152073,76.314082,0,,
9738,Mahavir Hospital,"Near Old Subzi Mandi, Jind, Haryana, 126102",113.0,126102.0,29.3211153,76.3058328,0,,
9739,Mangla Hospital,"Sc Flat 2,3, Near Bank Of India, Scheme No.-6, Gandhi Nagar, Jind, Haryana, 126102",113.0,126102.0,33.836081,-81.1637245,0,,
9740,Maya Devi Hospital / Maya Medicare,"Near New Subzi Mandi, Jind, Haryana, 126102",113.0,126102.0,29.3211153,76.3058328,0,,
9741,Minakshi Jain Hospital,"No. 54-5516, Gandhi Nagar,Near Bus Stand, Jind, Haryana, 126102",113.0,126102.0,30.8993149,75.8455906,0,,
9742,Nath Nursing Home,"Near S.D. High School,Sainath Road, Jind, Haryana, 126102",113.0,126102.0,20.012327,73.785743,0,,
9743,Nirmal Eye Hospital,"173/19 Vivekanand Nagar, Jind, Haryana, 126102",113.0,126102.0,28.6526354,77.4528794,0,,
9744,Ravindra Nursing Home and Maternity Centre,"Near Mandir More , Railway Road ,  Junction, Jind, Haryana, 126102",113.0,126102.0,29.3152073,76.314082,0,,
9745,Sachdeva Maternity and General Hospital,"Puran Vihar,Jagadhari, Jind, Haryana, 126102",113.0,126102.0,29.3152073,76.314082,0,,
9746,Sanjeevani Hospital,"Near Drda & Govt College, Gohana Road, Jind, Haryana, 126102",113.0,126102.0,29.3152073,76.314082,0,,
9747,Shanti Bindlish Charitable Hospital,"Old Court Road,Near Rani Talab, Jind, Haryana, 126102",113.0,126102.0,29.3141324,76.3164634,0,,
9748,Shanti Nursing Home,"Luxmi Nagar, Rohtak Road, Jind, Haryana, 126102",113.0,126102.0,28.682095,77.0512156,0,,
9749,Civil Hospital,"Safidon, Jind, Haryana, 126112",113.0,126112.0,29.4060653,76.6614853,0,,
9750,Sehrawat Hospital,"Railway Road, Safidon, Jind, Haryana, 126112",113.0,126112.0,29.4004122,76.6608749,0,,
9751,General Hospital,"Narwana, Jind, Haryana, 126116",113.0,126116.0,29.5910963,76.1145993,0,,
9752,General Hospital Narwana,"Narwana, Jind, Haryana, 126116",113.0,126116.0,29.5910963,76.1145993,0,,
9753,Sarvodaya Hospital and I C U,"Nr. Hanuman Mandir, Jota Farm, Safidon Road, Jind, Haryana, 126116",113.0,126116.0,29.3152073,76.314082,0,,
9754,Shanti Simriti Eye And General Hospital,"Canal Road, Narwana, Jind, Haryana, 126116",113.0,126116.0,29.587566,76.1238545,0,,
9755,Gangaputra Hospital and Research Centre,"Kaithal Road, Kandela, Jind, Haryana, 126102",113.0,126102.0,29.7856734,76.3984537,0,,
9756,Dr. Meenakshi Jain Hospital,"55/6, Gandhi Nagar, Near Telegraph Office, Jind, Haryana, 126102",113.0,126102.0,12.9831164,80.2207518,0,,
9757,Aarya Spiral Ct Scan Centre,"Pehowa Road, Kaithal, Haryana, 136027",109.0,136027.0,29.884133,76.621062,0,,
