hospital_id,hospital_name,address,district_id,pincode,latitude,longitude,mco_contact_number,total_beds,hospital_type
9956,J N Shori Multi Speciality Hospital,"Nalagarh Road, P. O. Pinjore, Panchkula, Haryana, 134102",105.0,134102.0,31.0381011,76.7118672,0,,
9957,Khera Hospital / Khera Hospital and X-Ray Centre,"45 Shiva Complex Main Bazar Pinjore, Panchkula, Haryana, 134102",105.0,134102.0,30.797013,76.9177947,0,,
9958,Khurana Hospital,"Near Railyway Crossing, Kalka Road, Pinjore, Panchkula, Haryana, 134102",105.0,134102.0,30.7628772,76.9049316,0,,
9959,Aarogya Hospital,"# 1303- P, Sector-21, New Grain Market Road, Panchkula, Haryana, 134109",105.0,134109.0,30.6975401,76.8551066,0,,
9960,Alchemist Hospitals Ltd. / (Formerly Know As Kaiser Hospital Ltd.),"Sector - 21, Panchkula, Haryana, 134109",105.0,134109.0,30.6747384,76.8634479,0,,
9961,Bajaj Bone and Joint Clinic,"K.No 889 ,Sector-4, Panchkula, Haryana, 134109",105.0,134109.0,30.6903348,76.8609575,0,,
9962,Bandhu Nursing Home,"469 Sector 7, Panchkula, Haryana, 134109",105.0,134109.0,30.7052881,76.844708,0,,
9963,Chakravarty Nursing Home / Chakshu Clinic,"207, Sector-10, Panchkula, Haryana, 134109",105.0,134109.0,30.6898813,76.8483677,0,,
9964,Childrens Hospital,"Swastik Vihar, Phase I, Sector - 5, Mansa Devi Complex, Panchkula, Haryana, 134109",105.0,134109.0,30.6975401,76.8551066,0,,
9965,Command Hospital,"Western Command Chandimandir Registered Hospital: Military Hospital Code, Panchkula, Haryana, 134109",105.0,134109.0,30.6975401,76.8551066,0,,
9966,Dhar Pediatric Centre,"Sco 94 Ff Swastik Vihar, Panchkula, Haryana, 134109",105.0,134109.0,30.6975401,76.8551066,0,,
9967,Dhir Clinic,"Sector-4, Panchkula, Haryana, 134109",105.0,134109.0,30.6975401,76.8551066,0,,
9968,Divine Eye Clinic,"705, Sector 4, Panchkula, Haryana, 134109",105.0,134109.0,30.6903348,76.8609575,0,,
9969,Divya Chikitsa Sewa Kendra,"Disha Orcade,Samerock School,Mansa Devi Complex,(Near Railway Fatak),Sector-4, Panchkula, Haryana, 134109",105.0,134109.0,30.6975401,76.8551066,0,,
9970,Dr Bakshis Clinical Laboratory,"H.No- 702, Sector-9, Panchkula, Haryana, 134109",105.0,134109.0,30.6953385,76.8436041,0,,
9971,Dr Bindals Dental Clinic and Implant Center,"S.C.O-2 ,First Floor,Sector-11, Panchkula, Haryana, 134109",105.0,134109.0,13.735566,-89.0517287,0,,
9972,Dr Krishan Lal Singla Nursing Home,"44 Sector-6, Panchkula, Haryana, 134109",105.0,134109.0,30.7064709,76.8562405,0,,
9973,Dr Monicas Laser Eye Clinic,"Sco -4 Swastik Vihar ,Mansa Devi Complex, Panchkula, Haryana, 134109",105.0,134109.0,30.6975401,76.8551066,0,,
9974,Gokul Surgical Hospital,"# 1034, Sector - 15, Panchkula, Haryana, 134109",105.0,134109.0,30.684933,76.8389413,0,,
9975,Gupta Gynae Centre,"H No 685, Sector 12-A, Panchkula, Haryana, 134109",105.0,134109.0,10.4924429,-66.9499217,0,,
9976,Gupta Nursing Home,"House No-576, , Sector-16, Panchkula, Haryana, 134109",105.0,134109.0,26.88728,80.9940139,0,,
9977,Gupta`S Dental Hospital,"Swastik Vihar,Sector 5,Mansa Devi Road, Panchkula, Haryana, 134109",105.0,134109.0,30.6975401,76.8551066,0,,
9978,Happy Family Maternitys Children Hospital Pvt Ltd,"Nursing Home Site No.-1, , Adjoining Gh-34, Sector-5,  (Mansadevi Complex), Panchkula, Haryana, 134109",105.0,134109.0,30.6975401,76.8551066,0,,
9979,Institute Of Reproduction and Child Cares,"Site No.3, Sector-17,Near Gowri Shankar Mandir, Panchkula, Haryana, 134109",105.0,134109.0,30.6975401,76.8551066,0,,
9980,Jindal Nursing Home,"602, Sector-7, Panchkula, Haryana, 134109",105.0,134109.0,30.7052881,76.844708,0,,
9981,Jyoti Dental and Eye Care Centre,"No.621, Sector-16, Panchkula, Haryana, 134109",105.0,134109.0,30.6918894,76.8370739,0,,
9982,Kamla Charitable Diagnostic Centre,"Scf-65 ,Sector-6, Panchkula, Haryana, 134109",105.0,134109.0,30.7064709,76.8562405,0,,
9983,Kaps Diagnoscan Centre,"Sco 12/5/Mdc/Pkl, On Chadkalka Highway, Panchkula, Haryana, 134109",105.0,134109.0,30.6975401,76.8551066,0,,
9984,Kl Nursing Home,"House No-46,Sector 6, Panchkula, Haryana, 134109",105.0,134109.0,30.7064709,76.8562405,0,,
9985,Makkar Dental Clinic,"Sco 298 Sec. 20, Panchkula, Haryana, 134109",105.0,134109.0,30.6942091,76.860565,0,,
9986,Malhotra Nursing Home,"# 302, Sector-7, Panchkula, Haryana, 134109",105.0,134109.0,30.7052881,76.844708,0,,
9987,Mehta Medical Centre,"254, Sector 17, Panchkula, Haryana, 134109",105.0,134109.0,30.6987539,76.8360578,0,,
9988,Narula Nursing Home,"#131, Sector 7, Panchkula, Haryana, 134109",105.0,134109.0,30.7052881,76.844708,0,,
9989,Noheria Nursing Home,"#807, Dilsukhnagar, Panchkula, Haryana, 134109",105.0,134109.0,30.6942091,76.860565,0,,
9990,Ortho Centre / Ortho Nava Hospital,"# 873, Sector - 8, Panchkula, Haryana, 134109",105.0,134109.0,30.6996417,76.844708,0,,
9991,Orthomax Bone and Joint Hospital,"Behind Raghunath Mandir, Nursing Home Site No1,Sector-15, Panchkula, Haryana, 134109",105.0,134109.0,30.6975401,76.8551066,0,,
9992,Orthomax Group,"Nursing Home, Site-1, Opposite Raghunathan Temple, Sector-15, Panchkula, Haryana, 134109",105.0,134109.0,30.6975401,76.8551066,0,,
9993,Orthonova Clinic,"#11 ,Sector-2, Panchkula, Haryana, 134109",105.0,134109.0,30.6960639,76.8648893,0,,
9994,Pardeep Allergy Centre,"Clinic Cum-Residence 298, Sec-15, Panchkula, Haryana, 134109",105.0,134109.0,30.6975401,76.8551066,0,,
9995,Phoneix Hospital,"Sco-8 Sector-16, Panchkula, Haryana, 134109",105.0,134109.0,30.6918894,76.8370739,0,,
9996,Pulse Hospital,"Sector-17, Panchkula, Haryana, 134109",105.0,134109.0,30.6987539,76.8360578,0,,
9997,Radha Devi Amravati Polyclinic,"Kalka National Highway-22, Amravati Enclave, Panchkula, Haryana, 134109",105.0,134109.0,30.6975401,76.8551066,0,,
9998,Raffels Hospital Pvt. Ltd.,"Sco-138, Sector-14, Panchkula, Haryana, 134109",105.0,134109.0,30.6798774,76.844708,0,,
9999,Shri Ram Clinic,"1187, Sector -11, Panchkula, Haryana, 134109",105.0,134109.0,30.6942091,76.860565,0,,
10000,Shriram Multispeciality Hospital,"House No-1187,Sector 11, Panchkula, Haryana, 134109",105.0,134109.0,23.2364974,-106.4237436,0,,
10001,Shubham Hospital and Diagnostic Center,"Sco289 Dss254, Sector-20, Panchkula, Haryana, 134109",105.0,134109.0,30.6975401,76.8551066,0,,
10002,Siddarth Nursing Home,"House No-851,Sector 17, Panchkula, Haryana, 134109",105.0,134109.0,30.7398339,76.782702,0,,
10003,Sidharrth Nursing Home,"H.No- 30,Sector 12-A, Panchkula, Haryana, 134109",105.0,134109.0,30.6942091,76.860565,0,,
10004,Singla Child Care Centre,"651,Sector-12, Panchkula, Haryana, 134109",105.0,134109.0,30.6975401,76.8551066,0,,
10005,Subham Hospital and Diagnostic Centre,"S.C.O. 289 & Dss 254, Sector-20, Panchkula, Haryana, 134109",105.0,134109.0,30.6975401,76.8551066,0,,
10006,Takkar Dental Clinic,"496.Sector-9, Panchkula, Haryana, 134109",105.0,134109.0,30.6953385,76.8436041,0,,
10007,Verma Maternity Centre7Nursing Home,"270,Sector-6, Panchkula, Haryana, 134109",105.0,134109.0,30.7064709,76.8562405,0,,
10008,Vohra Clinical Laboratories,"#1617 Sector 15,Opp Shri Guru Ravidass Bhawan, Panchkula, Haryana, 134109",105.0,134109.0,30.6975401,76.8551066,0,,
10009,Chc Raipur Rani,"Raipur Rani, Panchkula, Haryana, 134204",105.0,134204.0,30.583187,77.0190228,0,,
10010,"Alchemist Hospital, Panchkula","Sector 21, Panchkula, Haryana, 134112",105.0,134112.0,30.6747384,76.8634479,0,,
10011,Chakravarty Nursing Home,"207, Sector 10, Panchkula, Haryana, 134109",105.0,134109.0,30.6898813,76.8483677,0,,
10012,Chakravarty Polyclinics,"208, Sector-10, Panchkula, Haryana, 134109",105.0,134109.0,30.6898813,76.8483677,0,,
10013,Drishti Eye Hospital,"SCO-26, Sector-11, Panchkula, Haryana, 134109",105.0,134109.0,30.6864116,76.8533575,0,,
10014,Shri Ram Hospital,"1187, Sector 11, Near Main Bus Stand, Panchkula, Haryana, 134112",105.0,134112.0,23.216719,72.6421769,0,,
10015,Phoenix Hospital,"SCO 8, Sector 16, Panchkula, Haryana, 134108",105.0,134108.0,30.6918894,76.8370739,0,,
10016,"A R Mittal Hospital,","A R Mittal Hospital,Gohana Road, Panipat, Haryana, 132103",111.0,132103.0,35.20105,-91.8318334,0,,
10017,A S Dahiya Hospital / A.S Dhaiya Hospital,"2, Arya Nagar, Asandh Road, Panipat, Haryana, 132103",111.0,132103.0,29.3936623,76.947512,0,,
10018,Aarti Nursing Home,"Teshil Road, Panipat, Haryana, 132103",111.0,132103.0,29.3909464,76.9635023,0,,
10019,Abrol Medical and Heart Care Centre,"20,Nehru Nagar,Tehsil Town, Panipat, Haryana, 132103",111.0,132103.0,29.3912753,76.9771675,0,,
10020,Aggarwal Eye Hospital,"Gohana Road ,Near Gt Road, Panipat, Haryana, 132103",111.0,132103.0,29.3788655,76.9656473,0,,
10021,Ahuja Hospital Pvt.Ltd,"Ahuja Hospital Pvt.Ltd,Sanoli Road, Panipat, Haryana, 132103",111.0,132103.0,29.3912753,76.9771675,0,,
10022,Akash Hospital,"New Grain Market, Samalkha, Panipat, Haryana, 132103",111.0,132103.0,29.2405629,77.0113048,0,,
10023,Altius Maharaja Agarsain Hospital,"Near Devi Mandir, Panipat, Haryana, 132103",111.0,132103.0,29.3909464,76.9635023,0,,
10024,Amar Hospital,"Waiser RoadMadlauda, Panipat, Haryana, 132103",111.0,132103.0,29.3909464,76.9635023,0,,
10025,Anand Hospital Navdeep Eye Center / Anand Nursing Home,"No.105 Adarsh Nagar Near Head Post Office, Panipat, Haryana, 132103",111.0,132103.0,17.4068477,78.4623915,0,,
10026,Arora Psychiatric Nursing Home,"811 ,Model Town, Panipat, Haryana, 132103",111.0,132103.0,29.388958,76.9599852,0,,
10027,B K Gupta Eye Hospital,"Near Lal Tanki, Ram Lal Chowk, Panipat, Haryana, 132103",111.0,132103.0,29.3912753,76.9771675,0,,
10028,Bajaj Eye Centre,"206 , New Sukdev Nagar, Panipat, Haryana, 132103",111.0,132103.0,28.6971398,77.1596946,0,,
10029,Batra Hospital,"550,Sector - Ii,Huda, Panipat, Haryana, 132103",111.0,132103.0,29.3622905,76.9931074,0,,
10030,Bhatia Hospital,"Bhatia Hospital,3 - C,Narayan Singh Park, Panipat, Haryana, 132103",111.0,132103.0,29.3912753,76.9771675,0,,
10031,Chander Shekhar Rewari Memorial Trust,"Opposite Malikpetrolpump,Sanoli Road, Panipat, Haryana, 132103",111.0,132103.0,29.3912753,76.9771675,0,,
10032,Chaturbhuj Leelawati Trust Hospital and Nursing Home / Chaterbuj Trust Hospital,"Ralways Road, Panipat, Haryana, 132103",111.0,132103.0,29.3909464,76.9635023,0,,
10033,Chhabra Hospital,"1, Narian Singh Park Assandh Road, Panipat, Haryana, 132103",111.0,132103.0,29.3955427,76.9580198,0,,
10034,City Medical Care Hospital,"Sanouli Road Near Bhim Goda Mandir, Panipat, Haryana, 132103",111.0,132103.0,29.3912753,76.9771675,0,,
10035,Civil Hospital,"Bus Stand, Panipat, Haryana, 132103",111.0,132103.0,29.3909464,76.9635023,0,,
10036,D.K. Gastro-Care Clinic,"203, Sukhdev Nagar, Panipat, Haryana, 132103",111.0,132103.0,29.3986523,76.971507,0,,
10037,D.N.Batra Hospital,"Gohana Road, Panipat, Haryana, 132103",111.0,132103.0,29.3781682,76.9644342,0,,
10038,Delhi Eye Hospital,"123,Sukhdev Nagar, Panipat, Haryana, 132103",111.0,132103.0,29.3986523,76.971507,0,,
10039,Dewan Diagnostic Centre and Dental Clinic,"614, Near Ram Sharnam Ashram, Panipat, Haryana, 132103",111.0,132103.0,29.3912753,76.9771675,0,,
10040,Dilsukh Hospital,"Ward No.11 , Octroi Kutani Road, Panipat, Haryana, 132103",111.0,132103.0,29.3912753,76.9771675,0,,
10041,Dn Hospital,"Gohana Road Krishan Pura, Panipat, Haryana, 132103",111.0,132103.0,29.3781682,76.9644342,0,,
10042,Dr Bharat General and Dental Hospital,"5/9, Near Shiv Chowk, Sanoli Road, Panipat, Haryana, 132103",111.0,132103.0,29.388306,76.9780583,0,,
10043,Dr Narayana Datta Hospital,"Model Town, Panipat, Haryana, 132103",111.0,132103.0,29.388958,76.9599852,0,,
10044,Dr Sudhir Sabharwal Orthopaedic Center,"2, Gole Market, Model Town, Panipat, Haryana, 132103",111.0,132103.0,28.7065412,77.1905524,0,,
10045,Dr. G.C. Gupta Hospital,"372-373 Huda, Phase -1, Sector- 11-12, Panipat, Haryana, 132103",111.0,132103.0,29.3735591,76.9772675,0,,
10046,Dr. Rahul Mittal Memorial Hospital,"Dr. Rahul Mittal Memorial Hospital, 316,Model Town, Panipat, Haryana, 132103",111.0,132103.0,29.3912753,76.9771675,0,,
10047,Dr.Chaudary Hospital,"971/24,Jatal Road, Panipat, Haryana, 132103",111.0,132103.0,29.3759124,76.9451241,0,,
10048,"Dr.Jetinder Sharma Hospital,","Dr. Jetinder Sharma Hospital,Near Bus Stand, Panipat, Haryana, 132103",111.0,132103.0,29.3912753,76.9771675,0,,
10049,Dr.Narayan Datt Hospital,"Model Town, Panipat, Haryana, 132103",111.0,132103.0,29.388958,76.9599852,0,,
10050,Dr.Ravindera Maternity and General Hospital,"#638, Model Town,Near Pruthi Chowk, Panipat, Haryana, 132103",111.0,132103.0,29.3912753,76.9771675,0,,
10051,Gandhi Hospital,"Tehsil Road ,( Behind Civil Hospital), Panipat, Haryana, 132103",111.0,132103.0,29.3912753,76.9771675,0,,
10052,Gaurav Hospital And Heart Care Centre,"Near Bhim Goda Mandir, Sanoli Road, Panipat, Haryana, 132103",111.0,132103.0,29.3912753,76.9771675,0,,
10053,Geeta Hospital,"Geeta Hospital,46 - B,Narain Singh Park, Panipat, Haryana, 132103",111.0,132103.0,29.3912753,76.9771675,0,,
10054,Goel Children Hospital,"Bhim Goda Mandir Chowk , Sanoli Road, Panipat, Haryana, 132103",111.0,132103.0,29.3912753,76.9771675,0,,
10055,Heritage Hospitals Pvt Ltd,"Plot No-145, Vijay Nagar, Panipat, Haryana, 132103",111.0,132103.0,28.6516342,77.4209149,0,,
10056,Hyderabadi General Hospital and Nursing Home,"Sanoli Road Sanjay Chowk, Panipat, Haryana, 132103",111.0,132103.0,29.3897296,76.97317,0,,
10057,Jain Ent Center,"117 , Sukhdev Nagar, Panipat, Haryana, 132103",111.0,132103.0,29.3986523,76.971507,0,,
10058,"Jindal Nursing Home,","Jindal Nursing Home,50 Devi Multi Colony, Panipat, Haryana, 132103",111.0,132103.0,29.3912753,76.9771675,0,,
10059,Jitendra Hospital,"126, Sukhdev Nagar Jitindra Hospital Lane, Panipat, Haryana, 132103",111.0,132103.0,29.3912753,76.9771675,0,,
10060,Kapila Hospital,"Padaw, Samalkha, Panipat, Haryana, 132103",111.0,132103.0,29.2405629,77.0113048,0,,
10061,Khurana Hospital and Maternity Centre,"Tehshil Road Behind Civil Hospital, Panipat, Haryana, 132103",111.0,132103.0,29.3912753,76.9771675,0,,
10062,Kohli Nursing Home,"Sarang Road, Panipat, Haryana, 132103",111.0,132103.0,29.3909464,76.9635023,0,,
10063,Kundu Hospital,"Gohana Road, Panipat, Haryana, 132103",111.0,132103.0,29.3781682,76.9644342,0,,
10064,Lala Harbhagwan Das Memorial And Dr Prem Hospital / Lala Harbhagwan Dass Memorial and Dr.Prem Hospital,"Bishan Swaroop Colony, Panipat, Haryana, 132103",111.0,132103.0,29.3912753,76.9771675,0,,
10065,Madhumita Hospital and Diagnostic Centre,"Madhumita Hospital & Diagnostic Centre,G.T.RoadNear Gohana Chowk, Panipat, Haryana, 132103",111.0,132103.0,29.3912753,76.9771675,0,,
10066,Malhotra Mother and Child Hospital,"656-R, Pruthi Chowk, Model Town, Panipat, Haryana, 132103",111.0,132103.0,29.3912753,76.9771675,0,,
10067,Malik Hospital,"Gohana Road (Near G.T.Road), Panipat, Haryana, 132103",111.0,132103.0,29.3788655,76.9656473,0,,
10068,Manisha Maternity And General Hospital,"Ram Mandir , Opposite Mithan Sweets Teh. Camp, Panipat, Haryana, 132103",111.0,132103.0,29.3912753,76.9771675,0,,
10069,Mittal Chest Allegery and General Hospital,"396, Huda Colony, Sector - Ii, Panipat, Haryana, 132103",111.0,132103.0,28.8916618,76.635549,0,,
10070,Navjevan Charitable Hospital / Navjeevan Doctor House,"Saini Factory Wali Gali,Purewal Colony,Kacha Camp,Near Weaver Service Centre, Panipat, Haryana, 132103",111.0,132103.0,29.3912753,76.9771675,0,,
10071,Neeraj Hospital / Neraj Hospital,"No. 103, L Model Town, Panipat, Haryana, 132103",111.0,132103.0,37.3661655,-104.2105516,0,,
10072,Pahuja Hospital,"18 Nehru Nagar, Behind Skylark, Panipat, Haryana, 132103",111.0,132103.0,29.3912753,76.9771675,0,,
10073,Panipat Cath Lab and Heart Care Centre,"2Nd Floor, Prem Hospital ,Bishan Saroop Colony ,Opp Bus Stand, Panipat, Haryana, 132103",111.0,132103.0,29.3912753,76.9771675,0,,
10074,Pawananjali Hospital,"Near Babail Chowk, Sanoli Road, Panipat, Haryana, 132103",111.0,132103.0,29.3912753,76.9771675,0,,
10075,Prabhakar Hospital / Prabhakar Hospital- I,"Prabhakar Hospital,1,Assamdh Road, Panipat, Haryana, 132103",111.0,132103.0,29.3912753,76.9771675,0,,
10076,Prem Hospital,"Bishan Saroop Colony, Opp Bus Stand, Panipat, Haryana, 132103",111.0,132103.0,29.3912753,76.9771675,0,,
10077,Pritam Nursing Home,"1119, Bishan Sarup Colony,, Panipat, Haryana, 132103",111.0,132103.0,29.3980821,76.9657463,0,,
10078,R P Stone Clinic Pvt Ltd,"Scf. 33-31, Sector11, Urban State, Panipat, Haryana, 132103",111.0,132103.0,29.3912753,76.9771675,0,,
10079,Raghudeep Hospital,"Raghudeep Hospital,39 B,N.S.Park, Panipat, Haryana, 132103",111.0,132103.0,29.3912753,76.9771675,0,,
10080,Rainbow Children Hospital,"No. 152-R, Model Town, Panipat, Haryana, 132103",111.0,132103.0,30.9504406,74.6151551,0,,
10081,Renew R. P Endoscopic and Enitre Women Diseases Clin,"S. C. F 30 & 31, Sector 11, Urban Estate (Huda Colony ), Panipat, Haryana, 132103",111.0,132103.0,33.836081,-81.1637245,0,,
10082,Sai Ram Nursing Home,"Jattal Road, Panipat, Haryana, 132103",111.0,132103.0,29.3909464,76.9635023,0,,
10083,Sanjeevani Nursing Home / Sanjeevni Nursing Home,"Salar Gunj Gate, Insar Bazar Rd, Sukhdev Nagar, Old Housing Board Colony, Panipat, Haryana, 132103",111.0,132103.0,29.3912753,76.9771675,0,,
10084,Sanjiv Singla Children Hospital,"Saloni Road , Khushi Garden Wali Gali, Panipat, Haryana, 132103",111.0,132103.0,29.3912753,76.9771675,0,,
10085,Saradana Hospital / Sardana Hospital,"Gohana Rd, Panipat, Haryana, 132103",111.0,132103.0,29.3781682,76.9644342,0,,
10086,Shipra Hospitals Pvt. Ltd.,"Plot No.-154, Vijay Nagar, Panipat, Haryana, 132103",111.0,132103.0,28.6515136,77.4208293,0,,
10087,Shree Balaji Hospital and Health Care Centre / Shree Balajee Hospital and Heart Care Centre,"47,Devi Murti Colony,Behind Civil Hospital,Near Hawa Singh Hospital, Panipat, Haryana, 132103",111.0,132103.0,29.3912753,76.9771675,0,,
10088,Shri Hyderabadi Biradari Shiksha and Medical Sanstha,"Sanoli Road, Panipat, Haryana, 132103",111.0,132103.0,29.3872866,76.9993642,0,,
10089,Shri Radha Krishna Charitable Eye Hospital,"Sanoli Road Near Bhim Goda Mandir, Panipat, Haryana, 132103",111.0,132103.0,29.3912753,76.9771675,0,,
10090,Singla Nursing Home,"Near Ramlalchowk. Model Town, Panipat, Haryana, 132103",111.0,132103.0,29.3912753,76.9771675,0,,
10091,Sombeer Hospital / Sombir Hospital / Somdir Hospital,"Khanna Road Near Gohana Road, Panipat, Haryana, 132103",111.0,132103.0,29.3776606,76.9693889,0,,
10092,Soni Hospital,"435-L, Model Town, Panipat, Haryana, 132103",111.0,132103.0,29.388958,76.9599852,0,,
10093,Talwar Nursing Home,"Tehsil Road Behind Civil Hospital, Panipat, Haryana, 132103",111.0,132103.0,29.3912753,76.9771675,0,,
10094,Tandon Hospital,"Tehsil Road Behind Civil Hospital, Panipat, Haryana, 132103",111.0,132103.0,29.3912753,76.9771675,0,,
10095,Tikku Hoapital,"Tikku Hoapital,658,Model Town, Panipat, Haryana, 132103",111.0,132103.0,29.3912753,76.9771675,0,,
10096,"ESI Hospital, Panipat","ESIC  Building, Panipat, Haryana, 132103",111.0,132103.0,29.3909464,76.9635023,0,,
10097,Madaan Hospital,"Assandh Road, Model Town, Panipat, Haryana, 132103",111.0,132103.0,29.3942309,76.9467794,0,,
10098,Ravindra Hospital\n,"638, Model Town, Panipat, Haryana, 132103",111.0,132103.0,29.388958,76.9599852,0,,
10099,Aman Hospital,"Aman Hospital, Bishal Swaroop, Colony, Panipat, Haryana, 132103",111.0,132103.0,29.3912753,76.9771675,0,,
10100,Chhabra Star Hospital.,"1-A, Narain Singh Park, Assandh Road, Model Town, Panipat, Haryana, 132103",111.0,132103.0,29.3912753,76.9771675,0,,
10101,Dewan Dental Clinic and Diagnostic Centre,"614, Model Town, OppositeRam Sharnam Ashram (Shakuntla mandir), Panipat, Haryana, 132103",111.0,132103.0,29.3912753,76.9771675,0,,
10102,Dr. G.C.Gupta Hospital,"372-373, Huda Sec-2, Panipat, Haryana, 132103",111.0,132103.0,29.3909464,76.9635023,0,,
10103,Malhotra Mother and Child Hospital,"656-R, Pruthi Chowk, Model Town, Panipat, Haryana, 132103",111.0,132103.0,29.3912753,76.9771675,0,,
10104,"R P Stone Clinic Pvt.Ltd., Panipat","SCF: 30-31, Sector-11, Near Angel Prime Mall, Huda Colony, Panipat, Haryana, 132103",111.0,132103.0,29.3912753,76.9771675,0,,
10105,Apex Hospital And Trauma Centre / Apex Hospital (Multi Speciality Centre),"Plot No: 5 (Near S B I) Sector 6 Dharuhera, Rewari, Haryana, 123106",121.0,123106.0,28.2142461,76.7985669,0,,
10106,Aaroh Hospital,"Opposite Jain Publichigh School, New Civil Hospital, Circular Road, Rewari, Haryana, 123401",121.0,123401.0,28.1956468,76.6165179,0,,
10107,Aditya Neuro and Spine Speciality Hospital,"Circular Road, Near Kanod Gate, Rewari, Haryana, 123401",121.0,123401.0,28.1956468,76.6165179,0,,
10108,Ahuja Hospital,"Near Modawala Mandir Main Gate, Delhi Road, Narnaul, Rewari, Haryana, 123401",121.0,123401.0,28.0657961,76.1014781,0,,
10109,Apex Hospital and Trauma Centre,"70, Km Milestone, Opposite Sec.-6 Housing Board Colony Daruhera, Rewari, Haryana, 123401",121.0,123401.0,28.1956468,76.6165179,0,,
10110,Arora Nursing Home,"Model Town, Rewari, Haryana, 123401",121.0,123401.0,28.1877433,76.6167212,0,,
10111,Arvind Yadav Hospital and Research Center,"Dharuhera Chowk, Circular Road, Rewari, Haryana, 123401",121.0,123401.0,28.1956468,76.6165179,0,,
10112,Atam Prakash Hospital,"Near New Anaj Mandi, Bharawas Road, Rewari, Haryana, 123401",121.0,123401.0,28.1956468,76.6165179,0,,
10113,Bansal Hospital Heart Care Center,"G.T. Road Old Bus Stand, Rewari, Haryana, 123401",121.0,123401.0,31.1027186,77.1602007,0,,
10114,Birendra Hospital,"Leo Chowk, Rewari, Haryana, 123401",121.0,123401.0,28.1927631,76.6239423,0,,
10115,City Care Hospital,"Sco No-24, Huda Shopping Complex, Sector -4, Rewari, Haryana, 123401",121.0,123401.0,28.1956468,76.6165179,0,,
10116,Civil Hospital,"Circular Road, Rewari, Haryana, 123401",121.0,123401.0,28.1933219,76.6203179,0,,
10117,Deep Hospital,"Opp Government Girls Sec School Circular Road, Rewari, Haryana, 123401",121.0,123401.0,28.1956468,76.6165179,0,,
10118,Dr B L Goyal Nursing Home,"Near Naiwali Chok Cerculer Road, Rewari, Haryana, 123401",121.0,123401.0,28.1956468,76.6165179,0,,
10119,Dr Bhargava Hospital and Nursing Home,"Near Punjabi Dharamshala, Circular Road, Rewari, Haryana, 123401",121.0,123401.0,28.1956468,76.6165179,0,,
10120,Dr S P Yadav Multispecilty Hospital,"Near Kanod Gate, Circular Road, Rewari, Haryana, 123401",121.0,123401.0,28.1956468,76.6165179,0,,
10121,Dr. Arora Vijay Memorial Hospital,"201-R,Model Town, Rewari, Haryana, 123401",121.0,123401.0,28.1877433,76.6167212,0,,
10122,Dr. Kaushal Surgical Hospital and Maternity Home,"Court Road, Model Town, Rewari, Haryana, 123401",121.0,123401.0,31.6386589,74.8659017,0,,
10123,Dr. Ramjass Hospital,"Near Railway Station, Circular Road, Rewari, Haryana, 123401",121.0,123401.0,30.1397227,74.1950513,0,,
10124,Dr. Vivek Yadav Hospital,"Garhi Bolni Road ( Near Shiv Complex) Opposite B.D.O Block Office, Rewari, Haryana, 123401",121.0,123401.0,28.1956468,76.6165179,0,,
10125,Dr.S.S. Yadav Ram-Bhagwan Charitable Institute,"Mirpur, Rewari, Haryana, 123401",121.0,123401.0,28.1927631,76.6239423,0,,
10126,Dr.Ved Prakash Surgical and Laproscopic Centre,"Court Road,Model Town(Near Bus Stand), Rewari, Haryana, 123401",121.0,123401.0,30.8989156,75.845453,0,,
10127,Eye-Q Super Speciality Hospitals,"Garhi Bilini Chowkcircular Road, Rewari, Haryana, 123401",121.0,123401.0,28.1956468,76.6165179,0,,
10128,Gangadei Memorial Hospital,"Leo Chowk, Konsiwas Road, Rewari, Haryana, 123401",121.0,123401.0,28.1956468,76.6165179,0,,
10129,Gulati Healthcare,"Near Kanod Gate, Circular Road, Rewari, Haryana, 123401",121.0,123401.0,28.1956468,76.6165179,0,,
10130,Health Point,"Bighar, Fatehabad, Rewari, Haryana, 123401",121.0,123401.0,28.1927631,76.6239423,0,,
10131,Health Way Research and Diagnostic Pvt.Ltd.,"Jangidmall Circular Road, Bhiwadi Road, Dharuhera, Rewari, Haryana, 123401",121.0,123401.0,28.1956468,76.6165179,0,,
10132,Healthway Research and Diagnostic Pvt. Ltd.,"Kokila Building, Leo Chowk, Sohna Road, Dharuhera, Rewari, Haryana, 123401",121.0,123401.0,28.1956468,76.6165179,0,,
10133,Imran Ent Hospital,"Rao Matadin Hospital,  Road, Narnaul, Rewari, Haryana, 123401",121.0,123401.0,28.0657961,76.1014781,0,,
10134,Kalawati Hospital,"Garhi Bolni Rd, Model Town, Rewari, Haryana, 123401",121.0,123401.0,28.1880105,76.6170739,0,,
10135,Kamla Hospital,"Opposite Sandpier Tourist Complex, Circular Road, Rewari, Haryana, 123401",121.0,123401.0,28.1956468,76.6165179,0,,
10136,Katyal Hospital and Critical Care Centre,"Kanod Gate, Circular Road, Rewari, Haryana, 123401",121.0,123401.0,28.1956468,76.6165179,0,,
10137,Kesar Hospital,"Maharana Partap Chowk, Bawal Road, Rewari, Haryana, 123401",121.0,123401.0,28.1956468,76.6165179,0,,
10138,Lalita Memorial Hospital Pvt Ltd / Lalita Memorial Multi Speciality Trauma and Test Tube Baby Center,"Opp: Hanuman Mandir Bara Talab, Rewari, Haryana, 123401",121.0,123401.0,28.1956468,76.6165179,0,,
10139,Lifecare Hospital,"Sec-5, Huda Market, Opposite Bmg Mall, Circular Road, Rewari, Haryana, 123401",121.0,123401.0,28.1956468,76.6165179,0,,
10140,Medimax Hospital,"Rampur, Rewari, Haryana, 123401",121.0,123401.0,28.1927631,76.6239423,0,,
10141,Metro Umkal Hospital And Heart Institute,"Dharuhera Chowk,Cirucular Road,Dharuhera Chungi, Rewari, Haryana, 123401",121.0,123401.0,28.1956468,76.6165179,0,,
10142,Mission Hospital and Diagnostic Centre,"Near Army Canteen , Circular Road, Rewari, Haryana, 123401",121.0,123401.0,28.1956468,76.6165179,0,,
10143,Naithani Neuro Cente,"Ambedkar Chowk, Rewari, Haryana, 123401",121.0,123401.0,28.1927631,76.6239423,0,,
10144,Om Heart Care and Medical Centre,"218-L,Court Road,Model Town, Rewari, Haryana, 123401",121.0,123401.0,31.6386589,74.8659017,0,,
10145,Poonam Child Care Centre,"R-205,Model Town, Rewari, Haryana, 123401",121.0,123401.0,28.1877433,76.6167212,0,,
10146,R. Yadav Surgical and Rekha Eye Hospital,"Opposite Govt Girls School, Circular Road, Rewari, Haryana, 123401",121.0,123401.0,28.1956468,76.6165179,0,,
10147,Sachdeva Hospital And Nursing Home,"Oppositr Telephone Exchange,Narnaul Chowk, Rewari, Haryana, 123401",121.0,123401.0,28.1956468,76.6165179,0,,
