hospital_id,hospital_name,address,district_id,pincode,latitude,longitude,mco_contact_number,total_beds,hospital_type
2545,Goyet Clinic,"Veerpur, Supaul, Bihar, 854340",245.0,854340.0,26.1317087,86.6107106,0,,
2588,Asha Hospital and Research Centre,"Asha Nagar, Bettiah, West Champaran, Bihar, 845101",240.0,845101.0,26.8028048,84.5169757,0,,
2589,Kumar Nurshing Home,"Mitra Chowk, Bettiah, West Champaran, Bihar, 845101",240.0,845101.0,26.8028048,84.5169757,0,,
2590,Nauroz Hospital,"Indira Chowk, Bettiah, West Champaran, Bihar, 845101",240.0,845101.0,26.8028048,84.5169757,0,,
2591,Sai Nurshing Home,"Kotwali Chowk, Bettiah, West Champaran, Bihar, 845101",240.0,845101.0,26.8028048,84.5169757,0,,
2592,Shri Ram Health Care,"Kotwali Chowk, Bettiah, West Champaran, Bihar, 845101",240.0,845101.0,26.8028048,84.5169757,0,,
2593,Sunaina Smriti Sewa Sansthan,"Harnatand Market Bagha-2, West Champaran, Bihar, 845103",240.0,845103.0,27.0518367,84.3351209,0,,
2594,Central Well Fare Hospital,"Dakbaglow Road , Bettiah, West Champaran, Bihar, 845306",240.0,845306.0,26.8028048,84.5169757,0,,
2595,Dr.Deepak Jayswals Hosital,"Hospital Road , Bettaih, West Champaran, Bihar, 845306",240.0,845306.0,26.7968036,84.498316,0,,
2596,Joti Nursing Home,"Manjulia Main Market Road, West Champaran, Bihar, 845306",240.0,845306.0,27.0518367,84.3351209,0,,
2597,Liza and Nans,"Sabui Road Near Rajhansh School, Ram Nagar, West Champaran, Bihar, 845306",240.0,845306.0,27.0518367,84.3351209,0,,
2598,Narayan Memorial Hospital,"Bonwal , Narwal, Bagha-2,Ps- Bagha -2, West Champaran, Bihar, 845306",240.0,845306.0,27.0518367,84.3351209,0,,
2599,Sahara Nursing Home,"Kotwali Chawak , Bettiah, West Champaran, Bihar, 845306",240.0,845306.0,26.8028048,84.5169757,0,,
2600,Sweksha Nursing Home,"Main Road ,Mainatar, West Champaran, Bihar, 845306",240.0,845306.0,27.2590444,84.0180642,0,,
2601,Vipul Hospital,"Station Road,Bagha,Naripur, West Champaran, Bihar, 845306",240.0,845306.0,27.0518367,84.3351209,0,,
2602,Smt. Hazari Medical and Maternity Care,"Azad Nagar , Balua Tal, Motihari, West Champaran, Bihar, 845404",240.0,845404.0,26.6469624,84.9088938,0,,
2603,Central Welfare Hospital,"Moharram Chawk,Bettiah, West Champaran, Bihar, 845438",240.0,845438.0,26.8028048,84.5169757,0,,
2604,Choudhary Memorial Medical Centre,"Hospital Road, Bettiah, West Champaran, Bihar, 845438",240.0,845438.0,26.7968036,84.498316,0,,
2605,Dr. Saroj Jaiswal,"Bettiah, West Champaran, Bihar, 845438",240.0,845438.0,26.8028048,84.5169757,0,,
2606,Dr.Suresh Prassad,"Supryia Cinema Road , Bethia, West Champaran, Bihar, 845438",240.0,845438.0,26.8050128,84.5093334,0,,
2607,Parivar Nursing Home,"Main Road Infront Of Ram Janki Mandir, Nautan, West Champaran, Bihar, 845438",240.0,845438.0,27.0518367,84.3351209,0,,
2608,Pariwar Clinic,"Kotwali Chowk, Bettiah, West Champaran, Bihar, 845438",240.0,845438.0,26.8028048,84.5169757,0,,
2609,Samir Memorial,"Alokbhartiroad, Navrangabagh, Bettiah, West Champaran, Bihar, 845438",240.0,845438.0,26.8028048,84.5169757,0,,
2610,Shivam Nursing Home,"Hospital Road, Bettiah, West Champaran, Bihar, 845438",240.0,845438.0,26.7968036,84.498316,0,,
2611,Tiwary Shyama Hospital,"Kotwali Chowk, Bettiah, West Champaran, Bihar, 845438",240.0,845438.0,26.8028048,84.5169757,0,,
2612,Pranjali Gupta,"Siswa Bairagi , Youga Patti, West Champaran, Bihar, 845452",240.0,845452.0,27.0518367,84.3351209,0,,
2613,Shivam Memorial Hospital,"Main Road, Nawalpur Bazar, Machhali Hatta, Bus Stand, Jogapatti, West Champaran, Bihar, 845452",240.0,845452.0,26.8651447,84.3476321,0,,
2614,Aapna Health Care Centre,"Bettiah Road, Lauria, West Champaran, Bihar, 845453",240.0,845453.0,26.9950297,84.4041343,0,,
2615,Ganpati Nursing Home,"Lauriya, West Champaran, Bihar, 845453",240.0,845453.0,26.9948214,84.3988806,0,,
2616,Majhauliya Health Care Centre,"Sariswa Road, Majhaulia, West Champaran, Bihar, 845454",240.0,845454.0,27.0518367,84.3351209,0,,
2617,Navajeen Clinic and Chest Care Centre,"Krishi Bajar Road ,Narkatiaganj, West Champaran, Bihar, 845455",240.0,845455.0,27.106337,84.4750137,0,,
2618,Shamshia Clinic,"Opposite Adarsh Vidyalaya,Shiv Ganj, Narkitiaganj, West Champaran, Bihar, 845455",240.0,845455.0,26.8028048,84.5169757,0,,
2619,Shivam Hospital,"Jadish Pur ,Block-Nautan, West Champaran, Bihar, 845459",240.0,845459.0,26.6891442,84.5785528,0,,
