hospital_id,hospital_name,address,district_id,pincode,latitude,longitude,mco_contact_number,total_beds,hospital_type
1580,Abhinav Hospital,"Hospital Road, Araria, Bihar, 854311",246.0,854311.0,26.1346459,87.4654062,0,,
1581,Jeevan Jyoti Orthopedic Emergency And Trauma Center,"Near Bus Stand, Araria, Bihar, 854311",246.0,854311.0,26.1346459,87.4654062,0,,
1582,Lovely Nursing Home,"Hospital Road, Araria, Bihar, 854311",246.0,854311.0,26.1346459,87.4654062,0,,
1583,Mohini Devi Rungta Hospital,"Rs(Near To Court), Araria, Bihar, 854311",246.0,854311.0,26.1346459,87.4654062,0,,
1584,Sadar Hopital Araria,"Sadar Hopital, Araria, Bihar, 854311",246.0,854311.0,26.1346459,87.4654062,0,,
1585,The Rural Institute Of Medical Aids,"Treatment Centre, Araria, Bihar, 854311",246.0,854311.0,26.1346459,87.4654062,0,,
1586,Baba Gramin Seva Sadan,"Refferal Roda , Forbesganj, Araria, Bihar, 854318",246.0,854318.0,26.2992736,87.2666121,0,,
1587,Dr. Alakh Niranjan Memorial Hospital,"Forbesganj, Araria, Bihar, 854318",246.0,854318.0,26.2992736,87.2666121,0,,
1588,Dr. Chaudhary Hospital and Research Institute,"Refferal Roda , Forbesganj, Araria, Bihar, 854318",246.0,854318.0,26.2992736,87.2666121,0,,
1589,Mata Mariam Nursing Home,"Referal Road, Forbesganj, Araria, Bihar, 854318",246.0,854318.0,26.2992736,87.2666121,0,,
1590,Kumar Ortho and Maternity Home,"W.No.-10, Guddu Chowk, Ashram Road, Araria, Bihar, 854329",246.0,854329.0,26.1346459,87.4654062,0,,
1771,Swasthya Kendra Khairwa,"Vill-Khairwa, P.O-Bela, Chauradanao, East Champaran, Bihar, 845302",241.0,845302.0,26.6393261,84.8990136,0,,
1772,Aditya Arogya Sansthan,"Naga Road, Raxaul, East Champaran, Bihar, 845305",241.0,845305.0,26.9808459,84.8540706,0,,
1773,The Duncan Hospital,"Raxaul, East Champaran, Bihar, 845305",241.0,845305.0,26.9910294,84.8507594,0,,
1774,Sekhauna Swasthya Kendra,"Sekhauna, P.S:-Ghorasahan, East Champaran, Bihar, 845315",241.0,845315.0,26.6393261,84.8990136,0,,
1775,Aastha Nursing Home and Maternity Centre,"Gopal Pur, Motihari, East Champaran, Bihar, 845401",241.0,845401.0,26.6469624,84.9088938,0,,
1776,Amar Clinic And Diabetic Care Centre,"Gayatri Nagar, Motijheel Ke Kinare, Motihari, East Champaran, Bihar, 845401",241.0,845401.0,26.6469624,84.9088938,0,,
1777,Astha Nursing Home,"West Gopalpur, Motihari, East Champaran, Bihar, 845401",241.0,845401.0,26.6393803,84.9023839,0,,
1778,Banarsidas Chandiwala Eye Hospital,"Chota Bariarpur, Nh-28 A, Motihari, East Champaran, Bihar, 845401",241.0,845401.0,26.6469624,84.9088938,0,,
1779,Bhawani Nursing Home,"Agarwa-Motihari, East Champaran, Bihar, 845401",241.0,845401.0,26.6430248,84.911823,0,,
1780,Chandana Surgicare,"Razabazar, Motihari, East Champaran, Bihar, 845401",241.0,845401.0,26.6469624,84.9088938,0,,
1781,Dr. A. Rahmans Hospital,"Bhawanipur, Zirat, East Champaran, Bihar, 845401",241.0,845401.0,26.6501494,84.9232282,0,,
1782,Hospito Care,"Salam Complex,Gorashan Raod,Dhaka, East Champaran, Bihar, 845401",241.0,845401.0,23.810332,90.4125181,0,,
1783,Jai Shree Swasthya Kendra,"Brhemashthan, Ghorasahan Road , Dhaka, East Champaran, Bihar, 845401",241.0,845401.0,23.810332,90.4125181,0,,
1784,Jeevan Deep Nursing Home,"Dhaka Road, Mahiya, Deh, Chatoni, Motihari, East Champaran, Bihar, 845401",241.0,845401.0,26.6469624,84.9088938,0,,
1785,M.J. Heart Hospital,"Rehman Hospital, Bhavani Pur, Zirath, Motihari, East Champaran, Bihar, 845401",241.0,845401.0,26.6469624,84.9088938,0,,
1786,Maa Nursing Home,"Shri Krishan Nagar, Near L.N.D. College, Motihari, East Champaran, Bihar, 845401",241.0,845401.0,26.6469624,84.9088938,0,,
1787,Maa Seva Sadan and Prasuti Kendra,"Brahm Asthan, Ghorasahan Road, Dhaka, Motihari, East Champaran, Bihar, 845401",241.0,845401.0,26.6469624,84.9088938,0,,
1788,Madan Raj Nursing Home,"Hospital Road , Motihari, East Champaran, Bihar, 845401",241.0,845401.0,26.4180749,85.0490069,0,,
1789,Madhuri Nursing Home,"Banjariya Pandal Chowk, Motihari, East Champaran, Bihar, 845401",241.0,845401.0,26.6469624,84.9088938,0,,
1790,Maharaja Nursing Home,"Raghunathpur, Motihari, East Champaran, Bihar, 845401",241.0,845401.0,26.6433705,84.890664,0,,
1791,Motihari Medical Center,"Po-Raghunathpur,Thana- Tirkoliya,Motihari, East Champaran, Bihar, 845401",241.0,845401.0,26.6469624,84.9088938,0,,
1792,Om Sai Nursing Home,"Opposite Chatauni Colony, Gali No:-1, Chatauni, Motihari, East Champaran, Bihar, 845401",241.0,845401.0,26.6469624,84.9088938,0,,
1793,Rajpali Nursing Home,"Joti Complex, Bank Road, Motihar, East Champaran, Bihar, 845401",241.0,845401.0,26.6393261,84.8990136,0,,
1794,Shamima Health Center,"Gyan Pull Chowk,Near Madahav Cinema Hall,Banjariya,Motihari, East Champaran, Bihar, 845401",241.0,845401.0,26.6469624,84.9088938,0,,
1795,Sharan Nursing Home,"Motihari, East Champaran, Bihar, 845401",241.0,845401.0,26.6469624,84.9088938,0,,
1796,Shreyaskar Hospital,"Nh 28 A Chatauni Chowk Beside Sheetal Hotel, Motihari, East Champaran, Bihar, 845401",241.0,845401.0,26.6469624,84.9088938,0,,
1797,Surgicare,"Sadar Hospital Road, Motihari, East Champaran, Bihar, 845401",241.0,845401.0,26.6469624,84.9088938,0,,
1798,Susrut Shalya Chikitsha Kendra,"Hospital Road Motihari, East Champaran, Bihar, 845401",241.0,845401.0,26.4180749,85.0490069,0,,
1799,Vatsalya Nursing Home,"Gopalpur, Raza Bazar Road, Motihari, East Champaran, Bihar, 845401",241.0,845401.0,26.6469624,84.9088938,0,,
1800,Yogendra Giri Sewa Ashram,"Belwa Chowk,Near Railway Crossing ,Motihari, East Champaran, Bihar, 845401",241.0,845401.0,26.6469624,84.9088938,0,,
1801,Osho Healing Space,"Madhuban Road Barachakia,Chakia, East Champaran, Bihar, 845412",241.0,845412.0,26.4174337,85.0541036,0,,
1802,Referral Hospital,"Bara Chakia, East Champaran, Bihar, 845412",241.0,845412.0,26.4106892,85.0493253,0,,
1803,Chapra Endoscopy Academy And Centre For Minimally,"Chatradhari Bazar , Jail Se Sate Dakshin, Chapra, East Champaran, Bihar, 845414",241.0,845414.0,26.6393261,84.8990136,0,,
1804,Chandralekha Health Care,"Thana Road Gorashan, East Champaran, Bihar, 845418",241.0,845418.0,26.6098139,84.8567932,0,,
1805,Matra Chaya,"Infront Of Ragistri House,Gorashan Road,Dhaka, East Champaran, Bihar, 845418",241.0,845418.0,23.810332,90.4125181,0,,
1806,Sundaram Hospital,"Tetariya Road, Madhuban, East Champaran, Bihar, 845420",241.0,845420.0,26.4925984,85.2798208,0,,
1807,Jagannath Seva Sansthan(Medical Help Centre Ngo),"N.H-28, Khajauriya Chowk, Motihari, East Champaran, Bihar, 845423",241.0,845423.0,26.6469624,84.9088938,0,,
1808,Sumitra Health Centre,"Kesariya, Kadam Chowk, East Champaran, Bihar, 845424",241.0,845424.0,26.6393261,84.8990136,0,,
1809,Yuvraj Hospital,"Hamidpur Road Kesariya, East Champaran, Bihar, 845424",241.0,845424.0,26.6393261,84.8990136,0,,
1810,Shri Ganesh Seva Sadan,"Madhuban Road, Pakhri Dayal, East Champaran, Bihar, 845428",241.0,845428.0,26.6393261,84.8990136,0,,
1811,Ajeet Nursing Home,"Turkoliya Bazar,Turkoliya, East Champaran, Bihar, 845437",241.0,845437.0,26.6393261,84.8990136,0,,
1812,Sapna Nursing Home,"Gandhi Nagar, Kotwa, Motihari, East Champaran, Bihar, 845437",241.0,845437.0,26.6469624,84.9088938,0,,
1813,Vaishanavi Hospital,"Nanhkar Road, Patahi, East Champaran, Bihar, 845457",241.0,845457.0,26.6098139,84.8567932,0,,
1814,Sehat Seva Kendra,"Paharpur, East Champaran, Bihar, 845458",241.0,845458.0,26.6031974,84.5981913,0,,
1903,Onyx Dental And Implant Center,"Binodpur, Katihar, Bihar, 854101",249.0,854101.0,25.5385943,87.5676712,0,,
1904,Sanjeewini Nursing Home,"Binodpur, Katihar, Bihar, 854101",249.0,854101.0,25.5385943,87.5676712,0,,
1905,Satyabhama Netralaya,"Karhagola, P.O-Gurubazar, Katihar, Bihar, 854104",249.0,854104.0,25.5586421,87.6457196,0,,
1906,Advanced Bone Center,"Barmasia, Katihar, Bihar, 854105",249.0,854105.0,25.552048,87.5718609,0,,
1907,Biswas Health Clinic,"G F Rahaman Colony, Sharif Ganj, B.Mill, Katihar, Bihar, 854105",249.0,854105.0,25.5586421,87.6457196,0,,
1908,Chaturbhuj Surgicare,"Anwarpur, Katihar, Bihar, 854105",249.0,854105.0,25.577045,87.5346402,0,,
1909,Devesh Nursing Home,"Durgapur, Katihar, Bihar, 854105",249.0,854105.0,25.5139028,87.5630684,0,,
1910,Dr Arif Clinic,"Binod Pur, Katihar, Bihar, 854105",249.0,854105.0,25.552048,87.5718609,0,,
1911,Dr. M M Haque Nursing Home,"Binod Pur, Katihar, Bihar, 854105",249.0,854105.0,25.552048,87.5718609,0,,
1912,Godawari Dinanath Matri Evam Shishu Kalyan Niketan,"Main Road Kumhri, Kadwa, Katihar, Bihar, 854105",249.0,854105.0,25.5586421,87.6457196,0,,
1913,Jannakshya Nursing Home,"Binodpur Road, Katihar, Bihar, 854105",249.0,854105.0,25.5395799,87.5684895,0,,
1914,K K Matri Seva Sadan,"Durgapur Road, Katihar, Bihar, 854105",249.0,854105.0,25.552048,87.5718609,0,,
1915,Katihar Seva Sadan,"Hospital Road Kalibari, Katihar, Bihar, 854105",249.0,854105.0,26.0269532,87.9500306,0,,
1916,Lodi Health Clinic,"Sharif Gunj, Katihar, Bihar, 854105",249.0,854105.0,25.552048,87.5718609,0,,
1917,Manish Nursing Home,"R K Mission Road, Katihar, Bihar, 854105",249.0,854105.0,25.5417348,87.5744557,06452  33081,,
1918,Minat Nursing Home,"M.G. Road, Faquirtakia Chaowk, Katihar, Bihar, 854105",249.0,854105.0,25.5586421,87.6457196,0,,
1919,Nidaan Hospital,"Kali Bada , Binodpur, Katihar, Bihar, 854105",249.0,854105.0,25.5385943,87.5676712,0,,
1920,Nirog Nursing Home,"Ram Para Chowk, Katihar, Bihar, 854105",249.0,854105.0,25.552048,87.5718609,0,,
1921,Patna Hospital,"Lalkothi Road, Katihar, Bihar, 854105",249.0,854105.0,25.552048,87.5718609,0,,
1922,Popular Sewa Sadan,"Block Road Pathepur, Katihar, Bihar, 854105",249.0,854105.0,25.552048,87.5718609,0,,
1923,Shamim Nursing Home,"Binodpur Road, Katihar, Bihar, 854105",249.0,854105.0,25.5395799,87.5684895,0,,
1924,Sharan Clinic,"Binodpur Road, Katihar, Bihar, 854105",249.0,854105.0,25.5395799,87.5684895,0,,
1925,Sheefa Health Clinic,"Sarifganj, Katihar, Bihar, 854105",249.0,854105.0,25.552048,87.5718609,0,,
1926,Sub Div Hospital Manihari,"Manihari, Katihar, Bihar, 854105",249.0,854105.0,25.3418047,87.620941,0,,
1927,Y F A Hospital and Research Centre,"Nayatola, Katihar, Bihar, 854105",249.0,854105.0,25.6671685,87.8580447,241878,,
1928,Foundation Life For All,"Sarkali Hospital,Semapur, Katihar, Bihar, 854115",249.0,854115.0,25.5586421,87.6457196,0,,
1929,Rubeda Nursing Home,"At Sonaili, P.O Sonaili , P.S Kadwa, Katihar, Bihar, 855114",249.0,855114.0,25.5586421,87.6457196,0,,
1932,Mgm Medical College,"Dinajpur Road, Kishanganj, Bihar, 855106",247.0,855106.0,26.2984144,87.9466715,0,,
1933,Divya Haddi Aur Daat Hosp,"Linebazar, Purnia, Bihar, 855107",248.0,855107.0,25.7758723,87.4087667,0,,
1934,Haider Nursing Home,"Churripatti Road, Kishanganj, Bihar, 855107",247.0,855107.0,26.2984144,87.9466715,0,,
1935,Jai Tulsi Nursing Home,"Hira Market Churipatti, Kishanganj, Bihar, 855107",247.0,855107.0,26.2984144,87.9466715,0,,
1936,K.B Nursing Home,"Subsh Pally Chok, Kishanganj, Bihar, 855107",247.0,855107.0,26.2984144,87.9466715,0,,
1937,Kanchanlata Nursing Home,"Dharamsala Road, Kishanganj, Bihar, 855107",247.0,855107.0,26.1024918,87.9545046,0,,
1938,Khwaja Garib Nawaz,"Block Road, Kothia, Kishanganj, Bihar, 855107",247.0,855107.0,26.2984144,87.9466715,0,,
1939,Life Care Nursing Home,"Dighalbank Chatgachhi, Kishanganj, Bihar, 855107",247.0,855107.0,26.2984144,87.9466715,0,,
1940,Maa Janaki Nursing Home,"Near Rajshree, Kishanganj, Bihar, 855107",247.0,855107.0,26.2984144,87.9466715,0,,
1941,Madhab Surgical and Maternity Clinic,"Dharamshala Road (Near Manoranjan Club), Kishanganj, Bihar, 855107",247.0,855107.0,26.2984144,87.9466715,0,,
1942,N B Nursing Home,"College Road Churipatty, Kishanganj, Bihar, 855107",247.0,855107.0,26.2984144,87.9466715,06456  233986,,
1943,Rabia Nursing Home,"Bahadurgunj Rahil Colony Main Road, Kishanganj, Bihar, 855107",247.0,855107.0,26.2984144,87.9466715,0,,
1944,Shaukat Nursing Home,"Churripatti Road, Kishanganj, Bihar, 855107",247.0,855107.0,26.2984144,87.9466715,0,,
1945,Smile Dental Clinic,"Neemchand Road Jamuna Market, Kishanganj, Bihar, 855107",247.0,855107.0,26.2984144,87.9466715,0,,
1946,Z.A.Nursing Home,"Paschimpali Chowk, Kishanganj, Bihar, 855107",247.0,855107.0,26.2984144,87.9466715,0,,
1947,Ab Nursing Home,"Subhash Pally, Kishanganj, Bihar, 855108",247.0,855108.0,26.2984144,87.9466715,0,,
1948,Bhairon Bhakt Raghunath Rai Netralaya,"Opposite Jagarnath School, Thakurbari Road, Kishanganj, Bihar, 855108",247.0,855108.0,26.2984144,87.9466715,0,,
1949,Hussain Memorial Nursing Home,"Main Road Bahadurganj, Kishanganj, Bihar, 855108",247.0,855108.0,26.4631836,86.9232138,0,,
1961,Aditya Arogya Sansthan,"Under Jageswar Devi Society, Near Bus Stand, Madhepura, Bihar, 852113",250.0,852113.0,25.7806118,86.9364753,0,,
1962,Care Nursing Home,"Raja Complex, By Pass Road, Madhepura, Bihar, 852113",250.0,852113.0,10.9940111,76.9561277,0,,
1963,Druvit Hospital,"Near Bus Stand, Madhepura, Bihar, 852113",250.0,852113.0,25.9286903,86.7909759,0,,
1964,Madhipura Christian Hospital Society,"At + Po, Madhepura, Bihar, 852113",250.0,852113.0,25.9286903,86.7909759,0,,
1965,Pradhi Yadav Hospital,"Jaypaalpatti Chowk Bypass Road, Madhepura, Bihar, 852113",250.0,852113.0,25.7806118,86.9364753,0,,
1966,Pragyan Nursing Home,"Jaypaalpatti Chowk Near Lic Office, Madhepura, Bihar, 852113",250.0,852113.0,25.7806118,86.9364753,0,,
1967,Satish Memorial Hospital And Research Center,"Raja Nagar Sadhupath, Madhepura, Bihar, 852113",250.0,852113.0,25.9286903,86.7909759,0,,
1968,Vinit Nursing Home,"Purnia Gola Chowk,Maim Road, Madhepura, Bihar, 852113",250.0,852113.0,25.7771391,87.4752551,0,,
1969,Vrindavan Nursing Home,"Near Bhupendera Chowk Towards Bus Stand, Madhepura, Bihar, 852113",250.0,852113.0,25.7806118,86.9364753,0,,
1970,Ramkrishana Hospital and Medical Research Centre-Madhepura,"Nh-107,Cinema Chowk Murli Ganj, Madhepura, Bihar, 852122",250.0,852122.0,43.1938516,-71.5723953,266103,,
1971,Dr.D K Gupta,"Pipra, Supaul, Bihar, 852218",245.0,852218.0,25.9286903,86.7909759,0,,
1972,Heart Hospital,"Jahnavi Sadan , Navratan, Madhubani, Bihar, 847211",244.0,847211.0,26.3503076,86.2296424,0,,
1973,Heritage Hospital and S N R L Trauma and Orthopedic R,"Jeebachh Chowk Sapta, Madhubani, Bihar, 847211",244.0,847211.0,26.3609666,86.059333,0,,
1974,Jeeva Deep Charitable Trust,"Bela, Jaynagar, Madhubani, Bihar, 847211",244.0,847211.0,26.5883988,86.1370148,0,,
1975,Golu and Lucky Medicare Home,"Singh Mansion, Kotwali Chowk, Madhubani, Bihar, 847212",244.0,847212.0,26.3503076,86.2296424,0,,
1976,Astha Hospital,"Benipatti, Madhubani, Bihar, 847223",244.0,847223.0,26.4465698,85.9074526,0,,
1977,Balajee Hospital,"Kataiya Road, Madhubani, Bihar, 847223",244.0,847223.0,26.3503076,86.2296424,0,,
1978,Sardaun Memorial Arogya Clinic,"Basopatti, Badhanedi Chowk, Madhubani, Bihar, 847225",244.0,847225.0,26.5790111,86.009606,0,,
1979,Dr. Uma Kant Jha,"Bhelwatola, Jaynagar, Madhubani, Bihar, 847226",244.0,847226.0,26.5883988,86.1370148,9934275572,,
1980,Dr. Ak Singh Clinic,"P.O Khutauna, Madhubani, Bihar, 847227",244.0,847227.0,26.5012234,86.3976042,0,,
1981,Siddhi Saakshi Swasthya Sewa Sadan,"Main Road, Bhatti Chowk, Rajnagar, Madhubani, Bihar, 847235",244.0,847235.0,26.3503076,86.2296424,0,,
1982,Veena Diagnostic and Research Hopsital,"Veena Vatika Raj Nagar, Madhubani, Bihar, 847235",244.0,847235.0,26.3503076,86.2296424,0,,
1983,Z K Memorial Hospital,"Noorchak Bazar, Bisfi, Madhubani, Bihar, 847235",244.0,847235.0,26.3503076,86.2296424,0,,
1984,Dinesh Nursing Home,"Madhubani Road, Sakri, Madhubani, Bihar, 847239",244.0,847239.0,26.2053088,86.0101442,0,,
1985,Haider Hospital and Reasearch Center,"Sakri, Madhubani, Bihar, 847239",244.0,847239.0,26.218532,86.0784459,0,,
1986,Jeevan Jyoti Nursing Home,"Sakri, Madhubani, Bihar, 847239",244.0,847239.0,26.218532,86.0784459,0,,
1987,Mithilanchal Nursing Home,"Opp Kashi Project, Madhubani Road Sakri, Madhubani, Bihar, 847239",244.0,847239.0,26.3503076,86.2296424,0,,
1988,Nayan Jyoti Netralaya,"Ranti Deodhi, Madhubani, Bihar, 847239",244.0,847239.0,26.3468544,86.0715474,0,,
1989,Surgical Clinic,"Mahanthi Lal Chowk, Madhubani, Bihar, 847239",244.0,847239.0,26.3468544,86.0715474,0,,
1990,"Sub-Divisional Hospital, Jhanjharpur (Madhubani)","Near Block Office, Jhanjharpur, Madhubani, Bihar, 847404",244.0,847404.0,26.3503076,86.2296424,0,,
2377,Divya Clinic,"Line Bazar, Purnia, Bihar, 854201",248.0,854201.0,25.781808,87.488871,0,,
2378,"Sub.Div.Hospital,Banmankhi","Banmankhi, Purnia, Bihar, 854202",248.0,854202.0,25.8872792,87.1946269,0,,
2379,"Ref.Hospital,Dhamdaha,Purnea","Dhamdaha, Purnia, Bihar, 854205",248.0,854205.0,25.7424311,87.1830995,0,,
2380,Advanced Orthopaedic and Spine Centre,"Line Bazar Chowk, Purnia, Bihar, 854301",248.0,854301.0,25.7771391,87.4752551,0,,
2381,Alam Ortho Clinic,"Line Bazar, Purnia, Bihar, 854301",248.0,854301.0,25.781808,87.488871,0,,
2382,Alfa Hospital Of Bone and Spine,"Line Bazar, Purnia, Bihar, 854301",248.0,854301.0,25.781808,87.488871,0,,
2383,Amla Health Centre,,248.0,854301.0,25.7771391,87.4752551,0,,
2384,B. K. Nursing Home,"Bihar Tokij Road, Purnia, Bihar, 854301",248.0,854301.0,25.7771391,87.4752551,0,,
2385,Badridev Surgical Clinic,"Line Bazar, Purnia, Bihar, 854301",248.0,854301.0,25.781808,87.488871,0,,
2386,Bapu Jan Kalyan Sansthan,"Plaza, Complex Khushi Lodge,Line Bazar, Purnia, Bihar, 854301",248.0,854301.0,25.7758723,87.4087667,6454229244,,
2387,Divyam Nursing Home,"Station Rd, Purnia, Bihar, 854301",248.0,854301.0,25.7771391,87.4752551,0,,
2388,Fatma Nursing Home,"Line Bazar, Purnia, Bihar, 854301",248.0,854301.0,25.781808,87.488871,0,,
2389,Hope Superspeciality Hospital Pvt Ltd,"Rambagh, Purnia, Bihar, 854301",248.0,854301.0,25.7923034,87.4975335,0,,
2390,Indra Gandhi Memorial Seva Sansthan,"Near Bhoothnath Mandir Colony, Purnia, Bihar, 854301",248.0,854301.0,26.8745449,80.9819291,0,,
2391,Kk Nursing Home,"N H 31 Line Bazar, Purnia, Bihar, 854301",248.0,854301.0,25.781808,87.488871,"0641    2421456, 2429434",,
2392,Laxmi Seva Sadan,"Line Bazar, Nh31, Purnia, Bihar, 854301",248.0,854301.0,25.7771391,87.4752551,0,,
2393,Maa Anita Seva Sadan,"Near Thana Road, Jalalgarh, Purnia, Bihar, 854301",248.0,854301.0,25.7758723,87.4087667,0,,
2394,Maa Pancha Devi Stone Hospital,"Line Bazar, Purnia, Bihar, 854301",248.0,854301.0,25.7771391,87.4752551,0,,
2395,Maa Savitri Multi Speciality Hospital,"Bihar Tokij Road, Purnia, Bihar, 854301",248.0,854301.0,25.7771391,87.4752551,0,,
2396,Mithila Dental Clinic,"Line Bazar Chowk, Purnia, Bihar, 854301",248.0,854301.0,25.7771391,87.4752551,0,,
2397,Neelam Nursing Home,"Line Bazar ,Nh31, Purnia, Bihar, 854301",248.0,854301.0,25.7771391,87.4752551,0,,
2398,Papular Seva Sadan,"Post Martum Road, Line Bazar, Purnia, Bihar, 854301",248.0,854301.0,25.7758723,87.4087667,0,,
2399,Premnath Kejriwal Nursing Home,"Line Bazar, Purnia, Bihar, 854301",248.0,854301.0,25.781808,87.488871,0,,
2400,Premnath Kejriwal Seva Sadan,"Bihar Tokij Road, Purnia, Bihar, 854301",248.0,854301.0,25.7771391,87.4752551,0,,
2401,Raza Nursing Home,"Near Of Shiv Mandir,Line Bazar, Purnia, Bihar, 854301",248.0,854301.0,30.9184526,75.8348296,0,,
2402,Sahyog Nursing Home,"Nh-31,Line Bazar, Purnia, Bihar, 854301",248.0,854301.0,25.781808,87.488871,0,,
2403,Saloni Nursing Home,"N . H. 31, Purnia, Bihar, 854301",248.0,854301.0,25.7771391,87.4752551,0,,
2404,Saurav Nursing Home,"Line Bazar ,Nh31, Purnia, Bihar, 854301",248.0,854301.0,25.7771391,87.4752551,0,,
2405,Shanti Memorial Hospital,"Mahavir Tola,Ara, Purnia, Bihar, 854301",248.0,854301.0,25.8704418,87.634628,0,,
2406,Sourav Nursing Home,"Nh-31, Near Kundipul, Line Bazar, Purnia, Bihar, 854301",248.0,854301.0,43.1938516,-71.5723953,0,,
2407,Tapowan Fracture and Orthopaedic Centre,"N.H-31 Line Bazar, Purnia, Bihar, 854301",248.0,854301.0,25.781808,87.488871,244602,,
2408,Yasin Clinic,"Neaer Of Shiv Mandir,Jhanda Chowk, Purnia, Bihar, 854301",248.0,854301.0,25.7758723,87.4087667,0,,
2426,Anand Orthopaedic and Trauma Center,"Purab Bazar, Vip Road, Saharsa, Bihar, 852201",251.0,852201.0,25.8330757,86.6143751,0,,
2427,Ashirvad Nursing Home,"Naya Bazar, Saharsa, Bihar, 852201",251.0,852201.0,25.8801297,86.5829699,0,,
2428,Ayush Nursing Home,"New Colony, Naya Bazar, Saharsa, Bihar, 852201",251.0,852201.0,32.9268284,73.7301953,0,,
2429,Dinkar Nursing Home,"Near Karu Khirhari Holt, Saharsa, Bihar, 852201",251.0,852201.0,25.8330757,86.6143751,0,,
2430,Drishti Eye Care Centre,"N.C.C. Road, Pratap Nagar, Saharsa, Bihar, 852201",251.0,852201.0,24.588231,73.7421352,0,,
2431,Ganga Hospital(Maternity and Ortho Centre),"Ali Nagar, Bangaon Road, Saharsa, Bihar, 852201",251.0,852201.0,25.8747277,86.5872377,0,,
2432,Gayatri Nursing Home,"Near Meera Tokij, Saharsa, Bihar, 852201",251.0,852201.0,25.8330757,86.6143751,0,,
2433,Gosai Seva Sadan,"Kachahari Dhala, Saharsa, Bihar, 852201",251.0,852201.0,25.8330757,86.6143751,0,,
2434,Heart Care Clinic,"Naya Bazar, Saharsa, Bihar, 852201",251.0,852201.0,25.8801297,86.5829699,0,,
2435,Janta Poly Clinic-Saharsa,"Hatia Gachhi, Purab Bazar, Saharsa, Bihar, 852201",251.0,852201.0,25.8330757,86.6143751,0,,
2436,Koshi Nursing Home,"Bhakitarpur Rd.,Sardha Nagar,Batraha,Ward No.-27, Saharsa, Bihar, 852201",251.0,852201.0,25.8713189,86.5881169,0,,
2437,Mahaveer Hospital and Orthocare Centre,"Refugee Colony Bangaon Road, Saharsa, Bihar, 852201",251.0,852201.0,25.8733282,86.5791485,228195,,
2438,P.K. Hospital,"Naya Bazar, Saharsa, Bihar, 852201",251.0,852201.0,25.8873288,86.5908524,0,,
2439,Sai Seva Sadan,"Naya Bazar, Saharsa, Bihar, 852201",251.0,852201.0,25.8801297,86.5829699,0,,
2440,Sirgicare Nursing Home,"Gangajala, Saharsa, Bihar, 852201",251.0,852201.0,25.8330757,86.6143751,0,,
2441,Sri Krishna Salaya Chikitsalaya,"V.I.P Road, Main Road Zoometer, Saharsa, Bihar, 852201",251.0,852201.0,25.8330757,86.6143751,6478228934,,
2443,Surgicare Hospital,"Gangjala Chowk, Gangjala, Saharsa, Bihar, 852201",251.0,852201.0,25.8330757,86.6143751,0,,
2444,Surya Hospital,"Ashok Cinema Road, Gandhi Path, Saharsa, Bihar, 852201",251.0,852201.0,28.6513402,77.1196321,0,,
2445,Ugratara Netra Chikitsalaya Hospital,"Refugee Colony Bangaon Road, Saharsa, Bihar, 852201",251.0,852201.0,25.8733282,86.5791485,0,,
2495,Dr.Panna Ram Sinha Memorial Nursing Home,"Jhana Road, In Front Of Town Thana, Sheohar, Bihar, 843329",242.0,843329.0,26.4934234,85.2717561,0,,
2496,Hassan Health Care and Research Centre,"Jhana Road, In Front Of Town Thana, Sheohar, Bihar, 843329",242.0,843329.0,26.4934234,85.2717561,0,,
2497,Nandipat Memorial Laproscopic and General Surgery Centre.,"Dumra Road, Sitamarhi, Bihar, 843329",243.0,843329.0,26.5684617,85.528131,0,,
2498,Shreya Nursing Home,"Hospital Road Near District Hospital, Sheohar, Bihar, 843329",242.0,843329.0,22.5404893,88.339408,0,,
2499,Soumya Nursing Home,"Central Bank Road, Sheohar, Bihar, 843329",242.0,843329.0,26.5145872,85.2942313,0,,
2500,Specialist Hospital and Research Centre,"Choti Rani Campus, Ward No-15, Sheohar, Bihar, 843329",242.0,843329.0,26.4934234,85.2717561,0,,
2501,R. K Dayal Nursing Home and Reasearch Centre,"Panchwati, Nahar Chowk,Dumra Chowk, Sitamarhi, Bihar, 843316",243.0,843316.0,26.5942841,85.500428,0,,
2502,Dhanwantri Nursing Home and Research Centre,"Dr Yadav Road ,Dumra, Sitamarhi, Bihar, 843301",243.0,843301.0,26.5642577,85.5154243,0,,
2503,Gajadhar Memorial Hospital and Research Centre,"Nahar Chowk,Dumra Road, Sitamarhi, Bihar, 843301",243.0,843301.0,26.5942841,85.500428,0,,
2504,Nandipat Memorial Laproscopic and General Surgery Ce,"Sona Complex, Sonawati Coloney, Dumra Road, Sitamarhi, Bihar, 843301",243.0,843301.0,26.5942841,85.500428,0,,
2505,Pupri Hospital and Rural Surgical Centre,"Jaipur,Ward No-4,Po-Janakpur Road, Sitamarhi, Bihar, 843301",243.0,843301.0,26.4567342,85.7012621,0,,
2506,Baijnath Nursing Home Research Centre,"Mela Road, Sitamarhi, Bihar, 843302",243.0,843302.0,26.6036356,85.4909795,0,,
2507,Dr. Renu Chatterjee,"Hospital Road, Sitamarhi, Bihar, 843302",243.0,843302.0,26.5956762,85.4951865,0,,
2508,Dr.Lata Gupta Nursing Home,"Koat Bazar, Sitamarhi, Bihar, 843302",243.0,843302.0,26.5907057,85.4883121,0,,
2509,Dr.Sabitri Sinha Nursing Home,"Thana Road, Sitamarhi, Bihar, 843302",243.0,843302.0,26.5942841,85.500428,0,,
2510,Jj Hospital,"Sursand Road, Sitamarhi, Bihar, 843302",243.0,843302.0,26.5942841,85.500428,0,,
2511,Nidan Hospital,"Old Exchange Road, Sitamarhi, Bihar, 843302",243.0,843302.0,26.5949547,85.4890908,0,,
2512,R.S Hospital and Research Centre,"Bypass Chowk, Rajopatti, Sitamarhi, Bihar, 843302",243.0,843302.0,26.6771384,85.5455068,0,,
2513,Rajeev Memorial Health Care Centre,"Near Mathura High School, Lakshmana Nagar, Ring Baandh, Sitamarhi, Bihar, 843302",243.0,843302.0,27.4924134,77.673673,0,,
2514,Ram Sati Devi Memorial Hospital,"Dumra Road, Rajopatti, Sitamarhi, Bihar, 843302",243.0,843302.0,26.5573032,85.5455,0,,
2515,Suksagar Hospital,"Rajopatti,Dumra Road, Sitamarhi, Bihar, 843302",243.0,843302.0,26.5942841,85.500428,0,,
2516,Sbs Hospitak,"Bairgania, Sitamarhi, Bihar, 843313",243.0,843313.0,26.7360933,85.2774207,0,,
2517,Narayan Nursing Home,"Janakpur Road, Mohalla- Jaitpur, Sitamarhi, Bihar, 843320",243.0,843320.0,26.4689553,85.7007007,0,,
2538,Dr Mehta Emergncy General Hptl,"Simrahi Bazrar, Raghopur, Supaul, Bihar, 852111",245.0,852111.0,26.315238,86.8456793,0,,
2539,S P Memorial Hospital,"Hospital Road, Ward No. 4, Simrahi Bazar, Raghopur, Supaul, Bihar, 852111",245.0,852111.0,26.2768089,86.7959614,0,,
2540,Anant Nursing Home,"Lohiya Nagar Chowk, Supaul, Bihar, 852131",245.0,852131.0,26.1317087,86.6107106,0,,
2541,Barfi Karak Memorial Health and Welfare Foundation,"Panchwati Chowk, Hospital Road, Supaul, Bihar, 852131",245.0,852131.0,24.590694,73.696938,0,,
2542,R. K. Hospital,"Dharamshala Road, Near Gandhi Maidan, Supaul, Bihar, 852131",245.0,852131.0,25.3156354,86.4902843,0,,
2543,Shristi Nursing Home,"Near Pani Tanki, Dharamsala Road, Gandhi Maidan, Supaul, Bihar, 852131",245.0,852131.0,26.2768089,86.7959614,0,,
2544,Sun Medicare,"Lohiya Nagar, Supaul, Bihar, 852131",245.0,852131.0,26.1209629,86.600694,0,,
