hospital_id,hospital_name,address,district_id,pincode,latitude,longitude,mco_contact_number,total_beds,hospital_type
25521,Vasan Eye Care Hospital,"No 16, Sukkanendal Village Managiri, Karaikudi Sivaganga, Sivaganga, Tamil Nadu, 630307",629.0,630307.0,9.8486881,78.4870461,0,,
25522,Sri Adhi Parasakthi Hospital,"Thondai Road, Sivaganga, Tamil Nadu, 630561",629.0,630561.0,9.8486881,78.4870461,0,,
25523,Dar -Es- Shifa Nursing Home,"366, Kamarajar Road, Ilayangudi Sivagangai, Sivaganga, Tamil Nadu, 630702",629.0,630702.0,9.8486881,78.4870461,0,,
25524,Vizhiyagam Eye Hospital - Salaigramam,",Salaigramam,Ilayangudi (T.K), Sivaganga, Tamil Nadu, 630702",629.0,630702.0,9.8486881,78.4870461,0,,
25525,Anbu Hospital,"#4 & 5, Lakshmi Villas St,Near Selvam Theathre, Thanjavur, Tamil Nadu, 612001",627.0,612001.0,10.659037,79.2014278,0,,
25526,Dhanalakshmi Nursing Home,"59 ,Gandhi Addigal Salai Kumbakonam, Thanjavur, Tamil Nadu, 612001",627.0,612001.0,10.659037,79.2014278,0,,
25527,Dr Agarwal's Eye Hospital,"2/381, Indira Nagar (Near Vatti Pillaiyar Koil), Thanjavur, Tamil Nadu, 612001",627.0,612001.0,10.659037,79.2014278,0,,
25528,Grace Nursing Home,"No,Lasankulam West Bank,Pattukkottai, Thanjavur, Tamil Nadu, 612001",627.0,612001.0,10.659037,79.2014278,0,,
25529,Kannan Nursing Home,"9 Ramasamy Koil West Kumbakonam Kumbakonam, Thanjavur, Tamil Nadu, 612001",627.0,612001.0,10.659037,79.2014278,0,,
25530,Keerthi Poly Clinic,"40, Balakrishna Nagar, Mannargudi, Kummakonam, Thanjavur, Tamil Nadu, 612001",627.0,612001.0,10.659037,79.2014278,0,,
25531,Ks Hospital,"60, Mutt Street Kumbakonam Kumbakonam, Thanjavur, Tamil Nadu, 612001",627.0,612001.0,10.659037,79.2014278,0,,
25532,M.M. Ortho Speciality Hospital,"# 80, Chekkanganni Rd,Near Income Tax Office, Thanjavur, Tamil Nadu, 612001",627.0,612001.0,10.659037,79.2014278,0,,
25533,Priya Poly Clinic,"No 10 & 11 Kasiviswanathar North Street, Kumbakonam, Thanjavur, Tamil Nadu, 612001",627.0,612001.0,10.659037,79.2014278,0,,
25534,Senthil Nursing Home,"11-A, Banadurai South St ,Kumbakonam, Thanjavur, Tamil Nadu, 612001",627.0,612001.0,10.659037,79.2014278,0,,
25535,Siddarth Clinic,"10/25, Banadurai South Street,Kumbakonam, Thanjavur, Tamil Nadu, 612001",627.0,612001.0,10.659037,79.2014278,0,,
25536,St Hospital,"38/79, Nageswaran Kumbakonam, Thanjavur, Tamil Nadu, 612001",627.0,612001.0,10.659037,79.2014278,0,,
25537,Sugam Multispeciality Hospital,"1,New Railway Station Road(Near Crc), Kumbakonam, Thanjavur, Tamil Nadu, 612001",627.0,612001.0,10.659037,79.2014278,0,,
25538,Vijay Poly Clinic,"21-A, Ayekulam Road Kumbakonam, Thanjavur, Tamil Nadu, 612001",627.0,612001.0,10.659037,79.2014278,0,,
25539,Vimala Memorial Hospital,"2/381 Vattipillayar Koil Street Kumbakonam, Thanjavur, Tamil Nadu, 612001",627.0,612001.0,10.659037,79.2014278,0,,
25540,A K C Nursing Home,"26 Shivaji Nagar, Thanjavur, Tamil Nadu, 613001",627.0,613001.0,10.659037,79.2014278,0,,
25541,Dr. R. K. Nursing Home,"29-A, Shivaji Nagar, Thanjavur, Tamil Nadu, 613001",627.0,613001.0,10.659037,79.2014278,0,,
25542,Dr.Navamani Clinic,"No.90,East Main Street, Thanjavur, Tamil Nadu, 613001",627.0,613001.0,10.659037,79.2014278,0,,
25543,K R Annamalai Hospital,"85, Market Road, Thanjavur, Tamil Nadu, 613001",627.0,613001.0,10.659037,79.2014278,0,,
25544,Keerthana Hospita P) Ltd,"58 G.A. Canal Road Near Hotel Parisutham, Thanjavur, Tamil Nadu, 613001",627.0,613001.0,10.659037,79.2014278,0,,
25545,Kra Hospital,"# 85, Market Road, Thanjavur, Tamil Nadu, 613001",627.0,613001.0,10.659037,79.2014278,0,,
25546,Nova Hospital,"93, Court Road,Membalam, Thanjavur, Tamil Nadu, 613001",627.0,613001.0,10.659037,79.2014278,0,,
25547,P.K.Hospital,",Vijaya Theatre Rd, Thanjavur, Tamil Nadu, 613001",627.0,613001.0,10.659037,79.2014278,0,,
25548,Sudar Hospital,"23, Shivaji Nagar, Membalam, Thanjavur, Tamil Nadu, 613001",627.0,613001.0,10.659037,79.2014278,0,,
25549,M.R.Hospital,"No:1 Yagappa Nagar,Pudukkottai Road,Mani Mandapam, Thanjavur, Tamil Nadu, 613002",627.0,613002.0,10.659037,79.2014278,0,,
25550,Vasan Eye Care Hospital,"No:51,Gandhiji Road, Near Railway Station , Tanjore, Thanjavur, Tamil Nadu, 613004",627.0,613004.0,10.659037,79.2014278,0,,
25551,Ksdc Hospital,"No-6 & 7, K S Nagar , Opp Bus Stand, Thanjavur, Tamil Nadu, 613005",627.0,613005.0,10.659037,79.2014278,0,,
25552,Rss Hospital,"Cauvery Nagar South 6Th Street Opposite New Housing Unit Pudukkottai Road, Thanjavur, Tamil Nadu, 613005",627.0,613005.0,10.659037,79.2014278,0,,
25553,Annu Multispeciality Hospital,"69, Tirchy Road, Nera Convent, Thanjavur, Tamil Nadu, 613007",627.0,613007.0,10.659037,79.2014278,0,,
25554,Deiva Hospital,"4,Tps Nagar,Medical College Road, Thanjavur, Tamil Nadu, 613007",627.0,613007.0,10.659037,79.2014278,0,,
25555,Dr.V.V.R.Hospital,"6Th Cross Street,Arulananda Nagar, Thanjavur, Tamil Nadu, 613007",627.0,613007.0,10.659037,79.2014278,0,,
25556,K.D.R.Hospital,"1 & 2 , Ramakrishna Puram,Near Rohini Hospital, Thanjavur, Tamil Nadu, 613007",627.0,613007.0,10.659037,79.2014278,0,,
25557,M.G.Hospitals,"No:16, First Street, Arulananda Nagar, Thanjavur, Tamil Nadu, 613007",627.0,613007.0,10.659037,79.2014278,0,,
25558,N.M. Hospital Pvt. Ltd,"3275, 1/A-1, Ramakrishnapuram, OppositeTo Manimandap, Thanjavur, Tamil Nadu, 613007",627.0,613007.0,10.659037,79.2014278,0,,
25559,Our Lady Of Health Hospital,"Arulananda Nagar, Thanjavur, Tamil Nadu, 613007",627.0,613007.0,10.659037,79.2014278,0,,
25560,Right Hospital,"35/3125, V.O.C. Nagar, Trichy Road, Near Lic Jeevan Chola, Thanjavur, Tamil Nadu, 613007",627.0,613007.0,10.659037,79.2014278,0,,
25561,Rohini Hospital,"81/1 Arulananda Nagar,3Km From New Bus Stand,Pudukottai Road, Thanjavur, Tamil Nadu, 613007",627.0,613007.0,10.659037,79.2014278,0,,
25562,S.B.Hospital,"Ii Nd St, Rajappanagar,Medical College Road, Thanjavur, Tamil Nadu, 613007",627.0,613007.0,10.659037,79.2014278,0,,
25563,Suriya Medical Centre,"15-A, Selvam Nagar, Medical College Road, Thanjavur, Tamil Nadu, 613007",627.0,613007.0,10.659037,79.2014278,0,,
25564,Vinodhagan Memorial Hospital,"3120 & 3121, Trichy Road, Thanjavur, Tamil Nadu, 613007",627.0,613007.0,10.659037,79.2014278,0,,
25565,M.V.K.Nursing Home,"Near Big Temple / Sivaganga Garden, Thanjavur, Tamil Nadu, 613009",627.0,613009.0,10.659037,79.2014278,0,,
25566,Raja Rajan Nursing Home,"1886, South Main Street, Thanjavur, Tamil Nadu, 613009",627.0,613009.0,10.659037,79.2014278,0,,
25567,Royal Hospital,"1624, South Main Street, (Near Singaram Medical), Thanjavur, Tamil Nadu, 613009",627.0,613009.0,10.659037,79.2014278,0,,
25568,Thanga Saradha Nursing Home,"2896,South Main Street, Thanjavur, Tamil Nadu, 613009",627.0,613009.0,10.659037,79.2014278,0,,
25569,Elangovan Hospital,"No. 62, Pilliyar Kovil Street, Thanjavur, Tamil Nadu, 614601",627.0,614601.0,10.659037,79.2014278,0,,
25570,Kanakesa Thevar Memorial Hospital Pvt. Ltd.,"No.66, Chinnaiah Street, Thanjavur, Tamil Nadu, 614601",627.0,614601.0,10.659037,79.2014278,0,,
25571,Sri Kumarun Hospital,"16,High School Road,Pattukkottai, Thanjavur, Tamil Nadu, 614601",627.0,614601.0,10.659037,79.2014278,0,,
25572,K R Nursing Home,"28,Nadimmuttu Nagar,Pattukootai, Thanjavur, Tamil Nadu, 614602",627.0,614602.0,10.659037,79.2014278,0,,
25573,Sangeetha Hospital,"No. 43, Pillaiyar Kovil Street Pattukkottai, Thanjavur, Tamil Nadu, 614602",627.0,614602.0,10.659037,79.2014278,0,,
25574,G.R.A.M. Hospital,"49/5 S.R.Complex Soukkandi St., Pattukkottai, Thanjavur, Tamil Nadu, 614701",627.0,614701.0,10.659037,79.2014278,0,,
25575,Aarokkiyaa Hospital,"Sethu Road, Peravurani, Thanjavur, Tamil Nadu, 614804",627.0,614804.0,10.659037,79.2014278,0,,
25576,Ooty Hospital,"Blue Mountain School Road, The Nilgiris, Tamil Nadu, 643001",618.0,643001.0,11.4,76.7,0,,
25577,Parvathy Medical Centre,"Havelock Road, Ooty, The Nilgiris, Tamil Nadu, 643001",618.0,643001.0,11.4,76.7,0,,
25578,S M Hospital,"Coonoor Road, The Nilgiris, Tamil Nadu, 643001",618.0,643001.0,11.4,76.7,0,,
25579,Shiva Shakthi Multi Speciality Centre,"Blue Mountain School Road, The Nilgiris, Tamil Nadu, 643001",618.0,643001.0,11.4,76.7,0,,
25580,The Eye Foundation,"4/B2, Coonoor Road Elkhill Junction, Ootacamund, The Nilgiris, Tamil Nadu, 643001",618.0,643001.0,11.4,76.7,0,,
25581,Vijaya Hospital,"39/56, Off Ettines Road Ootacamund Ootacamund, The Nilgiris, Tamil Nadu, 643001",618.0,643001.0,11.4,76.7,0,,
25582,Good Shepherd International School Hospital,"M.Palada M.Palada, The Nilgiris, Tamil Nadu, 643004",618.0,643004.0,11.4,76.7,0,,
25583,Nankem Hospital,"Near Y W C A Coonoor, The Nilgiris, Tamil Nadu, 643101",618.0,643101.0,11.4,76.7,0,,
25584,Pushpa Hospital,"Grays Hill, The Nilgiris, Tamil Nadu, 643101",618.0,643101.0,11.4,76.7,0,,
25585,Sagayamatha Hospital,"Balaclava Hill, Coonoor 643 102, The Nilgiris, Tamil Nadu, 643102",618.0,643102.0,11.4,76.7,0,,
25586,Gudapur Medical Centre Pvt Ltd,"6/111 Ooty Road Rajagopalapuram Gudalur, The Nilgiris, Tamil Nadu, 643212",618.0,643212.0,11.4,76.7,0,,
25587,Pushpgiri Mission Hospital,"Gudalur Bazar, P.O. Gudalur, The Nilgiris, Tamil Nadu, 643212",618.0,643212.0,11.4,76.7,0,,
25588,Holy Family Mission Hospital,"Cotherstone Kotagiri Kotagiri, The Nilgiris, Tamil Nadu, 643217",618.0,643217.0,11.4,76.7,0,,
25589,Kotagiri Medical Fellowship Hospital,,618.0,643217.0,11.4,76.7,0,,
25590,Andal Hospital,"Vaigai Road Andipatti Andipatti, Theni, Tamil Nadu, 625512",631.0,625512.0,9.8692558,77.4222974,0,,
25591,Palaniammal Childrens Hospital,"11-1-306 Theni Road Andipatti Andipatti, Theni, Tamil Nadu, 625512",631.0,625512.0,9.8692558,77.4222974,0,,
25592,Rajam Clinic,"Vaigai Road Andipatti Andipatti, Theni, Tamil Nadu, 625512",631.0,625512.0,9.8692558,77.4222974,0,,
25593,S V S Meenakshi Hospital,"Sakkampatti, Andipatti, Theni, Tamil Nadu, 625512",631.0,625512.0,9.8692558,77.4222974,0,,
25594,Arun Hospital,"Opposite To Bus Stand,#51,Uthamapalayam Road, Theni, Tamil Nadu, 625513",631.0,625513.0,9.8692558,77.4222974,0,,
25595,Deepam Hospital,"Thendral Nagar,Bodinayakanur, Theni, Tamil Nadu, 625513",631.0,625513.0,9.8692558,77.4222974,0,,
25596,Shanmugam Clinic,"Thevaram Road, Bodinayakanur, Theni, Tamil Nadu, 625513",631.0,625513.0,9.8692558,77.4222974,0,,
25597,Venkateshwara Hospital,"New No. 37, 2Nd New Street, Kulalarpalayam, Bodinayakanur, Theni, Tamil Nadu, 625513",631.0,625513.0,9.8692558,77.4222974,0,,
25598,Lakshmi Maternity And Childrens Hospitals,"16/4, Markayankottai Road Chinnamnur, Theni, Tamil Nadu, 625515",631.0,625515.0,9.8692558,77.4222974,0,,
25599,Mohan Clinic and Nursing Home,"No. 82, Kuttrya Pillair Street, Cumbum, Theni, Tamil Nadu, 625516",631.0,625516.0,9.8692558,77.4222974,0,,
25600,Aravind Eye Hospital,"No-371 Periyakulam Road, Theni, Tamil Nadu, 625531",631.0,625531.0,9.8692558,77.4222974,0,,
25601,Gayathree Medical Center,"No. 356, Aranmanaipudur Road, Theni, Tamil Nadu, 625531",631.0,625531.0,9.8692558,77.4222974,0,,
25602,Kohila Hospital,"#54, Periyakulam Rd,Allinagaram, Theni, Tamil Nadu, 625531",631.0,625531.0,9.8692558,77.4222974,0,,
25603,Krishnammal Memorial Hospital,"293 Periyakulam Road, Theni, Tamil Nadu, 625531",631.0,625531.0,9.8692558,77.4222974,0,,
25604,Kulasekaran Hospital,"588,Madurai Road,Bangalow Medu, Theni, Tamil Nadu, 625531",631.0,625531.0,9.8692558,77.4222974,0,,
25605,Manis Hospital,"3-1-54A, Cumbum Road, Opp Rmtc Depot.Pc Patty, Theni, Tamil Nadu, 625531",631.0,625531.0,9.8692558,77.4222974,0,,
25606,N. R. T. Hospital,"132, Madurai Main Road, Theni, Tamil Nadu, 625531",631.0,625531.0,9.8692558,77.4222974,0,,
25607,Nalam Hospital And Speciality Care Centre,"63/2 Lake Road Sri Ram Nagar, Theni, Tamil Nadu, 625531",631.0,625531.0,9.8692558,77.4222974,0,,
25608,Sekar Nursing Home,"10-E.B. Road, Theni, Tamil Nadu, 625531",631.0,625531.0,9.8692558,77.4222974,0,,
25609,Sree Mohan Hospital,"702 Madhurai Road, Theni, Tamil Nadu, 625531",631.0,625531.0,9.8692558,77.4222974,0,,
25610,Sri Sairam Hospital,"# 60 Feet Scheme Rd,Kottaikalam, Theni, Tamil Nadu, 625531",631.0,625531.0,9.8692558,77.4222974,0,,
25611,Suham Hospital,"23, Miranda Lane Old G.H.Road, Theni, Tamil Nadu, 625531",631.0,625531.0,9.8692558,77.4222974,0,,
25612,Udaya Nursing Home,"Periyakulam Road, Theni, Tamil Nadu, 625531",631.0,625531.0,9.8692558,77.4222974,0,,
25613,Vasan Eye Care Hospital,"440 & 440 A, Nehruji Road,(Periyakuam Road), Theni, Tamil Nadu, 625531",631.0,625531.0,9.8692558,77.4222974,0,,
25614,Vidhya Hospital,"Cumbum Road, Theni, Tamil Nadu, 625531",631.0,625531.0,9.8692558,77.4222974,0,,
25615,Christian Hospital,"Thenkarai,Vaigae Dam Road, Theni, Tamil Nadu, 625601",631.0,625601.0,9.8692558,77.4222974,0,,
25616,Al Ameen Nursing Home,"16/31, Analkatti Maidan, Tiruchirappalli, Tamil Nadu, 620001",621.0,620001.0,10.8071144,78.6880939,0,,
25617,Atlas Hospital,"34/ 1-First Cross Vn Ngar Karur Bye Pass Road, Near Chathiram Bus Stand, Tiruchirappalli, Tamil Nadu, 620001",621.0,620001.0,10.8071144,78.6880939,0,,
25618,Bone and Joint Hospital,"103-A, Salai Road,Woraiyur, Tiruchirappalli, Tamil Nadu, 620001",621.0,620001.0,10.8071144,78.6880939,0,,
25619,Br Nursing Home,"Cooperative Society Thuraiyur Thuraiyur, Tiruchirappalli, Tamil Nadu, 620001",621.0,620001.0,10.8071144,78.6880939,0,,
25620,Child Jesus Hospital,"C.J. Hospital, P. Box. No. 17,Cantonment,Next To All India Radio, Tiruchirappalli, Tamil Nadu, 620001",621.0,620001.0,10.8071144,78.6880939,0,,
25621,Dr A Govindarajan Eye Hospital,"6, Officer`S Colony Puthur, Tiruchirappalli, Tamil Nadu, 620001",621.0,620001.0,10.8071144,78.6880939,0,,
25622,Frontline Hospital and Research Institute,"37&39, Chinthamani Bazaar ( Near Anna Statue ), Tiruchirappalli, Tamil Nadu, 620001",621.0,620001.0,10.8071144,78.6880939,0,,
25623,Indira Seshadri Nursing Home,"5, Collector Office Road, Cantonment, Tiruchirappalli, Tamil Nadu, 620001",621.0,620001.0,10.8071144,78.6880939,0,,
25624,Is Nursing Home(Indira Seshadri Nursing Home),"No:5, Collector Office Road, Raja Colony, Tiruchirappalli, Tamil Nadu, 620001",621.0,620001.0,10.8071144,78.6880939,0,,
25625,Joseph Eye Hospital (Institute Of Ophthalmology),"Post Box No:138, Melapudhur,General Post Office, Tiruchirappalli, Tamil Nadu, 620001",621.0,620001.0,10.8071144,78.6880939,0,,
25626,Karp Nursing Home,"A12, 11Th Cross Street(West), Thillainagar, Tiruchirappalli, Tamil Nadu, 620001",621.0,620001.0,10.8071144,78.6880939,0,,
25627,Kmc Specialty Hospitals Limited,"No 6, Royal Road Cantonment Road, Tiruchirappalli, Tamil Nadu, 620001",621.0,620001.0,10.8071144,78.6880939,0,,
25628,M.S Hospitals Senthil Nursing Home,"91, Butterworth Road, Near Chatram Bus Stand, Tiruchirappalli, Tamil Nadu, 620001",621.0,620001.0,10.8071144,78.6880939,0,,
25629,New Aarthy Hospital,"3-A/108, Bharathiar Salai,Contonment, Tiruchirappalli, Tamil Nadu, 620001",621.0,620001.0,10.8071144,78.6880939,0,,
25630,Prabhu Nursing Home,"# 25, Vekatesan Road, Tiruchirappalli, Tamil Nadu, 620001",621.0,620001.0,10.8071144,78.6880939,0,,
25631,Sankara Eye Care,"10/3, Parvathipuram, 1St Street , Thuraiyur Road, Musiri, Tiruchirappalli, Tamil Nadu, 620001",621.0,620001.0,10.8071144,78.6880939,0,,
25632,Sea Horse Hospitals Ltd.,"No.6, Royal Road, Tiruchirapally,Tamil Nadu, Tiruchirappalli, Tamil Nadu, 620001",621.0,620001.0,10.8071144,78.6880939,0,,
25633,Sethu Ent Research Center,"D 108, 9Th Cross, East, Thillainagar, Tiruchirappalli, Tamil Nadu, 620001",621.0,620001.0,10.8071144,78.6880939,0,,
25634,Shri Ram Nursing Home,"26, Ram Nagar Karumandapam, Tiruchirappalli, Tamil Nadu, 620001",621.0,620001.0,10.8071144,78.6880939,0,,
25635,Shrimuthu Nursing Home,"95, Big Sowrastra Street, Tiruchirappalli, Tamil Nadu, 620001",621.0,620001.0,10.8071144,78.6880939,0,,
25636,Shyamala Nursing Home,"15,Benwells Road, Tiruchirappalli, Tamil Nadu, 620001",621.0,620001.0,10.8071144,78.6880939,0,,
25637,Sri Kavery Medical Care(Trichy) (P) Ltd.,"No. 6, Royal Road, Cantonment, Tiruchirappalli, Tamil Nadu, 620001",621.0,620001.0,10.8071144,78.6880939,0,,
25638,Sri Krishna Clinic,"73, C/23, Salai Road, Trichirappalli, Tiruchirappalli, Tamil Nadu, 620001",621.0,620001.0,10.8071144,78.6880939,0,,
25639,Sri Venkateswara Hospitals,"22-A , Trunk Road, Thiruvanaikovil, Tiruchirappalli, Tamil Nadu, 620001",621.0,620001.0,10.8071144,78.6880939,0,,
25640,Tilak Hospitals,"103 A/2, Devar Colony , 1St Cross, Thillai Nagar, Tiruchirappalli, Tamil Nadu, 620001",621.0,620001.0,10.8071144,78.6880939,0,,
25641,Vaishali Digestive Diseases Care.,"New No.159, Salai Road,Thillaingar, Tiruchirappalli, Tamil Nadu, 620001",621.0,620001.0,10.8071144,78.6880939,0,,
25642,Kidney Park,"Karur Bypass Road, Near Chatram Bus Stand, Tiruchirappalli, Tamil Nadu, 620002",621.0,620002.0,10.8071144,78.6880939,0,,
25643,Mani Memorial Medicare Hospital,"39, Karur By Pass Road, Tiruchirappalli, Tamil Nadu, 620002",621.0,620002.0,10.8071144,78.6880939,0,,
25644,Mmm Hospitals,"No 39, Karur By Pass Road Near Kalaignar Arivalayam Trichy, Tiruchirappalli, Tamil Nadu, 620002",621.0,620002.0,10.8071144,78.6880939,0,,
25645,Senthil Nursing Home,"#91, Butterworth Road,Near Chatram Bust Stand, Tiruchirappalli, Tamil Nadu, 620002",621.0,620002.0,10.8071144,78.6880939,0,,
25646,Thirumurugan Hospital,"#10, Town Railway Station Road,Near Town Railway Station, Tiruchirappalli, Tamil Nadu, 620002",621.0,620002.0,10.8071144,78.6880939,0,,
25647,C.S.I. Mission General Hospital,"Worior, Tiruchirappalli, Tamil Nadu, 620003",621.0,620003.0,10.8071144,78.6880939,0,,
25648,Jeyam Nursing Home,"13-A, Thiruthanthoni Road, Woraiyur, Tiruchirappalli, Tamil Nadu, 620003",621.0,620003.0,10.8071144,78.6880939,0,,
25649,Ramakrishna Nursing Home,"# 20, 21, Vivekananda Hospital,Near Csi Mission Hospital,Wouriur, Tiruchirappalli, Tamil Nadu, 620003",621.0,620003.0,10.8071144,78.6880939,0,,
25650,Sri Muthu Nursing Home,"95,Big Sowrasta Street Woraiyur Main Road, Tiruchirappalli, Tamil Nadu, 620003",621.0,620003.0,10.8071144,78.6880939,0,,
25651,Stephen Nursing Home,"#6 A/8, First Main Road,Ramalinganagar,Woraiyur, Tiruchirappalli, Tamil Nadu, 620003",621.0,620003.0,10.8071144,78.6880939,0,,
25652,Sudharsana Hospital,"No: 6A/7, First Main Road, Ramalinga Nagar, Woraiyur, Tiruchirappalli, Tamil Nadu, 620003",621.0,620003.0,10.8071144,78.6880939,0,,
25653,Rajendhira Hospital,"#32 , Gandhi Rd,T.V.Kovil, Tiruchirappalli, Tamil Nadu, 620005",621.0,620005.0,10.8071144,78.6880939,0,,
25654,Sri Balaji Hospital,"Chennai Trunk Road, Thiruvanai Koil, Tiruchirappalli, Tamil Nadu, 620005",621.0,620005.0,10.8071144,78.6880939,0,,
25655,Sri Dhanvanthri Nursing Home,"Rao Bahadur Ganapati Colony,T.V Koil, Tiruchirappalli, Tamil Nadu, 620005",621.0,620005.0,10.8071144,78.6880939,0,,
25656,G.V.N. Insitute Of Medical Sciences Dr. Pankajm Si,"5, Ranganatha Puram East, Srirangam, Tiruchirappalli, Tamil Nadu, 620006",621.0,620006.0,10.8071144,78.6880939,0,,
25657,Lakshmi Eye Hospital,"No. 684, Ragavendra Complex, Amma Mandapam Road, Srirangam - 6, Tiruchirappalli, Tamil Nadu, 620006",621.0,620006.0,10.8071144,78.6880939,0,,
25658,Pankajam Sitharam Nursing Home,"5,Ranganatha Puram East,Srirangam, Tiruchirappalli, Tamil Nadu, 620006",621.0,620006.0,10.8071144,78.6880939,0,,
25659,Rengasri Child Care Clinic,"New No. 76, Gandhi Road, Srirangam, Tiruchirappalli, Tamil Nadu, 620006",621.0,620006.0,10.8071144,78.6880939,0,,
25660,Sreedevi Hospital,"16/4, Gandhi Road, Srirangam, Tiruchirappalli, Tamil Nadu, 620006",621.0,620006.0,10.8071144,78.6880939,0,,
25661,Vasan Eye Care Hospital(Unit Of Vasan Health Care Pvt Ltd),"No 14, Renganathapuram, Srirangam, Tiruchirappalli, Tamil Nadu, 620006",621.0,620006.0,10.8071144,78.6880939,0,,
25662,Thilagavathy Hospital,"#12, Wireless Road,Airport ,Kamaraj Nagar, Tiruchirappalli, Tamil Nadu, 620007",621.0,620007.0,10.8071144,78.6880939,0,,
25663,Dr G.Viswanathan Speciality Hospital,"27 ,Babu Road, Tiruchirappalli, Tamil Nadu, 620008",621.0,620008.0,10.8071144,78.6880939,0,,
25664,Gvn Hospital,"46, Singarathope, Tiruchirappalli, Tamil Nadu, 620008",621.0,620008.0,10.8071144,78.6880939,0,,
25665,Navin Medical Centre,"Deeran Nagar, Tiruchirappalli, Tamil Nadu, 620009",621.0,620009.0,10.8071144,78.6880939,0,,
25666,Neuro Center,"A9, 11Th Cross West,Thillai Nagar, Tiruchirappalli, Tamil Nadu, 620012",621.0,620012.0,10.8071144,78.6880939,0,,
25667,Olympia Hospital,"47,47-A, Puthur Road ,Puthur, Tiruchirappalli, Tamil Nadu, 620012",621.0,620012.0,10.8071144,78.6880939,0,,
25668,Trp Clinic Zone,"No:15 , 2Rd Cross ,Thillai Nagar Mn Rd, Tiruchirappalli, Tamil Nadu, 620012",621.0,620012.0,10.8071144,78.6880939,0,,
25669,Eye Care Hospitals,"No.6,Officers Colony,Puthur, Tiruchirappalli, Tamil Nadu, 620014",621.0,620014.0,10.8071144,78.6880939,0,,
25670,Sree Paduka Speciality Hospital,"No:B-35(S), 11Th Cross East, Thillainagar, Tiruchirappalli, Tamil Nadu, 620014",621.0,620014.0,10.8071144,78.6880939,0,,
25671,Jagadha Hospital,"3, First Cross West Extension, Thillai Nagar, Tiruchirappalli, Tamil Nadu, 620016",621.0,620016.0,10.8071144,78.6880939,0,,
25672,Arul Hospital,"No. 6, Thiruvika Nagar, Vannarapettai Corner, Opposite To Guru Medical, Puthur, Tiruchirappalli, Tamil Nadu, 620017",621.0,620017.0,10.8071144,78.6880939,0,,
25673,Assured Best Care Hospital,,621.0,620017.0,10.8071144,78.6880939,0,,
25674,Deepan Nursing Home,"50, Bishop Road ; Puthur, Tiruchirappalli, Tamil Nadu, 620017",621.0,620017.0,10.8071144,78.6880939,0,,
25675,Deepthi Hospital,"No. 31-A Mohanur Road, Namakkal, Tiruchirappalli, Tamil Nadu, 620017",621.0,620017.0,10.8071144,78.6880939,0,,
25676,Friends Eye Hospital,"Surya Avenue, Aryna Nagar, Puthur, Tiruchirappalli, Tamil Nadu, 620017",621.0,620017.0,10.8071144,78.6880939,0,,
25677,Gitanjali Medical Center - Tiruchirapalli,"No. 5, Vayaloor Road, Opposite Bishop Heber College Ground, Near Puthur Nal Road, Puthur, Tiruchirappalli, Tamil Nadu, 620017",621.0,620017.0,10.8071144,78.6880939,0,,
25678,Janet Hospital,"# 21-B, Jaganathapuram,Puthur, Tiruchirappalli, Tamil Nadu, 620017",621.0,620017.0,10.8071144,78.6880939,0,,
25679,Kauvery Hospital,"No 1 K C Road Tennur, Tiruchirappalli, Tamil Nadu, 620017",621.0,620017.0,10.8071144,78.6880939,0,,
25680,Kerala Ayurvedic Hospital,"No-10,Vishwanathpuram,Tennur, Tiruchirappalli, Tamil Nadu, 620017",621.0,620017.0,10.8071144,78.6880939,0,,
25681,Kingsley's Kids Clinic,"Rishivanam, 6-B, Vayalur Road,Puthur, Tiruchirappalli, Tamil Nadu, 620017",621.0,620017.0,10.8071144,78.6880939,0,,
25682,Kmc Heart City Hospital,"No1, K C Road Tennur, Tiruchirappalli, Tamil Nadu, 620017",621.0,620017.0,10.8071144,78.6880939,0,,
25683,Mahathma Eye Hospital,"No. 6, Seshapurm,Tennurtiruchiappalli, Tiruchirappalli, Tamil Nadu, 620017",621.0,620017.0,10.8071144,78.6880939,0,,
25684,Maruti Hospital,"95 Pattabiraman Street Tennur, Tiruchirappalli, Tamil Nadu, 620017",621.0,620017.0,10.8071144,78.6880939,0,,
25685,Moorthys Hospital Private Limited,"Heart Clinic 48/2,V>O>C> Road,Anna Nagar,Tennur, Tiruchirappalli, Tamil Nadu, 620017",621.0,620017.0,10.8071144,78.6880939,0,,
25686,Priya Nursing Home- Tiruchirapalli,"8-D , Ramarayar Street , Tennur , Thillainagar, Tiruchirappalli, Tamil Nadu, 620017",621.0,620017.0,10.8071144,78.6880939,0,,
25687,R J Hospital,"No-1, 7Th Cross , Srinivasa Nagar, Tiruchirappalli, Tamil Nadu, 620017",621.0,620017.0,10.8071144,78.6880939,0,,
25688,Retina Global Hospital,"95/1, Pattabiraman Street Tennur,Bhaarti, Tiruchirappalli, Tamil Nadu, 620017",621.0,620017.0,10.8071144,78.6880939,0,,
25689,Sri Ranga Nursing Home,"C-73,4Th Cross,Thillai Nagar,Tiruchirapalli, Tiruchirappalli, Tamil Nadu, 620017",621.0,620017.0,10.8071144,78.6880939,0,,
25690,Sundaram Hospital,"No.17, Evr Road,Near Chinthamani Super Market, Tiruchirappalli, Tamil Nadu, 620017",621.0,620017.0,10.8071144,78.6880939,0,,
25691,Vasan Medical Centre,"1E, Evr Road, Puthur, Tiruchirappalli, Tamil Nadu, 620017",621.0,620017.0,10.8071144,78.6880939,0,,
25692,Vihas Hospital,"31,Bishop Road,Puthur, Tiruchirappalli, Tamil Nadu, 620017",621.0,620017.0,10.8071144,78.6880939,0,,
25693,A B C Hospital,"Assured Best Care Hospital P Ltd, No. 1, Malligai Salaiannamalai Nagar, Annamalai Nagar Main Road, Tiruchirappalli, Tamil Nadu, 620018",621.0,620018.0,10.8071144,78.6880939,0,,
25694,Ananthagiri Hospital,"C-1,N.E.Extn, 1 St Cross Street, Thillai Nagar, Tiruchirappalli, Tamil Nadu, 620018",621.0,620018.0,10.8071144,78.6880939,0,,
25695,"Assured Best Care Hospital (P) Ltd., ( Abc Hospital)","#1, Annamalai Nagar,Main Road,Annamalai Nagar, Tiruchirappalli, Tamil Nadu, 620018",621.0,620018.0,10.8071144,78.6880939,0,,
25696,Athreya Rentinal Centre,"No. 1, 5Th Cross, Thillainagar, Tiruchirappalli, Tamil Nadu, 620018",621.0,620018.0,10.8071144,78.6880939,0,,
25697,Ayesha Hospital,"A-6,11Th Cross (East),Thillaingar, Tiruchirappalli, Tamil Nadu, 620018",621.0,620018.0,10.8071144,78.6880939,0,,
25698,Cethar Healthcare Services Private Limited.,"C-108,Fort Station Road,5Th Cross, Thillainagar,Makkal Mandram, Tiruchirappalli, Tamil Nadu, 620018",621.0,620018.0,10.8071144,78.6880939,0,,
25699,Dr S Chitra Lalitha Nursing Home,"Mtdto B2 S 10Th A Cross, Pallai Nagar, Tiruchirappalli, Tamil Nadu, 620018",621.0,620018.0,10.8071144,78.6880939,0,,
25700,Dr.Vas Hospital For Eye and Children,"C-124,5Th Cross,Thillainagar, Tiruchirappalli, Tamil Nadu, 620018",621.0,620018.0,10.8071144,78.6880939,0,,
25701,Eeswari Nursing Home,"B-34, 11Th Cross, Thillai Nagar, Tiruchirappalli, Tamil Nadu, 620018",621.0,620018.0,10.8071144,78.6880939,0,,
25702,Fathima Maternity Home,"4-B 10Th Cross Street, Rahmaniyapuram, Thillainagar, Tiruchirappalli, Tamil Nadu, 620018",621.0,620018.0,10.8071144,78.6880939,0,,
25703,Gastro Cre Hospital,"C,57 11Th Cross Thillai Nagar, Tiruchirappalli, Tamil Nadu, 620018",621.0,620018.0,10.8071144,78.6880939,0,,
25704,Girish Clinic and Nursing Home,"B-35,11Th Cross,Thillai Nagar, Tiruchirappalli, Tamil Nadu, 620018",621.0,620018.0,10.8071144,78.6880939,0,,
25705,Jeyam Urological Centre,"C-40, Iii Rd Cross,Thillainagar, Tiruchirappalli, Tamil Nadu, 620018",621.0,620018.0,10.8071144,78.6880939,0,,
