hospital_id,hospital_name,address,district_id,pincode,latitude,longitude,mco_contact_number,total_beds,hospital_type
24793,Sankara Kidney Hospital,"No: 2, Iii Main Road, New Colony, Chrompet,Chennai, Kanchipuram, Tamil Nadu, 600044",611.0,600044.0,12.9647163,79.9839686,0,,
24794,Sri Venkateswara Orthopaedic Speciality Hospital,"Plot No.51, Chandran Nagar, Chromepet, Kanchipuram, Tamil Nadu, 600044",611.0,600044.0,12.9647163,79.9839686,0,,
24795,Surya Physiotherapy Clinic,"81B/77, Radha Nagar Main Road,(Near Subiksha Super Market), Chromepet, Kanchipuram, Tamil Nadu, 600044",611.0,600044.0,12.9647163,79.9839686,0,,
24796,Vasan Eye Care Hospital,"Door No. 286, Gst Road, Chrompet, Kanchipuram, Tamil Nadu, 600044",611.0,600044.0,12.9647163,79.9839686,0,,
24797,Vel Nursing Home,"No. 196, Radha Nagar Main Road, Chromepet, Kanchipuram, Tamil Nadu, 600044",611.0,600044.0,12.9647163,79.9839686,0,,
24798,A.G Hospital,"29, Kakkan Street, Tambaram West, Chennai, Kanchipuram, Tamil Nadu, 600045",611.0,600045.0,12.9647163,79.9839686,0,,
24799,Babus Maternity Hospital,"New No. 7, Doraisamy Reddy Street Chennai, Kanchipuram, Tamil Nadu, 600045",611.0,600045.0,12.9647163,79.9839686,0,,
24800,Bethesda Medical Mission,"No.5, Beemeshnaran Koil Street, Tambaram West, Kanchipuram, Tamil Nadu, 600045",611.0,600045.0,12.9647163,79.9839686,0,,
24801,Deepam Hospitals Pvt Ltd,"327, Muthurangam Road West Tambaram Chennai, Kanchipuram, Tamil Nadu, 600045",611.0,600045.0,12.9647163,79.9839686,0,,
24802,Dr.Agarwal's Eye Hospital Ltd,"Tdk Towers, No.6 Duraisamy Reddy Street, Tambaram, Kanchipuram, Tamil Nadu, 600045",611.0,600045.0,12.9647163,79.9839686,0,,
24803,Gajanan Hospitals Pvt Ltd,"No.29, Kakkan Street, West Tambaryam, Kancheepuram, Kanchipuram, Tamil Nadu, 600045",611.0,600045.0,12.9647163,79.9839686,0,,
24804,Grace Multipeciality Hospital,"No.56 Medavaakkam Main Raod Keelkattalai, Kanchipuram, Tamil Nadu, 600045",611.0,600045.0,12.9647163,79.9839686,0,,
24805,Jawahar Hospital,"1, Lutheran Church Cross Street, Kadaperi, Tambaram, Kanchipuram, Tamil Nadu, 600045",611.0,600045.0,12.9647163,79.9839686,0,,
24806,Kk Eye Health Care And Research Centre,"34, Gandhi Road West Tambaram Chennai, Kanchipuram, Tamil Nadu, 600045",611.0,600045.0,12.9647163,79.9839686,0,,
24807,Mano Hospital,"No.1&2, Krishna Nagar,8Th Street, Mudichur Road,Near Andhra Bank,Thambaram West, Kanchipuram, Tamil Nadu, 600045",611.0,600045.0,12.9647163,79.9839686,0,,
24808,Nirmal Eye Care Centre,"108, Ayyasamy Street,West Tambaram, Kanchipuram, Tamil Nadu, 600045",611.0,600045.0,12.9647163,79.9839686,0,,
24809,Nn Hospital,"New No 39, Gandhi Road West Tambaram, Kanchipuram, Tamil Nadu, 600045",611.0,600045.0,12.9647163,79.9839686,0,,
24810,"S.K. Nursing Home, Hospital","#14, Duraiswami Pillai Street,Tambaram, Kanchipuram, Tamil Nadu, 600045",611.0,600045.0,12.9647163,79.9839686,0,,
24811,Saravana Ortho and Multi Speciality Hospital,"5, Bheemeshwaran Koil Street, West Tambaram, Palani Kalyana Mandapam Backside, Kanchipuram, Tamil Nadu, 600045",611.0,600045.0,12.9647163,79.9839686,0,,
24812,Sri Kumaran Women And Paediatric Centre,"# 3A - 3B ,Kakkan Street , West Tambaram, Chennai, Kanchipuram, Tamil Nadu, 600045",611.0,600045.0,12.9647163,79.9839686,0,,
24813,National Institute Of Siddha Department Of Ayush,"Ministry Of Health & Family Welfare ,Goverment Of India, Kanchipuram, Tamil Nadu, 600047",611.0,600047.0,12.9647163,79.9839686,0,,
24814,S P A Hospital,"864, G S T Road Tanbaram Sanatorium ( Opp: National Siddha Institute ), Kanchipuram, Tamil Nadu, 600047",611.0,600047.0,12.9647163,79.9839686,0,,
24815,Sundar Health Centre,"10 A,Baktavatsalm Street,West Tambaram,Chennai, Kanchipuram, Tamil Nadu, 600047",611.0,600047.0,12.9647163,79.9839686,0,,
24816,Christudas Orthopaedic Speciality Hospital,"9, I. A. F. Road, Elangovan Street,Durraisamy Nagar, Near East Tambaram, Kanchipuram, Tamil Nadu, 600059",611.0,600059.0,12.9647163,79.9839686,0,,
24817,S.R. Clinic,"No. 9/2A,Elangovan Street, East Tambaram, Kanchipuram, Tamil Nadu, 600059",611.0,600059.0,12.9647163,79.9839686,0,,
24818,B. M. Hospital,"No.36, 5Th Main Road, Thillai Ganga Nagar, Nanganallur, Kanchipuram, Tamil Nadu, 600061",611.0,600061.0,12.9647163,79.9839686,0,,
24819,Beach Chennai Hospital,"No 4, L I G Colony, New Market Wipsner ,Manpet, Kanchipuram, Tamil Nadu, 600061",611.0,600061.0,12.9647163,79.9839686,0,,
24820,Dr.Agarwal's Eye Hospital Ltd,"Ophthalmology Department, Margaret Sydney Hospital, 13,2Nd Street, Nanganallur, Kanchipuram, Tamil Nadu, 600061",611.0,600061.0,12.9647163,79.9839686,0,,
24821,Gowri Nursing Home,"18, 6Th Street Lakshmi Nagar, Nanganallur Chennai, Kanchipuram, Tamil Nadu, 600061",611.0,600061.0,12.9647163,79.9839686,0,,
24822,K.F. Hospital,"5, Sarwamangala Nagar, Nanganallur, Kanchipuram, Tamil Nadu, 600061",611.0,600061.0,12.9647163,79.9839686,0,,
24823,Pankajam Memorial Hospital,"C3, Hindu Colony, Nanganallur, Kanchipuram, Tamil Nadu, 600061",611.0,600061.0,12.9647163,79.9839686,0,,
24824,Sri Chakra Multi Speciality Hospital,"# 1, Civilaviation Colony,100 Feet Rd, Near Eb Office,Nanganallur, Kanchipuram, Tamil Nadu, 600061",611.0,600061.0,12.9647163,79.9839686,0,,
24825,Sri Venkateshwara`S C.M. Hospital,"1, 47Th Street, 5Th Main Road, Nanganallur, Kanchipuram, Tamil Nadu, 600061",611.0,600061.0,12.9647163,79.9839686,0,,
24826,Srinivasan Rajalakshmi Memorial Hospital,"11/77, Voltas Colony,6Th Street Nanganallur- 61, Kanchipuram, Tamil Nadu, 600061",611.0,600061.0,12.9647163,79.9839686,0,,
24827,Warriers Dental Care,"Ayodhya Flats No 5 ,Nanganallur, Kanchipuram, Tamil Nadu, 600061",611.0,600061.0,12.9647163,79.9839686,0,,
24828,Bappu Clinic And Nursing Home,"46, Kalaingar Main Road, Srinivasa Nagar,Perungalaturm Chennai, Kanchipuram, Tamil Nadu, 600063",611.0,600063.0,12.9647163,79.9839686,0,,
24829,Manushree Nursing Home,"No.5, Sankarar Street,Srinivasa Nagar,Peerkankaranai,Chennai, Kanchipuram, Tamil Nadu, 600063",611.0,600063.0,12.9647163,79.9839686,0,,
24830,B.S. Hospital,"No.16, Iiird Main Road, Chitlapakkam, Kanchipuram, Tamil Nadu, 600064",611.0,600064.0,12.9647163,79.9839686,0,,
24831,Deepak Health Care Centre P Ltd.,"30, Ayyasami Street, Nehru Nagar, Chromepet Channai, Kanchipuram, Tamil Nadu, 600064",611.0,600064.0,12.9647163,79.9839686,0,,
24832,Dr Sugumar Nursing Home,"# 7 / 1 , Pillaiyar Kovil Street, Anakaputhur, Chennai, Kanchipuram, Tamil Nadu, 600070",611.0,600070.0,12.9647163,79.9839686,0,,
24833,Bethesda Hospital andChild Care Centre,"No.31,I O B Colony,Bharthi Nagar,Camp Road,Seliayur, Kanchipuram, Tamil Nadu, 600073",611.0,600073.0,12.9647163,79.9839686,0,,
24834,Dr. K.K. Surgical and Paediatric Centre Pvt Ltd,"Door No.238/310, Plot No.33, Velachery Main Road, Selaiyur, East Tambaram, Chennai, Kanchipuram, Tamil Nadu, 600073",611.0,600073.0,12.9647163,79.9839686,0,,
24835,Sindu Hospital,"203, Velachery Main Road, Camp Road Junction, Selaiyur, Kanchipuram, Tamil Nadu, 600073",611.0,600073.0,12.9647163,79.9839686,0,,
24836,Vani Nursing Home,"279,Velachery,Main Road,Rajakilpakkam, Kanchipuram, Tamil Nadu, 600073",611.0,600073.0,12.9647163,79.9839686,0,,
24837,Das Nursing Home,"5/271, Prem Nagar Exten. Pozhichalur Main Road, Pozhichalur, Kanchipuram, Tamil Nadu, 600074",611.0,600074.0,12.9647163,79.9839686,0,,
24838,Jip Diabetic and Heart Care Centre,"No-26, Pammal Mn Rd,Muthamizh Ngr,Pammal , Chennai, Kanchipuram, Tamil Nadu, 600074",611.0,600074.0,12.9647163,79.9839686,0,,
24839,Arvind Sai Eye Hospital,"No. 1, Ganesan Street, (Pammal Main Road) Krishna Nagar, Pammal, Kanchipuram, Tamil Nadu, 600075",611.0,600075.0,12.9647163,79.9839686,0,,
24840,B.P. Jain Hospital (Sri Sankara Health Centre),"Plot No.6, Gokulam Colony, Anna Salai, Pammal, Kanchepuram, Kanchipuram, Tamil Nadu, 600075",611.0,600075.0,12.9647163,79.9839686,0,,
24841,Devibala Maternity,"No.19, 4Th Cross Street, Krishna Nagar, Pammal, Chennai, Kanchipuram, Tamil Nadu, 600075",611.0,600075.0,12.9647163,79.9839686,0,,
24842,Sankara Eye Hospital,"No.1, 3Rd Cross St. Sankar Nagar, Pammal, Kanchipuram, Tamil Nadu, 600075",611.0,600075.0,12.9647163,79.9839686,0,,
24843,Sree Sai Eye Hospital,"Janswar Vision Charitable Trust, No-01, Ganeshan Street, Pammal Main Road, Krishna Nagar, Pammal, Kanchipuram, Tamil Nadu, 600075",611.0,600075.0,12.9647163,79.9839686,0,,
24844,Subhikshaa Hospital Pvt Ltd,"17, Pillayar Koil Street, Krishna Nagar, Pammal, Kanchipuram, Tamil Nadu, 600075",611.0,600075.0,12.9647163,79.9839686,0,,
24845,Caps Dental Clinic and Face and Jaw Centre,"No.1/2 Amaravathy Street, Bharath Nagar, Adambakkam, Chennai, Kanchipuram, Tamil Nadu, 600088",611.0,600088.0,12.9647163,79.9839686,0,,
24846,K.P.Childrens HospitalandNeuro Centre,"#3,Medavakkam Road,Adambakkam, Kanchipuram, Tamil Nadu, 600088",611.0,600088.0,12.9647163,79.9839686,0,,
24847,M/S Frontier Life Line Hospital,"R- 30- C Ambattur Industrial Estate Road, Mogappair, Kanchipuram, Tamil Nadu, 600088",611.0,600088.0,12.9647163,79.9839686,0,,
24848,Ponmalligai Hospital Pvt Ltd,"#1, Kakkan Nagar 1St Main Road, Adambakkam, Kanchipuram, Tamil Nadu, 600088",611.0,600088.0,12.9647163,79.9839686,0,,
24849,Sarathy Nursing Home,"28, Vellala East 2Nd Street, Adambakkam, Kanchipuram, Tamil Nadu, 600088",611.0,600088.0,12.9647163,79.9839686,0,,
24850,Sp Hospital,"No 11, Vellalar 1St Street, Adambakkam, Kanchipuram, Tamil Nadu, 600088",611.0,600088.0,12.9647163,79.9839686,0,,
24851,Centre For Thoracic And Cardio Vascular Care,"4/112,Mount Poonamallee Road Manapakkam, Kanchipuram, Tamil Nadu, 600089",611.0,600089.0,12.9647163,79.9839686,0,,
24852,Miot Hospitals,"4/112, Mount Poonamalee Road, Manapakkam, Kanchipuram, Tamil Nadu, 600089",611.0,600089.0,12.9647163,79.9839686,0,,
24853,Roy's Heart Foundation,"No: 3/49, Valluvar Salai, Ramapuram, Kanchipuram, Tamil Nadu, 600089",611.0,600089.0,12.9647163,79.9839686,0,,
24854,Srushti Hospital,"No.1, Padmavathy Street, Thirumalai, Ramapuram, Kanchipuram, Tamil Nadu, 600089",611.0,600089.0,12.9647163,79.9839686,0,,
24855,Anjaka Hospital,"#23, Medavakkam Main Rd,Near K.K.Mahal ,Madipakkam, Kanchipuram, Tamil Nadu, 600091",611.0,600091.0,12.9647163,79.9839686,0,,
24856,Dr Jacquline Divyananda Divya Hospital),"No. 20, Medavakkam Main Road, Madipakkam, Kanchipuram, Tamil Nadu, 600091",611.0,600091.0,12.9647163,79.9839686,0,,
24857,Kumar Clinic,"280/2 Ponnaimman Koil Street, Chennai, Kanchipuram, Tamil Nadu, 600091",611.0,600091.0,12.9647163,79.9839686,0,,
24858,"Lifeline Hospital , Madipakkam","1, 2Nd Cross Street, Kannan Nagar, Madipakkam, Kanchipuram, Tamil Nadu, 600091",611.0,600091.0,12.9647163,79.9839686,0,,
24859,Ponni Hospital,"Neyvelli-2, Kanchipuram, Tamil Nadu, 600091",611.0,600091.0,12.9647163,79.9839686,0,,
24860,Saraswathy Speciality Hospitals,"92/A, Bazaar Road, Sadasiva Nagar, Nr Ram Nagar Bus Stop, Madipakkam, Kanchipuram, Tamil Nadu, 600091",611.0,600091.0,12.9647163,79.9839686,0,,
24861,Sibi Hospital,"Plot No. 5, Medavakkam Main Road, , Madipakkam,Near Madipakkam Koot Oad, Kanchipuram, Tamil Nadu, 600091",611.0,600091.0,12.9647163,79.9839686,0,,
24862,Sri G.M.Hospital,"#.39, Sabari Salai,Madipakkam, Kanchipuram, Tamil Nadu, 600091",611.0,600091.0,12.9647163,79.9839686,0,,
24863,Thirimoorthys Heart Care Hospital,"2/93, 2Nd Main Rod, Ragavanagar, Madipakkam, Kanchipuram, Tamil Nadu, 600091",611.0,600091.0,12.9647163,79.9839686,0,,
24864,Vasan Eye Care Hospital,"No: 683/5, Mahalingam Street ( Near Sbi ) Madipakkam, Kanchipuram, Tamil Nadu, 600091",611.0,600091.0,12.9647163,79.9839686,0,,
24865,Lifeline Multispeciality Hospital - Chennai,"No-5/639, Rajiv Gandhi Salai(Omr), Mahabalipuram Road, Perungudi, Chennai, Kanchipuram, Tamil Nadu, 600096",611.0,600096.0,12.9647163,79.9839686,0,,
24866,Nanthini Hospital,"168, Chandrasekaran Avenue, O.M.R, Thoraipakkam , Opposite To P.T.C Bus Stop, Kanchipuram, Tamil Nadu, 600096",611.0,600096.0,12.9647163,79.9839686,0,,
24867,Sri Lakshmi Multi Speciality Hospital Pvt Ltd,"5/91, Church Road, Perungudi, Near Andrew Yulex Colony, Chengalpattu, Kanchipuram, Tamil Nadu, 600096",611.0,600096.0,12.9647163,79.9839686,0,,
24868,Fracture OrthopedicsandJoint Replacement,"No.5&6,Palaniappa Nagar,Sriranga Garden, Kanchipuram, Tamil Nadu, 600097",611.0,600097.0,12.9647163,79.9839686,0,,
24869,Balagandhara Varma Nursing Home and Research Center,"17, First Main Road Iit Colony, Kanchipuram, Tamil Nadu, 600100",611.0,600100.0,12.9647163,79.9839686,0,,
24870,Dr. Kamakshi Memorial Hospital,"No. 1, Radial Road,Pallikaranai, Near Velachery Bus Stand,Chennai, Kanchipuram, Tamil Nadu, 600100",611.0,600100.0,12.9647163,79.9839686,0,,
24871,Dr Agarwals Eye Hospital Ltd,"No 49, Aruot Road Porur Porur Chennai, Kanchipuram, Tamil Nadu, 600116",611.0,600116.0,12.9647163,79.9839686,0,,
24872,M S Kedar Hospital,"19, Vinayagapuram, Mugalivakkam Main Road Porur, Kanchipuram, Tamil Nadu, 600116",611.0,600116.0,12.9647163,79.9839686,0,,
24873,Viganesh Hospital,"36, Poothapedu Main Road, Vengadeswar Nagar, Perur, Kanchipuram, Tamil Nadu, 600116",611.0,600116.0,12.9647163,79.9839686,0,,
24874,Lakshmi Clinic,"G-1,Thiruvalluvar Narar Main Road, Keelkattalai, Kanchipuram, Tamil Nadu, 600117",611.0,600117.0,12.9647163,79.9839686,0,,
24875,Vijayam Hospital,"No. 70, Medavakkam Main Road, Next To Subiksha Super Market, Keelkattalai, Chennai, Kanchipuram, Tamil Nadu, 600117",611.0,600117.0,12.9647163,79.9839686,0,,
24876,Kanaga Hospital,"No:3/225 Kundrathur Main Road Kovur, Kanchipuram, Tamil Nadu, 600122",611.0,600122.0,12.9647163,79.9839686,0,,
24877,Sayee Hospitals,"#234, Wallajah Main Rd,Opposite Indian Oil Petrol Bunk, Kanchipuram, Tamil Nadu, 601301",611.0,601301.0,12.9647163,79.9839686,0,,
24878,Anitha Nursing Home,"Bangalore High Road,Sunguvarchatram, Kanchipuram, Tamil Nadu, 602105",611.0,602105.0,12.9647163,79.9839686,0,,
24879,Deepika Eye Care Hospital,"Chenglepet Road, Opposite To Tvs Axles India, Sriperumbudur, Kancheepuram, Kanchipuram, Tamil Nadu, 602105",611.0,602105.0,12.9647163,79.9839686,0,,
24880,Dr P K Vijaya Ganapathy Hospital,"70, Gandhi Road Sriperumbudur, Kanchipuram, Tamil Nadu, 602105",611.0,602105.0,12.9647163,79.9839686,0,,
24881,Kshetropasna Medical Trust Ayurveda Hospital,"Brindavan, Maduvankarai, Sriperumbuder, Kanchipuram, Kanchipuram, Tamil Nadu, 602105",611.0,602105.0,12.9647163,79.9839686,0,,
24882,Pandian Hospital,"No 76, Bangalore Main Road, Mg Nagar Sriperumbudur, Kanchipuram, Tamil Nadu, 602105",611.0,602105.0,12.9647163,79.9839686,0,,
24883,Prepare Hospital,"Chingelpet Sriperambudur Sriperumbudur, Kanchipuram, Tamil Nadu, 602105",611.0,602105.0,12.9647163,79.9839686,0,,
24884,Balaji Hospital,"No:14, Varadhanar Street Vedachala Nagar Chengalpattu, Kanchipuram, Tamil Nadu, 603001",611.0,603001.0,12.9647163,79.9839686,0,,
24885,Beent Hospital,"No,19, Devadoss Steet, Vedachelam Nagar, Chenglpattu, Kanchipuram, Tamil Nadu, 603001",611.0,603001.0,12.9647163,79.9839686,0,,
24886,J S P Hospital,"70, Kanchipuram High Road, Chengalpattu, Near To Chengalpattu By Pass Connection Of Kancheepuram High Road, Kanchipuram, Tamil Nadu, 603001",611.0,603001.0,12.9647163,79.9839686,0,,
24887,J. J. Hospital,"55, Dr. Varadharajan Street, Vedhachala Nagar, Chengalpattu, Chengalpet, Kanchipuram, Tamil Nadu, 603001",611.0,603001.0,12.9647163,79.9839686,0,,
24888,Nambi Nursing Home and Research Centre,"#21, Devarajan Street, Kanchipuram, Tamil Nadu, 603001",611.0,603001.0,12.9647163,79.9839686,0,,
24889,Sri Ranga Nursing Home,"No12,Varada Reddy Street, Vedachala Nagar,Chengalpat, Kanchipuram, Tamil Nadu, 603001",611.0,603001.0,12.9647163,79.9839686,0,,
24890,Sri Venkatramana Hospital,"No. 11-A, Varadhanar Street, Vedachalanagr, Chengalapttu, Kanchipuram, Tamil Nadu, 603001",611.0,603001.0,12.9647163,79.9839686,0,,
24891,Sundaram Hospital,"No 21-A Devarajanar Street ,Vedachala Nagar Chengalpattu, Kanchipuram, Tamil Nadu, 603001",611.0,603001.0,12.9647163,79.9839686,0,,
24892,Vidhya Nursing Home,"# 50, J.C.K. Nagar, Kanchipuram, Tamil Nadu, 603002",611.0,603002.0,12.9647163,79.9839686,0,,
24893,Chettinad Hospital,"Chettinad Health City, It Highway Omr Road,Rajiv Gandhi Salai, Kelambakam, Kanchipuram, Tamil Nadu, 603103",611.0,603103.0,12.9647163,79.9839686,0,,
24894,Suradeep Hospital,"Thirukulam Street, Mamalla Puram, Kanchipuram, Tamil Nadu, 603104",611.0,603104.0,12.9647163,79.9839686,0,,
24895,Srm Hospital And Research Centre,"Srm Nagar, Potheri Kattankulathur Kattankulathur, Kanchipuram, Tamil Nadu, 603203",611.0,603203.0,12.9647163,79.9839686,0,,
24896,Muthu Ganapathy Hospital,"No.4/324, Nethaji Street, Singaperumal Koil, Kanchipuram, Tamil Nadu, 603204",611.0,603204.0,12.9647163,79.9839686,0,,
24897,Sree Sakthi Hospital,"1 / 120, Bharathiyar Street, Singaperumalkoil, Kanchipuram, Tamil Nadu, 603204",611.0,603204.0,12.9647163,79.9839686,0,,
24898,Hindu Mission Health Services,"100 Ft Road, Hindu Colony, Kancheepuram, Kanchipuram, Tamil Nadu, 603209",611.0,603209.0,12.9647163,79.9839686,0,,
24899,J.S.Hospital,"No:12,Mgr Salai,Nh-I,Hig,Marai Malai Nagar, Kanchipuram, Tamil Nadu, 603209",611.0,603209.0,12.9647163,79.9839686,0,,
24900,Surya Hospital,"1, Nhii, Kammbar Street, Kanchipuram, Tamil Nadu, 603209",611.0,603209.0,12.9647163,79.9839686,0,,
24901,Malmaravathur Adhiparasakthi Institute Of Medical,"Melmaruvathur, Kanchipuram, Tamil Nadu, 603319",611.0,603319.0,12.9647163,79.9839686,0,,
24902,Mapims( Melmaruvathur Adhiparasakthi Institute Of Medical Sciences and Research,"G.S.T.Road,Temple Back Side, Kanchipuram, Tamil Nadu, 603319",611.0,603319.0,12.9647163,79.9839686,0,,
24903,Melmaruvathur Adhiparasakthi Institute Of Medical,"Melmaruvathur, Kanchipuram, Tamil Nadu, 603319",611.0,603319.0,12.9647163,79.9839686,0,,
24904,Csi Hospital,"21 A Hospital Road, Kanchipuram, Tamil Nadu, 631501",611.0,631501.0,12.9647163,79.9839686,0,,
24905,Dr Agarwals Eye Hospital Ltd,"No: 32-B, Indira Gandhi Road, Kanchipuram, Tamil Nadu, 631501",611.0,631501.0,12.9647163,79.9839686,0,,
24906,Malikeswari Clinic,"# 4, Ennaikkara Street, Kanchipuram, Tamil Nadu, 631501",611.0,631501.0,12.9647163,79.9839686,0,,
24907,Manohar General Hospital,"Railway Road, Kanchipuram, Tamil Nadu, 631501",611.0,631501.0,12.9647163,79.9839686,0,,
24908,Modern Urology Centre - Kollam,"Polayathode, Kollam, Kanchipuram, Tamil Nadu, 631501",611.0,631501.0,12.9647163,79.9839686,0,,
24909,Sri D.K.K. Hospital,"No 5,Nadu Street,Sheikpet, Kanchipuram, Tamil Nadu, 631501",611.0,631501.0,12.9647163,79.9839686,0,,
24910,V.S.R Ortho Hospital,"45, Kamarajar St, Kanchipuram, Tamil Nadu, 631501",611.0,631501.0,12.9647163,79.9839686,0,,
24911,Vasan Eye Care Hospital,"No 1, Vallal Pachaiyappan St, Kanchipuram, Tamil Nadu, 631501",611.0,631501.0,12.9647163,79.9839686,0,,
24912,Adi Bhagavatpada Cardiac and Dialysis Hospital,"No.14,Ulagalandha Perumal Kovil Sannathi Street,Big, Kanchipuram, Tamil Nadu, 631502",611.0,631502.0,12.9647163,79.9839686,0,,
24913,Church Of South India Hospital,"Hospital Road, Kanchipuram, Tamil Nadu, 631502",611.0,631502.0,12.9647163,79.9839686,0,,
24914,Lakshmi Hospital,"Chittur Road , Palakkad Between Fort Maidan & Manapullikkavu Between Fort Maidan & Manapullikkavu, Kanchipuram, Tamil Nadu, 631502",611.0,631502.0,12.9647163,79.9839686,0,,
24915,Senthil Maternity Center,"7B,Aram Valatheeswaran Kovil Street, Kanchipuram, Tamil Nadu, 631502",611.0,631502.0,12.9647163,79.9839686,0,,
24916,Meenakshi Medical College Hospital And Research Institute,"Enathur, Kancheepuram Enathur Village, Kanchipuram, Tamil Nadu, 631552",611.0,631552.0,12.9647163,79.9839686,0,,
24917,Robin Hospital,"Udayar Bilia, Colachel, Kanniyakumari, Tamil Nadu, 629251",636.0,629251.0,8.3279814,77.3541173,0,,
24918,Ag Hospital And Diagnostic Care Centre,"16 Nagercoil Nagercoil, Kanniyakumari, Tamil Nadu, 629001",636.0,629001.0,8.3279814,77.3541173,0,,
24919,Ananthi Hospital,"Meenakshipuram, Kanniyakumari, Tamil Nadu, 629001",636.0,629001.0,8.3279814,77.3541173,0,,
24920,Balasundaram - Shyamala Hospital,"287 A , Avvai Shanmugam Road, Ozhuginasery, Nagercoil, Kanniyakumari, Tamil Nadu, 629001",636.0,629001.0,8.3279814,77.3541173,0,,
24921,Dr M Gopala Pillais Jawahar Hospital,"R V Puram, Kanniyakumari, Tamil Nadu, 629001",636.0,629001.0,8.3279814,77.3541173,0,,
24922,Dr. Anto Ent Head and Neck Hospital,"No:34-F, Distillary Road, Nagercoil, Kanniyakumari, Tamil Nadu, 629001",636.0,629001.0,8.3279814,77.3541173,0,,
24923,Dr. Gopala Pilla`S Hospital,"Ramavarmapuram,  Nagercoil, Kanniyakumari, Tamil Nadu, 629001",636.0,629001.0,8.3279814,77.3541173,0,,
24924,Dr. J. Mathias Hospital,"Kottar-Parvathipuram Road,Near Palpannai Bus Stop, Kanniyakumari, Tamil Nadu, 629001",636.0,629001.0,8.3279814,77.3541173,0,,
24925,Dr.Jeyasekaran Medical Trust,"K.P.Road Nagerkoil, Kanniyakumari, Tamil Nadu, 629001",636.0,629001.0,8.3279814,77.3541173,0,,
24926,Dr.Morris Mathias Hospital,"Dr.Mathias Nagar, Nagercoil, Kanniyakumari, Tamil Nadu, 629001",636.0,629001.0,8.3279814,77.3541173,0,,
24927,Gautham Nursing,"Eilliam Hospital Complexkrishnancoil,Nagercoil. 1, Kanniyakumari, Tamil Nadu, 629001",636.0,629001.0,8.3279814,77.3541173,0,,
24928,George Mission Hospital,"Vaithanathapuram, Nagercoil-2, Kanniyakumari, Tamil Nadu, 629001",636.0,629001.0,8.3279814,77.3541173,0,,
24929,Gopalapillai Hospital,"Nagercoil Nagercoil Nagercoil, Kanniyakumari, Tamil Nadu, 629001",636.0,629001.0,8.3279814,77.3541173,0,,
24930,Irene Hospital,"26/1 - 78,Asaripallam Road,Nagercoil, Kanniyakumari, Tamil Nadu, 629001",636.0,629001.0,8.3279814,77.3541173,0,,
24931,J. K. Hospital,"1- Sannathi Street, Krishnan Koil, Nagercoil, Kanniyakumari, Tamil Nadu, 629001",636.0,629001.0,8.3279814,77.3541173,0,,
24932,James Orthopaedic Clinic,"No 246 A K.P Road Nager Coil, Kanniyakumari, Tamil Nadu, 629001",636.0,629001.0,8.3279814,77.3541173,0,,
24933,Joseph Sahaayam Speciality Hospitals,"179/3, Ganesapuram Road, Nagercoil, Nagercoil, Kanniyakumari, Tamil Nadu, 629001",636.0,629001.0,8.3279814,77.3541173,0,,
24934,Kanyakumari Medical Mission,"Nagercoil, Kanniyakumari, Tamil Nadu, 629001",636.0,629001.0,8.3279814,77.3541173,0,,
24935,Lekshmi Hospital,"Kottar, Nagercoil, Kanniyakumari, Tamil Nadu, 629001",636.0,629001.0,8.3279814,77.3541173,0,,
24936,Little Flower Hospital,"Ramanputhur Junction, Nagercoil, Kanniyakumari, Tamil Nadu, 629001",636.0,629001.0,8.3279814,77.3541173,0,,
24937,Manuel Orthopaedic Hospital,"Therekal Puthoor,Tirunelveli Road,Ganesan Sae Mill, Kanniyakumari, Tamil Nadu, 629001",636.0,629001.0,8.3279814,77.3541173,0,,
24938,Maria Diabetic And Diagnostic Centre,"#9/1, Watertank Road,Near Bsnl Office, Kanniyakumari, Tamil Nadu, 629001",636.0,629001.0,8.3279814,77.3541173,0,,
24939,Moses Mathias Hospital,"K.P.Road, Mathias Nagar, Nagercoil, Kanniyakumari, Tamil Nadu, 629001",636.0,629001.0,8.3279814,77.3541173,0,,
24940,Muthunayagam Hospital,"K.P.Road, Mathias Nagar, Nagercoil, Kanniyakumari, Tamil Nadu, 629001",636.0,629001.0,8.3279814,77.3541173,0,,
24941,P S Medical Trust Hospital,"Uthuvilai , Thalakulam, Kanniyakumari, Tamil Nadu, 629001",636.0,629001.0,8.3279814,77.3541173,0,,
24942,Ramamurthy Hospital,"No.1, Perianadar Street,P.W.D. Road,Opposite Police Quarters, Kanniyakumari, Tamil Nadu, 629001",636.0,629001.0,8.3279814,77.3541173,0,,
24943,Raman Hospital,"Collectorate Junction Nagercoil Nagercoil Nagercoil, Kanniyakumari, Tamil Nadu, 629001",636.0,629001.0,8.3279814,77.3541173,0,,
24944,S J Nursing Home,"Cbh Road,Arughvilai,Nagercoil, Kanniyakumari, Tamil Nadu, 629001",636.0,629001.0,8.3279814,77.3541173,0,,
24945,S.R.Kidney Care Hospital,"#18, Cave St, Kanniyakumari, Tamil Nadu, 629001",636.0,629001.0,8.3279814,77.3541173,0,,
24946,Sam Hospital,"#29/1 -172 , College Rd, Kanniyakumari, Tamil Nadu, 629001",636.0,629001.0,8.3279814,77.3541173,0,,
24947,Saradha Clinic,"54 Asambu Road Vadasery Nagercoil, Kanniyakumari, Tamil Nadu, 629001",636.0,629001.0,8.3279814,77.3541173,0,,
24948,Srinivasa Hospitals,"#5/146-2, Tirunelvely Main Road,Therekalputhoor,Thirupathisaram (Po), Kanniyakumari, Tamil Nadu, 629001",636.0,629001.0,8.3279814,77.3541173,0,,
24949,Subam Hospitals,"215, Opposite S.M.R.V. School, Vadasery , Nagercoil, Kanniyakumari, Tamil Nadu, 629001",636.0,629001.0,8.3279814,77.3541173,0,,
24950,Sudha Sundar Hospital,"135-B Balamore Road Puthery Nagercoil, Kanniyakumari, Tamil Nadu, 629001",636.0,629001.0,8.3279814,77.3541173,0,,
24951,The Salvation Army Catherine Booth Hospital,"Cbh,Assambu Road, Puther, Kanniyakumari, Tamil Nadu, 629001",636.0,629001.0,8.3279814,77.3541173,0,,
24952,Thiraviam Orthopaedic Hospital,"2/191, Tirunelveli, Main Road, Therekal Puthoor, Thirupathi Saram Post, Kanniyakumari, Tamil Nadu, 629001",636.0,629001.0,8.3279814,77.3541173,0,,
24953,Trust Hospital,"K.P. Road,Parvathipuram, Kanniyakumari, Tamil Nadu, 629001",636.0,629001.0,8.3279814,77.3541173,0,,
24954,Umar Hospital,"North Car Street, Near Nagaraja Temple Nagercoil, Kanniyakumari, Tamil Nadu, 629001",636.0,629001.0,8.3279814,77.3541173,0,,
24955,Vasan Eye Care Hospital,"No 56/57, M S Road Vadesry, Nagercoil, Kanniyakumari, Tamil Nadu, 629001",636.0,629001.0,8.3279814,77.3541173,0,,
24956,Vasantham Health Centre Pvt Ltd,"Dennison Road Nagercoil Nagercoil, Kanniyakumari, Tamil Nadu, 629001",636.0,629001.0,8.3279814,77.3541173,0,,
24957,Willam Hospital,"252 Vetoornimadam Nagercoil Nagercoil, Kanniyakumari, Tamil Nadu, 629001",636.0,629001.0,8.3279814,77.3541173,0,,
24958,Abdul Khadir Hospital,"Kottar, Nagercoil Kanniyakumari, Kanniyakumari, Tamil Nadu, 629002",636.0,629002.0,8.3279814,77.3541173,0,,
24959,Dr. Ezhilarasu Children And Specialities Hospital,"#7/33, Natarajapuram Street,Meenakshipuram,In Fornt Of A.S. T. Kalyana Mandapam, Kanniyakumari, Tamil Nadu, 629002",636.0,629002.0,8.3279814,77.3541173,0,,
24960,Dr.Thanappans Children Hospital,"28,Rukmani Subramonium Hall, Thalavai Street, Meenakshipuram,Nagercoil, Kanniyakumari, Tamil Nadu, 629002",636.0,629002.0,8.3279814,77.3541173,0,,
