hospital_id,hospital_name,address,district_id,pincode,latitude,longitude,mco_contact_number,total_beds,hospital_type
24255,Hande Medical Centre,"#65, Nungambakkam High Road (Opposite ICICI and SBI bank  where Haddows Road joins Nungambakkam High Road ), Opposite ICICI and SBI bank\nPonnangipuram, Tirumurthy Nagar, Chennai, Tamil Nadu, 600034",610.0,600034.0,13.0836939,80.270186,0,,
24256,Hari Haran Diabetes and Heart Care Hospitals Pvt Ltd,"24 and 26, 'Swathi', 29 Th Street, Chennai, Tamil Nadu, 600061",610.0,600061.0,13.0836939,80.270186,0,,
24257,Hindu Mission Health Services,"100 Feet Road, Hindu Colony, Near EB Office, Chennai, Tamil Nadu, 600061",610.0,600061.0,13.0836939,80.270186,0,,
24258,Hindu Mission Hospital,"103 G.S.T.Road, Chennai, Tamil Nadu, 600045",610.0,600045.0,13.0836939,80.270186,0,,
24259,Hopkins ENT Hospitals,"No 5/45, Shanmugam Road, Opposite to old SBI building, Chennai, Tamil Nadu, 600045",610.0,600045.0,13.0836939,80.270186,0,,
24260,Huma Specialists Hospital and Research Centre Pvt Ltd,"786 Anna Salai, CIT Nagar West, Chennai, Tamil Nadu, 600035",610.0,600035.0,13.0836939,80.270186,0,,
24261,Impcops Hospital,"34-37, Kalki Krishnamurthy Salai, Chennai, Tamil Nadu, 600041",610.0,600041.0,13.0836939,80.270186,0,,
24262,Jaya Hospital,"No.3, Kothanda Nadar Nagar, Sriperumbudur, Nenmeli, Chennai, Tamil Nadu, 602105",610.0,602105.0,13.0836939,80.270186,0,,
24263,Janaki E.N.T.Nursing Home,"29, Nagamani Garden Street, Seven Wells South, Near Govindappa Naicken Street end, George Town, Flower Bazar Police Station, Chennai, Tamil Nadu, 600001",610.0,600001.0,13.0836939,80.270186,0,,
24264,K.H.M.Hospital,"AB-14/4907, Balasubramanian Building, Opposite Sri Ayyappa Temple, 6th Main Road, Chennai, Tamil Nadu, 600040",610.0,600040.0,13.0836939,80.270186,0,,
24265,K.J.Hospital,"New-182, Old-927, Poonamalee High Road, Flower Road, Chennai, Tamil Nadu, 600084",610.0,600084.0,13.0836939,80.270186,0,,
24266,K.K.R.ENT Hospital and Research Institute(P) Ltd,"No: 827, Poonamallee High Road, Chennai, Tamil Nadu, 600010",610.0,600010.0,13.0836939,80.270186,0,,
24267,K.S.Hospital,"747, Poonamallee High Road, Chennai, Tamil Nadu, 600031",610.0,600031.0,13.0836939,80.270186,0,,
24268,Kummaran Eye Speciality Centre,"67/79, Choolaimedu High Road, Chennai, Tamil Nadu, 600094",610.0,600094.0,13.0836939,80.270186,0,,
24269,Kumaran Hospital Pvt.Ltd.,"214, E.V.R.Periyar Salai, Poonamalee High Road, Periyar Salai, Chennai, Tamil Nadu, 600010",610.0,600010.0,13.0836939,80.270186,0,,
24270,Laksha Hospital,"No.15, P.S.Sivasamy Salai Road, P.S.Sivasamy Salai, Chennai, Tamil Nadu, 600004",610.0,600004.0,13.0836939,80.270186,0,,
24271,Laser and Laparascopic Hospital,"No.121 G.N.Chetty Road, Chennai, Tamil Nadu, 600017",610.0,600017.0,13.0836939,80.270186,0,,
24272,Life Line Multi Speciality,"47/3, New Avani Roan, Kilpavk, Chennai, Tamil Nadu, 600010",610.0,600010.0,13.0836939,80.270186,0,,
24273,"M N Eye Hospital Private Limited, Adyar","No.33/18, M.G.Road; 2nd Avenue,\nSasthri nagar, Chennai, Tamil Nadu, 600020",610.0,600020.0,13.0836939,80.270186,0,,
24274,"M N Eye Hospital Private Limited, Tondiarpet","No.781, T H Road, Opposite Tondiarpet Police Station, Chennai, Tamil Nadu, 600021",610.0,600021.0,13.0836939,80.270186,0,,
24275,Chamadhi Nethralayam Eye Hospital,"Ambattur Rotary Hospital, 1st Main Road, Ambattur Industrial Estate, Chennai, Tamil Nadu, 600058",610.0,600058.0,13.0836939,80.270186,0,,
24276,Chamadhi Nethralayam Eye Hospital,"No.9, Kasi Viswanathan Street, Opposite To Ambika Theatre, Voc Nagar, Chennai, Tamil Nadu, 600052",610.0,600052.0,13.0836939,80.270186,0,,
24277,Chamadhi Nethralayam Eye Hospital,"No.878, Thiruvottiyur High Road, Theradi bus stop near, Chennai, Tamil Nadu, 600019",610.0,600019.0,13.0836939,80.270186,0,,
24278,Anush Hospital,"1/2, Barathi Nagar, Sathyamangalam, Coimbatore, Tamil Nadu, 638402",639.0,638402.0,11.0018115,76.9628425,0,,
24279,Pee Vee Hospital,"167 , Raja Street, Sathyamangalam, Coimbatore, Tamil Nadu, 638402",639.0,638402.0,11.0018115,76.9628425,0,,
24280,Ganga Medical Centre and Hospital,"313,Mettupalayam Road, Coimbatore, Tamil Nadu, 641001",639.0,641001.0,11.0018115,76.9628425,0,,
24281,Immaculate Conception Convent Hospital,"37, Ismail Rowther Street, Coimbatore, Tamil Nadu, 641001",639.0,641001.0,11.0018115,76.9628425,0,,
24282,K Govindaswamy Naidu Medical Trust,"No 5 Arts College Road , No 5 Arts College Road, Coimbatore, Tamil Nadu, 641001",639.0,641001.0,11.0018115,76.9628425,0,,
24283,Karthic Nursing Home Pvt. Ltd.,"158, Karuppa Gounder Street, Coimbatore, Tamil Nadu, 641001",639.0,641001.0,11.0018115,76.9628425,0,,
24284,Saraswathi Hospital,"No. 152-A,Trichy Road,Sinthamanipudur, Coimbatore, Tamil Nadu, 641001",639.0,641001.0,11.0018115,76.9628425,0,,
24285,Shanmuga Nursing Home,"28,Venkatakrishna Road,R S Puram, Coimbatore, Tamil Nadu, 641001",639.0,641001.0,11.0018115,76.9628425,0,,
24286,Suwaathi Hospital,"25, Ishwarya Nagar, Udamalpet Post, Coimbatore, Tamil Nadu, 641001",639.0,641001.0,11.0018115,76.9628425,0,,
24287,Vasavi Hospital,"No. 608, Big Bazaar Street, Coimbatore, Tamil Nadu, 641001",639.0,641001.0,11.0018115,76.9628425,0,,
24288,Akilesh Orthopaedics Hospitals,"152-A, Venkatasamy Road East,R. S. Puram, Coimbatore, Tamil Nadu, 641002",639.0,641002.0,11.0018115,76.9628425,0,,
24289,Balaji Nursing Home,"48, Cowley Brown Road, R.S. Puram, Coimbatore, Tamil Nadu, 641002",639.0,641002.0,11.0018115,76.9628425,0,,
24290,Coimbatore Bone and Joint Foundation (P) Ltd.,"#1091, Mettupalayam Rd,North Coimbatore Bus Stop, Coimbatore, Tamil Nadu, 641002",639.0,641002.0,11.0018115,76.9628425,0,,
24291,Gateway Clinic,"43, Periyasamy Road(West ), Behind Eye Foundation . R S Puram, Coimbatore, Tamil Nadu, 641002",639.0,641002.0,11.0018115,76.9628425,0,,
24292,K R Healthcare Pvt Ltd,"90/F-3, Mtp Main Road , Near Easwaran Koil, P.N. Palayam, Coimbatore, Tamil Nadu, 641002",639.0,641002.0,11.0018115,76.9628425,0,,
24293,K.M.Polyclinic,"64,Arokiasamy Road(West),R.S.Puram, Coimbatore, Tamil Nadu, 641002",639.0,641002.0,11.0018115,76.9628425,0,,
24294,"Kumaran Hospital, Coimbatore","Cowley Brown Road, R.S.Puram, Coimbatore, Tamil Nadu, 641002",639.0,641002.0,11.0018115,76.9628425,0,,
24295,Lasik Centre Pvt Ltd,"55-56 Subramaniam Road, Coimbatore, Tamil Nadu, 641002",639.0,641002.0,11.0018115,76.9628425,0,,
24296,Maruthi Hospital,"361, D B Road R S Puram R S Puram, Coimbatore, Tamil Nadu, 641002",639.0,641002.0,11.0018115,76.9628425,0,,
24297,Ponnaiah Hospital,"232, , East Thiruvenkatasamy Road,R S Puram, Coimbatore, Tamil Nadu, 641002",639.0,641002.0,11.0018115,76.9628425,0,,
24298,Rao Hospital,"119, 120, West Periaswamy Road R S Puram u, Coimbatore, Tamil Nadu, 641002",639.0,641002.0,11.0018115,76.9628425,0,,
24299,Rasi Hospital,"558, D B Road R S Puram, Coimbatore, Tamil Nadu, 641002",639.0,641002.0,11.0018115,76.9628425,0,,
24300,Sankara Eye Hospital,"Srivari Kikani Centre,R.S.Puram, Coimbatore, Tamil Nadu, 641002",639.0,641002.0,11.0018115,76.9628425,0,,
24301,Saravana Surgery,"356, D B Road, R S Puram, Coimbatore, Tamil Nadu, 641002",639.0,641002.0,11.0018115,76.9628425,0,,
24302,Sengallippan Nursing Home,"684, Ponnai Gowder Road, Coimbatore, Tamil Nadu, 641002",639.0,641002.0,11.0018115,76.9628425,0,,
24303,Shree Saravana Nursing Home,"356, D.B.Road, R.S.Puram, Coimbatore, Tamil Nadu, 641002",639.0,641002.0,11.0018115,76.9628425,0,,
24304,Sri Ramana Hospital,"297&298, D B Road, R S Puram, Coimbatore, Tamil Nadu, 641002",639.0,641002.0,11.0018115,76.9628425,0,,
24305,Sri Thulasi Hospitals,"# 356, D.B. Road, R.S.Puram, Opposite To Kennedy Theatre, Coimbatore, Tamil Nadu, 641002",639.0,641002.0,11.0018115,76.9628425,0,,
24306,Sruti Hospitals,"7,Ramachandra Road,R.S.Puram, Coimbatore, Tamil Nadu, 641002",639.0,641002.0,11.0018115,76.9628425,0,,
24307,The Eye Foundaton,"582-A , D B Road, R, S, Puram, Coimbatore, Tamil Nadu, 641002",639.0,641002.0,11.0018115,76.9628425,0,,
24308,Vasan Eye Care Hospital,"81/83, T V Sami Road West, Opp To Kamatchiamman Temple, R S Puram, Coimbatore, Tamil Nadu, 641002",639.0,641002.0,11.0018115,76.9628425,0,,
24309,Vedanayagam Hospital (P) Limited,"New No.52 ,Old No.133 , East Bashyakaralu Road,R.S. Puram,End Of Maruthi Theatre Road, Coimbatore, Tamil Nadu, 641002",639.0,641002.0,11.0018115,76.9628425,0,,
24310,Veekuu Surgery,"19,Cowley Brown Road, R.S Puram,Cbe-02, Coimbatore, Tamil Nadu, 641002",639.0,641002.0,11.0018115,76.9628425,0,,
24311,Vega Ent Hospital,"#30, Guru Govind Singh Road Off.,Cowley Brown Road,R. S. Puram, Coimbatore, Tamil Nadu, 641002",639.0,641002.0,11.0018115,76.9628425,0,,
24312,Vijaya Hospitals,"46, Cowley Brown Road, R.S.Puram R.S.Puram, Coimbatore, Tamil Nadu, 641002",639.0,641002.0,11.0018115,76.9628425,0,,
24313,Vikaram Hospital,"69, West Venkatasamy Road, R S Puram, Coimbatore, Tamil Nadu, 641002",639.0,641002.0,11.0018115,76.9628425,0,,
24314,Senthil Hospital - Coimbatore,"8/1 R & R Lay Out , Behind Brooke Bond Road, R S Puram, Coimbatore, Tamil Nadu, 641003",639.0,641003.0,11.0018115,76.9628425,0,,
24315,Joseph Hospital,"10, 10Th Cross, Thirumagal Nagar Peelamedu Pudur, Coimbatore, Tamil Nadu, 641004",639.0,641004.0,11.0018115,76.9628425,0,,
24316,Psg Hospital,"P.O. Box. No.1674,Peelamedu,Near Psg College Of Technology, Coimbatore, Tamil Nadu, 641004",639.0,641004.0,11.0018115,76.9628425,0,,
24317,Raajah Hospitals,"60,Gandhi Street,B.R.Puram, Coimbatore, Tamil Nadu, 641004",639.0,641004.0,11.0018115,76.9628425,0,,
24318,Sumith Hospital,"Balan Nagar, Peelamedu, Coimbatore, Tamil Nadu, 641004",639.0,641004.0,11.0018115,76.9628425,0,,
24319,Ar Medical Centre,"#23, Vivekananda Nagar, Singanallur, Coimbatore, Tamil Nadu, 641005",639.0,641005.0,11.0018115,76.9628425,0,,
24320,Coimbatore Child Trust Hospital Pvt.Ltd.,"111, Nanjappa Nagar, Trichy Road,Singanallur Road,Petrol Bunk, Coimbatore, Tamil Nadu, 641005",639.0,641005.0,11.0018115,76.9628425,0,,
24321,N G Hospital Pvt Ltd,"1041,Trichy Road, Singanallur, Coimbatore, Tamil Nadu, 641005",639.0,641005.0,11.0018115,76.9628425,0,,
24322,Ortho One Orthopaedic Speciality Center(A Unit Of Spine Arthroscopic and Joint Replacement Center Pvt Ltd),"657, Trichy Road, Singanallur,  Opp To Andal Kalyana Mandapam, Coimbatore, Tamil Nadu, 641005",639.0,641005.0,11.0018115,76.9628425,0,,
24323,Shri Ram Polyclinic,"206, 206/1, Trichy Road, Singanallur, Coimbatore, Tamil Nadu, 641005",639.0,641005.0,11.0018115,76.9628425,0,,
24324,Spine Arthroscopic And Joint Replacement Centre Pv,"657, Trichy Road, Singanallur, Coimbatore, Tamil Nadu, 641005",639.0,641005.0,11.0018115,76.9628425,0,,
24325,Vgm Hospital,"2100,Trichy Road, Rajalakshmi Mills Stop, Coimbatore, Tamil Nadu, 641005",639.0,641005.0,11.0018115,76.9628425,0,,
24326,Kovai Ent Hospital and Research Centre,"Sathy Main Road, (Near Bsnal Exchange)Ganapathy, Coimbatore, Tamil Nadu, 641006",639.0,641006.0,11.0018115,76.9628425,0,,
24327,Paari Nursing Home,"Sathy Road,Ganapathy, Coimbatore, Tamil Nadu, 641006",639.0,641006.0,11.0018115,76.9628425,0,,
24328,"Shree Sivaa Hospital Pvt Ltd ,","Athipalayam Junction Sathy Main Road, Ganapathy, Coimbatore, Tamil Nadu, 641006",639.0,641006.0,11.0018115,76.9628425,0,,
24329,Sri Shakthy Hospital,"No. 1, Nehru Nagar, Police Quarters Road, Bharathi Nagar, Ganapathy, Coimbatore, Tamil Nadu, 641006",639.0,641006.0,11.0018115,76.9628425,0,,
24330,Ponnammal Duraisamy Eye Clinic,"90,Vivekananda Road,Senguptha Steet Junction,Ram Nagar, Coimbatore, Tamil Nadu, 641007",639.0,641007.0,11.0018115,76.9628425,0,,
24331,Sundareswaran Eye Foundation,"178,Sarojini Street,Ramnagar,Coimbatore, Coimbatore, Tamil Nadu, 641007",639.0,641007.0,11.0018115,76.9628425,0,,
24332,Aparna Hospital,"450-D, Palaghat Main Road, Kuniamuthur, Coimbatore, Tamil Nadu, 641008",639.0,641008.0,11.0018115,76.9628425,0,,
24333,Gowtham Hospital,"414/1- Palakad Main Road, Coimbatore, Tamil Nadu, 641008",639.0,641008.0,11.0018115,76.9628425,0,,
24334,K. J. Hospital,"56-A, Palaghat Main Road, Kuniyamuthur Post, Coimbatore, Tamil Nadu, 641008",639.0,641008.0,11.0018115,76.9628425,0,,
24335,Lotus Eye Care Hospital Ltd,"No. 155-B, East Periyasamy Road,Near Chinthamani,North Coimbatore,R. S. Puram, Coimbatore, Tamil Nadu, 641008",639.0,641008.0,11.0018115,76.9628425,0,,
24336,Mallika Nursing Home,"# 25, Rajagopal Nagar, Kuniamuthur, Opposite Kaveriammal Kalyana Mandapam, Coimbatore, Tamil Nadu, 641008",639.0,641008.0,11.0018115,76.9628425,0,,
24337,Sangeetha Hospital,"5/402-H,Kuniamuthur, Coimbatore, Tamil Nadu, 641008",639.0,641008.0,11.0018115,76.9628425,0,,
24338,Vasan Eye Care Hospital,"No 450-D, Palakkad Main Road, Kuniamuthoor Kuniamuthoor, Coimbatore, Tamil Nadu, 641008",639.0,641008.0,11.0018115,76.9628425,0,,
24339,Akilesh Orthopaedics Hospital,"95-97, Sastri Road, Ramnagar, Coimbatore, Tamil Nadu, 641009",639.0,641009.0,11.0018115,76.9628425,0,,
24340,"Ganga Medical Centre and Hospitals Pvt. Ltd ,Ramnagar","# 2 Swarnambika Lay-Out,Ramnagar, Coimbatore, Tamil Nadu, 641009",639.0,641009.0,11.0018115,76.9628425,0,,
24341,Kovai Diabetes Speciality Center and Hospital,"15, Vivekanand Road, Ramnagar, Coimbatore, Tamil Nadu, 641009",639.0,641009.0,11.0018115,76.9628425,0,,
24342,M. V. Eye Care Centre,"No. 10, Kalidas Road, Ram Nagar, Coimbatore, Tamil Nadu, 641009",639.0,641009.0,11.0018115,76.9628425,0,,
24343,Medindia Hospitals,"No. 96, Vivekananda Road, Ramnagar, Coimbatore, Tamil Nadu, 641009",639.0,641009.0,11.0018115,76.9628425,0,,
24344,S.G. Rajarathinam Nursing Home,"# 99, Vivekanada Road,Ramnagar, Coimbatore, Tamil Nadu, 641009",639.0,641009.0,11.0018115,76.9628425,0,,
24345,Spt Hospitals,"50,Vivekanandha Road,Rama Nagar, , Opposite Meena Eye Hospital, Coimbatore, Tamil Nadu, 641009",639.0,641009.0,11.0018115,76.9628425,0,,
24346,Sri Meru Nursing Home,"123, Sashtri Road, Ram Nagar, Coimbatore, Tamil Nadu, 641009",639.0,641009.0,11.0018115,76.9628425,0,,
24347,K T V R Groop Hospital,"P.B.No -2750, Narayana Guru Hospital Road Sai Baba Colony, Coimbatore, Tamil Nadu, 641011",639.0,641011.0,11.0018115,76.9628425,0,,
24348,Shri Hari Hospital,"80 N S R Road Saibaba Cilony, Coimbatore, Tamil Nadu, 641011",639.0,641011.0,11.0018115,76.9628425,0,,
24349,Vishnu Ent Hospital - Coimbatore,"109, N.S.R. Road, Near Pullamaram Bus Stop Sai Baba Colony, Coimbatore, Tamil Nadu, 641011",639.0,641011.0,11.0018115,76.9628425,0,,
24350,Ashwin Hospital,"1, Alamu Nagar Sathy Road, Coimbatore, Tamil Nadu, 641012",639.0,641012.0,11.0018115,76.9628425,0,,
24351,Bethel Hospital Pvt. Ltd. - Coimbatore,"223, Dr. Rajendra Prasad Road (100 Feet Road), Gandhipuram, Coimbatore, Tamil Nadu, 641012",639.0,641012.0,11.0018115,76.9628425,0,,
24352,Csr Nursing Home,"272, 7Th Street Extn Gandhipuram, Coimbatore, Tamil Nadu, 641012",639.0,641012.0,11.0018115,76.9628425,0,,
24353,Dr. Sengottayan Hospital,"454,Dr. Radhakrishna Road,Tatabad, Coimbatore, Tamil Nadu, 641012",639.0,641012.0,11.0018115,76.9628425,0,,
24354,Ellen Hospital,"# 284, Sathy Road, Gandhipuram, Coimbatore, Tamil Nadu, 641012",639.0,641012.0,11.0018115,76.9628425,0,,
24355,Kongunad Hospitals Private Limited,"# 79, 11Th Street, Tatabad, Coimbatore, Tamil Nadu, 641012",639.0,641012.0,11.0018115,76.9628425,0,,
24356,Lalithaa Hospital,"828-A Cross Cut Road Power House Gandhipuram, Coimbatore, Tamil Nadu, 641012",639.0,641012.0,11.0018115,76.9628425,0,,
24357,S K Medical Centre,"20, Saravana Street Udumalpet, Coimbatore, Tamil Nadu, 641012",639.0,641012.0,11.0018115,76.9628425,0,,
24358,Sathya Medical Centre,"12 B & 12 G, West Power House Road, Coimbatore, Tamil Nadu, 641012",639.0,641012.0,11.0018115,76.9628425,0,,
24359,Sheela Clinic,"46 East Power House Road Coimbatore, Coimbatore, Tamil Nadu, 641012",639.0,641012.0,11.0018115,76.9628425,0,,
24360,The Balakrishnan Hospital,"#205 100 Feet Road Tatabad, Coimbatore, Tamil Nadu, 641012",639.0,641012.0,11.0018115,76.9628425,0,,
24361,Arqvind Eye Hospital,"Postgraduate Institute Of Ophthalmology,Avinashi Road, Coimbatore, Tamil Nadu, 641014",639.0,641014.0,11.0018115,76.9628425,0,,
24362,Bhanmuhasvndaram Memorial Ent Clinic,"457 A Near N M & Co, Coimbatore, Tamil Nadu, 641014",639.0,641014.0,11.0018115,76.9628425,0,,
24363,Kovai Medical Center and Hospital,"Post Box No 3209,Avanashi Road, Coimbatore, Tamil Nadu, 641014",639.0,641014.0,11.0018115,76.9628425,0,,
24364,Lotus Eye Care Hospital Ltd,"No. 770/12, Avanashi Road,Civil Aerodrome Post, Coimbatore, Tamil Nadu, 641014",639.0,641014.0,11.0018115,76.9628425,0,,
24365,Park Hospital,"Kalapatti Main Road Near Sitra Civil Aerodrome Post, Coimbatore, Tamil Nadu, 641014",639.0,641014.0,11.0018115,76.9628425,0,,
24366,Priya Hospital,"U 80, Kovaipudur, Coimbatore, Tamil Nadu, 641014",639.0,641014.0,11.0018115,76.9628425,0,,
24367,St Lukes Hospital,"18-G, Ashok Layout, Civil Aerodrome Road, Coimbatore, Tamil Nadu, 641014",639.0,641014.0,11.0018115,76.9628425,0,,
24368,Ramvel Hospital,"13/1, Bharathi Nagar, Kamarajar Road, Uppilipalayam Post, Coimbatore, Tamil Nadu, 641015",639.0,641015.0,11.0018115,76.9628425,0,,
24369,Sri Maruthi Medical Center and Hospital,"3/3318, Mtp Road, K.Vadamadurai, Coimbatore, Tamil Nadu, 641017",639.0,641017.0,11.0018115,76.9628425,0,,
24370,Arunn Surgery,"Dr.Nanjappa Road, Coimbatore, Tamil Nadu, 641018",639.0,641018.0,11.0018115,76.9628425,0,,
24371,Dr N S Palaniappan Nursing Home,"373 , Dr Nanjappa Road, Coimbatore, Tamil Nadu, 641018",639.0,641018.0,11.0018115,76.9628425,0,,
24372,K.Govind Swamy Naidu Medical Trust,"Kg Hospital,No:5, GovernmentArts College Road, Coimbatore, Tamil Nadu, 641018",639.0,641018.0,11.0018115,76.9628425,0,,
24373,Madurai Eye Center,"137 East Periasamy Road, R.S. Puram, Coimbatore, Tamil Nadu, 641018",639.0,641018.0,11.0018115,76.9628425,0,,
24374,Masonic Medical Centre For Children,"232, Race Course Coimatore, Coimbatore, Tamil Nadu, 641018",639.0,641018.0,11.0018115,76.9628425,0,,
24375,Richmond Hospital,"No.1287, Trichy Road, Opposite Icici Bank, Coimbatore, Tamil Nadu, 641018",639.0,641018.0,11.0018115,76.9628425,0,,
24376,Sakthi Nursing Home,"172, Dr Nanjappa Road Coimbatore, Coimbatore, Tamil Nadu, 641018",639.0,641018.0,11.0018115,76.9628425,0,,
24377,Sri Rani Poly Clinic,"1,2, Sundaresa Lay-Out,Trichy Road, Coimbatore, Tamil Nadu, 641018",639.0,641018.0,11.0018115,76.9628425,0,,
24378,Rajam Medical Centre And Hospital (P) Ltd.,"#190,191, Pollachi Road, Near Lic Colony,Industrial Estate Post, Coimbatore, Tamil Nadu, 641021",639.0,641021.0,11.0018115,76.9628425,0,,
24379,Sree Ramm Nursing Home,"5/33, Nggo Colony Mettupalayam Road, Coimbatore, Tamil Nadu, 641022",639.0,641022.0,11.0018115,76.9628425,0,,
24380,Srinivasan V R Nursing Home,"5/33, N.G.G.O. Colony, Coimbatore, Tamil Nadu, 641022",639.0,641022.0,11.0018115,76.9628425,0,,
24381,S. M. Clinic,"74, Chettipalayam Road, Podanur, Coimbatore, Tamil Nadu, 641023",639.0,641023.0,11.0018115,76.9628425,0,,
24382,St MaryS Hospital,"Church Road Podanur Podanur, Coimbatore, Tamil Nadu, 641023",639.0,641023.0,11.0018115,76.9628425,0,,
24383,Abinand Hospital,"# 237, Pollachi Main Road, Sundarapuram, Coimbatore, Tamil Nadu, 641024",639.0,641024.0,11.0018115,76.9628425,0,,
24384,Koushikha Hospital,"135-A Saradha Mill Road Sundarapuram, Coimbatore, Tamil Nadu, 641024",639.0,641024.0,11.0018115,76.9628425,0,,
24385,Nrp Hospitals,"Lic Agent Colony, Sundarapuram, Coimbatore, Tamil Nadu, 641024",639.0,641024.0,11.0018115,76.9628425,0,,
24386,Sree Abhirami Hospitals (P) Limited,"33, Madukkarai Road Sundarapuram, Coimbatore, Tamil Nadu, 641024",639.0,641024.0,11.0018115,76.9628425,0,,
24387,Sree Resmika Hospital,"193/145, Pollachi Main Road,Sundarapuram, Coimbatore, Tamil Nadu, 641024",639.0,641024.0,11.0018115,76.9628425,0,,
24388,Sri Balaji Hospitals,"# 314, Pollachi Main Road, Sundarapuram, Coimbatore, Tamil Nadu, 641024",639.0,641024.0,11.0018115,76.9628425,0,,
24389,Durga Hospital,"S.F. No:15, Abbas Garden, Dr. M.S. Udaya Murthi Nagar,Thandagam Road, Coimbatore, Tamil Nadu, 641025",639.0,641025.0,11.0018115,76.9628425,0,,
24390,Joseph Memorial Hospital,"Thadegam Road,Edayapalayam, Coimbatore, Tamil Nadu, 641025",639.0,641025.0,11.0018115,76.9628425,0,,
24391,Kalpana Medical Center Pvt Ltd,"Mettupalayam Road Opp To Nithya Enclave, Coimbatore, Tamil Nadu, 641025",639.0,641025.0,11.0018115,76.9628425,0,,
24392,Kiruba Hospital,"13/82, Thadagam Road, Kovil Medu Pirivu, Coimbatore, Tamil Nadu, 641025",639.0,641025.0,11.0018115,76.9628425,0,,
24393,N.R.P Hospital,"Sundarpuram (P.O), Coimbatore, Tamil Nadu, 641025",639.0,641025.0,11.0018115,76.9628425,0,,
24394,Ranga Hospital,"1638, Thadagam Road, Velandipalayam, Coimbatore, Tamil Nadu, 641025",639.0,641025.0,11.0018115,76.9628425,0,,
24395,Sree Abishek Hospitals,"Plot No 1, Raju Garden, Thadagam Road, T V S Nagar, Edayarpalayam Post, Coimbatore, Tamil Nadu, 641025",639.0,641025.0,11.0018115,76.9628425,0,,
24396,Sri Vishnu Priyaa Hospitals Pvt Ltd,"16, Shivaji Colony Edayarpalyam, Coimbatore, Tamil Nadu, 641025",639.0,641025.0,11.0018115,76.9628425,0,,
24397,Snekaram Nursing Home,"5-1, Venkateshwara Layout, Lic-Colony, Selvapuram, Coimbatore, Tamil Nadu, 641026",639.0,641026.0,11.0018115,76.9628425,0,,
24398,Sri Lakshmi Hospital,"A Unit 07, S L Hospital (P) Ltd. 61, Pongiammal St, Ratinapuri, Coimbatore, Tamil Nadu, 641027",639.0,641027.0,11.0018115,76.9628425,0,,
24399,Anurag Hospital,"8, Krishna Nagar,Sowripalayam Main Road,Sowripalayam, Coimbatore, Tamil Nadu, 641028",639.0,641028.0,11.0018115,76.9628425,0,,
24400,G R Hospital,"30, Ram Gardens, Sowripalayam Road Udayampalayam, Coimbatore, Tamil Nadu, 641028",639.0,641028.0,11.0018115,76.9628425,0,,
24401,Kurinji Hospital,"S F No 522/3, Udayampalayam Road, Nava India, Hindustan College Road, Coimbatore, Tamil Nadu, 641028",639.0,641028.0,11.0018115,76.9628425,0,,
24402,Roselet Medical ObgandSurgical Centre,"263, Annamalai Nagar,Sowripalayam, Coimbatore, Tamil Nadu, 641028",639.0,641028.0,11.0018115,76.9628425,0,,
24403,Shanmugapriya Nursing Home,"No. 5, Grg Nagar, Gowripalyam, Coimbatore, Tamil Nadu, 641028",639.0,641028.0,11.0018115,76.9628425,0,,
24404,Swathi Poly Clinic,"1, Karthik Nagar, Sowripalayam Road, Coimbatore, Tamil Nadu, 641028",639.0,641028.0,11.0018115,76.9628425,0,,
24405,Parthiban Nursing Home,"11-H, S.M. Palayam Road, G.N. Mills (Po), Coimbatore, Tamil Nadu, 641029",639.0,641029.0,11.0018115,76.9628425,0,,
24406,Dr K Padmavathy Hospital,"5/25, Mattupalyam Road, Kavundampalyam, Coimbatore, Tamil Nadu, 641030",639.0,641030.0,11.0018115,76.9628425,0,,
24407,H. S. Hospital,"Gandhi Nagar, Kavundampalayam, Coimbatore, Tamil Nadu, 641030",639.0,641030.0,11.0018115,76.9628425,0,,
24408,Padmavathy Hospital,"5 / 25, M T P Road, Kavundampalayam, Coimbatore, Tamil Nadu, 641030",639.0,641030.0,11.0018115,76.9628425,0,,
24409,Sri Kumar Hospital,"5/19F, Peons Colony Mtp Road, Koundam Palayam Cockarko Behind Near Canara Bank, Coimbatore, Tamil Nadu, 641030",639.0,641030.0,11.0018115,76.9628425,0,,
24410,Sri Guru Hospital Pvt Ltd,"129, Narasimhanaicken Palayam, Coimbatore, Tamil Nadu, 641031",639.0,641031.0,11.0018115,76.9628425,0,,
24411,Sri Thangamanian Medical Centre,"177, Neelikonampalayam, Coimbatore, Tamil Nadu, 641033",639.0,641033.0,11.0018115,76.9628425,0,,
24412,Sri Lakshmi Medical Center and Hospital,"18/121, Mettupalayam Road, Behind Indian Bank, Thudiyalur, Coimbatore, Tamil Nadu, 641034",639.0,641034.0,11.0018115,76.9628425,0,,
24413,V. G. Hospital,"76A, M.T.P. Road, Coimbatore, Tamil Nadu, 641034",639.0,641034.0,11.0018115,76.9628425,0,,
24414,Vasan Eye Care Hospital,"Nanjammas Building 1/80-1, Metupallayam Road, Thudiyalur, Coimbatore, Tamil Nadu, 641034",639.0,641034.0,11.0018115,76.9628425,0,,
24415,Sankara Eye Centre,"Sathy Road Sivanandapuram, Coimbatore, Tamil Nadu, 641035",639.0,641035.0,11.0018115,76.9628425,0,,
24416,Sree Andal Hospital,"No. 39, Bharathi Nagar, Cheran Maanagar, Vilankuruchi Post, Coimbatore, Tamil Nadu, 641035",639.0,641035.0,11.0018115,76.9628425,0,,
24417,Sri Kanchi Kamakoti Medical Trust Sankara Eye Cent,"Sivanandapuram, Coimbatore, Tamil Nadu, 641035",639.0,641035.0,11.0018115,76.9628425,0,,
24418,Sree Lavnya Hospital,"5, Marudhamalai Road Kongu Nagar, Kalveerampalayam Bharathiar Uriversity, Coimbatore, Tamil Nadu, 641036",639.0,641036.0,11.0018115,76.9628425,0,,
24419,G. Kuppuswamy Naidu Memorial Hospital,"Post Box No. 6327, Pappanaichenpalayam, Coimbatore, Tamil Nadu, 641037",639.0,641037.0,11.0018115,76.9628425,0,,
24420,Vasan Eye Care Hospital,"No 777, Puliyakulam Road, Laxmi Mills Jn, P N Palayam, Coimbatore, Tamil Nadu, 641037",639.0,641037.0,11.0018115,76.9628425,0,,
24421,Dr. M . Ilangovan Ent Clinic and Paavai Hospital,"3, Chinnammal Street , Sai Baba Colony , K K Pudur Post, Coimbatore, Tamil Nadu, 641038",639.0,641038.0,11.0018115,76.9628425,0,,
24422,Siloam Thomas Eye Hospital,"Old No: 3, New No: 15 Chinnammal Street, Kk Pudur, Coimbatore, Tamil Nadu, 641038",639.0,641038.0,11.0018115,76.9628425,0,,
24423,Sri Guru Hospital Pvt Ltd,"No-1, Co-Op. 'A' Colony, K.K. Pudur S.B. Colony, Coimbatore, Tamil Nadu, 641038",639.0,641038.0,11.0018115,76.9628425,0,,
24424,Mowthi Nursing Home,"Alamaram Bus Stop Vadavalli, Coimbatore, Tamil Nadu, 641041",639.0,641041.0,11.0018115,76.9628425,0,,
24425,Vallar Hospitals (Pvt) Ltd,"285-A Marudhamalai Main Rod , Mullai Nagar, Coimbatore, Tamil Nadu, 641041",639.0,641041.0,11.0018115,76.9628425,0,,
24426,Aroghya Nursing Home,"No:11/8, Selvam Nagar, Vadavalli, Coimbatore, Tamil Nadu, 641043",639.0,641043.0,11.0018115,76.9628425,0,,
24427,Womens Center And Hospital(P)Limited,"1-5,Chairman Raju Nagar,Mettupalayam Road, Coimbatore, Tamil Nadu, 641043",639.0,641043.0,11.0018115,76.9628425,0,,
24428,Iswarya Fertility Test Tube Baby and Research Center,"No. 238, Avarampalayam Road, Near Womens Poly Technic, Gandhipuram, Coimbatore, Tamil Nadu, 641044",639.0,641044.0,11.0018115,76.9628425,0,,
24429,Nandha Hospital,"41,Bharathiyur Road,New Siddhapudur,Coimbatore, Coimbatore, Tamil Nadu, 641044",639.0,641044.0,11.0018115,76.9628425,0,,
